Sheet: Yearly
A1: Year | B1: Demographic limits | M1: Sales and Inheritances | R1: Mortgages and interest rates | AE1: Wage | AJ1: Land | AL1: Building permits | AP1: Houses by type and cost of building | BC1: Stock and cement | BJ1: Buyers | BN1: Tenure | BV1: Rent (source: idealista) | CC1: Multivariate model | CR1: Rainbow model
A2: Data | B2: Total Population | C2: Population (25-50) | D2: Upper limit | E2: Lower limit | F2: Optimal | G2: Age 30 | H2: Age 30/2 | I2: Age 40 | J2: Age 40/2 | K2: Age 50 | L2: Age 50/2 | M2: Home sales | N2: Inheritances | O2: Donations | P2: Swaps | Q2: Others | R2: Approved | S2: Releases | T2: Total amount | U2: Average amount | V2: Creditor subrogation | W2: Consumer subrogation | X2: Ratio M/S | Y2: Credit cycle | Z2: Euribor 1-year | AA2: Average mortgage rate | AB2: Fixed mortgages | AC2: Variable mortgages | AD2: Years mortgage | AE2: Disposable income | AF2: Years to fully pay | AG2: Ideal wage | AH2: W/M disconnect | AI2: Minimum wage | AJ2: Price of urban land | AK2: Tx of land | AL2: Building permits | AM2: Build | AN2: Reform | AO2: Demolish | AP2: Single family | AQ2: Single family m2 | AR2: SF cost (PEM) | AS2: SF Average cost | AT2: SF cost per m2 | AU2: Condominiums | AV2: Condos m2 | AW2: Condo cost | AX2: Condo Av. Cost | AY2: Condos cost per m2 | AZ2: Ratio price/cost | BA2: % cost production | BB2: Cost Edification | BC2: Total homes | BD2: New homes | BE2: Homes per 1000 | BF2: (%)New homes | BG2: % Pop. | BH2: Balance | BI2: Cement (mT) | BJ2: Legal entity | BK2: Nationals | BL2: Foreigners | BM2: Foreigner (raw) | BN2: Owned | BO2: Mortgaged | BP2: Rented | BQ2: Freely loaned | BR2: Owned (%) | BS2: Mortgaged (%) | BT2: Rented (%) | BU2: Freely loaned (%) | BV2: Rent price (e/m2) | BW2: Price % | BX2: Rent ROI Gross | BY2: Rent ROI Gross % | BZ2: Rent ROI Net | CA2: Rent ROI Net % | CB2: Idealista price(m2) | CC2: Price (e/m2) | CD2: Inflation CPI | CE2: CPI 1985 | CF2: Overrated inflation | CG2: Real over. | CH2: Real price | CI2: Accum. Infl. | CJ2: Real HPI | CK2: Nominal price (%) | CL2: (%)Real price | CM2: Pop.(%) | CN2: Sales(%) | CO2: Credit (%) | CP2: Unemployment(%) | CQ2: Net ROI (%) | CR2: Rainbow curve | CS2: EP+50 | CT2: EP-50 | CU2: EP+100 | CV2: EP-100 | CW2: Alt. Rainbow
A3: 1964 | B3: 31723000 | C3: =R[1]C*RC[-1]/R[1]C[-1] -> 10721598.911503393 | D3: =RC[-1]/26 -> 412369.18890397664 | E3: =RC[-1]/2 -> 206184.59445198832 | F3: =RC[-1]*1.5 -> 309276.89167798246 | BI3: 9917.2000000000007 | CD3: 6.95 | CG3: =RC[-24]/88 -> 112.69545454545455 | CH3: 112.69545454545455 | CR3: =-0.06*((RC[-95]-1963)^2)+8.5*(RC[-95]-1963)+140 -> 148.44 | CS3: =RC[-1]+50 -> 198.44 | CT3: =RC[-2]-50 -> 98.44 | CU3: =RC[-3]+100 -> 248.44 | CV3: =RC[-4]-100 -> 48.44 | CW3: =-0.025*((RC[-100]-1963)^2)+5.5*(RC[-100]-1963)+175 -> 180.47499999999999
A4: 1965 | B4: 32056000 | C4: =R[1]C*RC[-1]/R[1]C[-1] -> 10834144.775309799 | D4: =RC[-1]/26 -> 416697.8759734538 | E4: =RC[-1]/2 -> 208348.9379867269 | F4: =RC[-1]*1.5 -> 312523.40698009037 | BI4: 11388.9 | CD4: 13.32 | CG4: =RC[-24]/88 -> 129.41931818181817 | CH4: 129.41931818181817 | CR4: =-0.06*((RC[-95]-1963)^2)+8.5*(RC[-95]-1963)+140 -> 156.76 | CS4: =RC[-1]+50 -> 206.76 | CT4: =RC[-2]-50 -> 106.75999999999999 | CU4: =RC[-3]+100 -> 256.76 | CV4: =RC[-4]-100 -> 56.759999999999991 | CW4: =-0.025*((RC[-100]-1963)^2)+5.5*(RC[-100]-1963)+175 -> 185.9
A5: 1966 | B5: 32394000 | C5: =R[1]C*RC[-1]/R[1]C[-1] -> 10948380.516951136 | D5: =RC[-1]/26 -> 421091.55834427447 | E5: =RC[-1]/2 -> 210545.77917213723 | F5: =RC[-1]*1.5 -> 315818.66875820584 | BI5: 13053.4 | CD5: 6.25 | CG5: =RC[-24]/88 -> 148.33409090909092 | CH5: 148.33409090909092 | CR5: =-0.06*((RC[-95]-1963)^2)+8.5*(RC[-95]-1963)+140 -> 164.96 | CS5: =RC[-1]+50 -> 214.96 | CT5: =RC[-2]-50 -> 114.96000000000001 | CU5: =RC[-3]+100 -> 264.96000000000004 | CV5: =RC[-4]-100 -> 64.960000000000008 | CW5: =-0.025*((RC[-100]-1963)^2)+5.5*(RC[-100]-1963)+175 -> 191.27500000000001
A6: 1967 | B6: 32734000 | C6: =R[1]C*RC[-1]/R[1]C[-1] -> 11063292.209726445 | D6: =RC[-1]/26 -> 425511.23883563251 | E6: =RC[-1]/2 -> 212755.61941781626 | F6: =RC[-1]*1.5 -> 319133.42912672437 | BI6: 14071.399999999996 | CD6: 6.39 | CG6: =RC[-24]/88 -> 159.90227272727267 | CH6: 159.90227272727267 | CR6: =-0.06*((RC[-95]-1963)^2)+8.5*(RC[-95]-1963)+140 -> 173.04 | CS6: =RC[-1]+50 -> 223.04 | CT6: =RC[-2]-50 -> 123.03999999999999 | CU6: =RC[-3]+100 -> 273.03999999999996 | CV6: =RC[-4]-100 -> 73.039999999999992 | CW6: =-0.025*((RC[-100]-1963)^2)+5.5*(RC[-100]-1963)+175 -> 196.6
A7: 1968 | B7: 33079000 | C7: =R[1]C*RC[-1]/R[1]C[-1] -> 11179893.780336685 | D7: =RC[-1]/26 -> 429995.91462833405 | E7: =RC[-1]/2 -> 214997.95731416703 | F7: =RC[-1]*1.5 -> 322496.93597125052 | BI7: 15284.300000000001 | CD7: 4.9800000000000004 | CG7: =RC[-24]/76 -> 201.10921052631579 | CH7: 201.10921052631579 | CR7: =-0.06*((RC[-95]-1963)^2)+8.5*(RC[-95]-1963)+140 -> 181 | CS7: =RC[-1]+50 -> 231 | CT7: =RC[-2]-50 -> 131 | CU7: =RC[-3]+100 -> 281 | CV7: =RC[-4]-100 -> 81 | CW7: =-0.025*((RC[-100]-1963)^2)+5.5*(RC[-100]-1963)+175 -> 201.875
A8: 1969 | B8: 33427000 | C8: =R[1]C*RC[-1]/R[1]C[-1] -> 11297509.277647885 | D8: =RC[-1]/26 -> 434519.58760184172 | E8: =RC[-1]/2 -> 217259.79380092086 | F8: =RC[-1]*1.5 -> 325889.6907013813 | BI8: 16222.3 | CD8: 2.16 | CG8: =RC[-24]/76 -> 213.45131578947368 | CH8: 213.45131578947368 | CR8: =-0.06*((RC[-95]-1963)^2)+8.5*(RC[-95]-1963)+140 -> 188.84 | CS8: =RC[-1]+50 -> 238.84 | CT8: =RC[-2]-50 -> 138.84 | CU8: =RC[-3]+100 -> 288.84000000000003 | CV8: =RC[-4]-100 -> 88.84 | CW8: =-0.025*((RC[-100]-1963)^2)+5.5*(RC[-100]-1963)+175 -> 207.1
A9: 1970 | B9: 33779000 | C9: =R[1]C*RC[-1]/R[1]C[-1] -> 11416476.677227028 | D9: =RC[-1]/26 -> 439095.25681642414 | E9: =RC[-1]/2 -> 219547.62840821207 | F9: =RC[-1]*1.5 -> 329321.44261231809 | BC9: 10658882 | BI9: 16573.400000000001 | CD9: 5.72 | CG9: =RC[-24]/71 -> 233.42816901408452 | CH9: 233.42816901408452 | CR9: =-0.06*((RC[-95]-1963)^2)+8.5*(RC[-95]-1963)+140 -> 196.56 | CS9: =RC[-1]+50 -> 246.56 | CT9: =RC[-2]-50 -> 146.56 | CU9: =RC[-3]+100 -> 296.56 | CV9: =RC[-4]-100 -> 96.56 | CW9: =-0.025*((RC[-100]-1963)^2)+5.5*(RC[-100]-1963)+175 -> 212.27500000000001
A10: 1971 | B10: 34216000 | C10: 11564172 | D10: =RC[-1]/26 -> 444775.84615384613 | E10: =RC[-1]/2 -> 222387.92307692306 | F10: =RC[-1]*1.5 -> 333581.88461538462 | BC10: 11042601.752 | BD10: =RC[-1]-R[-1]C[-1] -> 383719.75200000033 | BE10: =(RC[-2]/(RC[-55]))*1000 -> 322.73210638297871 | BF10: =(RC[-3]*100/R[-1]C[-3])-100 -> 3.6000000000000085 | BG10: =(RC[-57]*100/R[-1]C[-57])-100 -> 1.2937031883714667 | BH10: =RC[-2]-RC[-1] -> 2.3062968116285418 | BI10: 16604.8 | CD10: 8.24 | CG10: =RC[-24]/69 -> 240.64927536231883 | CH10: 240.649275362319 | CR10: =-0.06*((RC[-95]-1963)^2)+8.5*(RC[-95]-1963)+140 -> 204.16 | CS10: =RC[-1]+50 -> 254.16 | CT10: =RC[-2]-50 -> 154.16 | CU10: =RC[-3]+100 -> 304.15999999999997 | CV10: =RC[-4]-100 -> 104.16 | CW10: =-0.025*((RC[-100]-1963)^2)+5.5*(RC[-100]-1963)+175 -> 217.4
A11: 1972 | B11: 34572000 | C11: 11620299 | D11: =RC[-1]/26 -> 446934.57692307694 | E11: =RC[-1]/2 -> 223467.28846153847 | F11: =RC[-1]*1.5 -> 335200.93269230769 | BC11: 11462220.618576001 | BD11: =RC[-1]-R[-1]C[-1] -> 419618.86657600105 | BE11: =(RC[-2]/(RC[-55]))*1000 -> 331.54635596945508 | BF11: =(RC[-3]*100/R[-1]C[-3])-100 -> 3.8000000000000114 | BG11: =(RC[-57]*100/R[-1]C[-57])-100 -> 1.0404489127893441 | BH11: =RC[-2]-RC[-1] -> 2.7595510872106672 | BI11: 18872.100000000002 | CD11: 8.27 | CG11: =RC[-24]/69 -> 273.50869565217397 | CH11: 273.50869565217397 | CR11: =-0.06*((RC[-95]-1963)^2)+8.5*(RC[-95]-1963)+140 -> 211.64 | CS11: =RC[-1]+50 -> 261.64 | CT11: =RC[-2]-50 -> 161.63999999999999 | CU11: =RC[-3]+100 -> 311.64 | CV11: =RC[-4]-100 -> 111.63999999999999 | CW11: =-0.025*((RC[-100]-1963)^2)+5.5*(RC[-100]-1963)+175 -> 222.47499999999999
A12: 1973 | B12: 34921000 | C12: 11702665 | D12: =RC[-1]/26 -> 450102.5 | E12: =RC[-1]/2 -> 225051.25 | F12: =RC[-1]*1.5 -> 337576.875 | BC12: 11909247.222700465 | BD12: =RC[-1]-R[-1]C[-1] -> 447026.60412446409 | BE12: =(RC[-2]/(RC[-55]))*1000 -> 341.0339687494764 | BF12: =(RC[-3]*100/R[-1]C[-3])-100 -> 3.8999999999999915 | BG12: =(RC[-57]*100/R[-1]C[-57])-100 -> 1.0094874464884924 | BH12: =RC[-2]-RC[-1] -> 2.890512553511499 | BI12: 21606.800000000003 | CD12: 11.37 | CG12: =RC[-24]/69 -> 313.1420289855073 | CH12: 313.1420289855073 | CR12: =-0.06*((RC[-95]-1963)^2)+8.5*(RC[-95]-1963)+140 -> 219 | CS12: =RC[-1]+50 -> 269 | CT12: =RC[-2]-50 -> 169 | CU12: =RC[-3]+100 -> 319 | CV12: =RC[-4]-100 -> 119 | CW12: =-0.025*((RC[-100]-1963)^2)+5.5*(RC[-100]-1963)+175 -> 227.5
A13: 1974 | B13: 35288000 | C13: 11800401 | D13: =RC[-1]/26 -> 453861.57692307694 | E13: =RC[-1]/2 -> 226930.78846153847 | F13: =RC[-1]*1.5 -> 340396.18269230769 | BC13: 12326070.875494981 | BD13: =RC[-1]-R[-1]C[-1] -> 416823.65279451571 | BE13: =(RC[-2]/(RC[-55]))*1000 -> 349.29922000382516 | BF13: =(RC[-3]*100/R[-1]C[-3])-100 -> 3.4999999999999858 | BG13: =(RC[-57]*100/R[-1]C[-57])-100 -> 1.0509435583173428 | BH13: =RC[-2]-RC[-1] -> 2.449056441682643 | BI13: 22147.3 | CD13: 15.66 | CG13: =RC[-24]/69 -> 320.97536231884055 | CH13: 320.97536231884055 | CR13: =-0.06*((RC[-95]-1963)^2)+8.5*(RC[-95]-1963)+140 -> 226.24 | CS13: =RC[-1]+50 -> 276.24 | CT13: =RC[-2]-50 -> 176.24 | CU13: =RC[-3]+100 -> 326.24 | CV13: =RC[-4]-100 -> 126.24000000000001 | CW13: =-0.025*((RC[-100]-1963)^2)+5.5*(RC[-100]-1963)+175 -> 232.47499999999999
A14: 1975 | B14: 35688000 | C14: 11872022 | D14: =RC[-1]/26 -> 456616.23076923075 | E14: =RC[-1]/2 -> 228308.11538461538 | F14: =RC[-1]*1.5 -> 342462.17307692306 | BC14: 12695853.001759831 | BD14: =RC[-1]-R[-1]C[-1] -> 369782.12626484968 | BE14: =(RC[-2]/(RC[-55]))*1000 -> 355.74571289396522 | BF14: =(RC[-3]*100/R[-1]C[-3])-100 -> 3.0000000000000142 | BG14: =(RC[-57]*100/R[-1]C[-57])-100 -> 1.1335298118340518 | BH14: =RC[-2]-RC[-1] -> 1.8664701881659624 | BI14: 20849.3 | CD14: 17.02 | CG14: =RC[-24]/63 -> 330.94126984126984 | CH14: 330.94126984126984 | CR14: =-0.06*((RC[-95]-1963)^2)+8.5*(RC[-95]-1963)+140 -> 233.36 | CS14: =RC[-1]+50 -> 283.36 | CT14: =RC[-2]-50 -> 183.36 | CU14: =RC[-3]+100 -> 333.36 | CV14: =RC[-4]-100 -> 133.36000000000001 | CW14: =-0.025*((RC[-100]-1963)^2)+5.5*(RC[-100]-1963)+175 -> 237.4
A15: 1976 | B15: 36118000 | C15: 11926333 | D15: =RC[-1]/26 -> 458705.11538461538 | E15: =RC[-1]/2 -> 229352.55769230769 | F15: =RC[-1]*1.5 -> 344028.8365384615 | BC15: 13064032.738810865 | BD15: =RC[-1]-R[-1]C[-1] -> 368179.73705103435 | BE15: =(RC[-2]/(RC[-55]))*1000 -> 361.70421227119073 | BF15: =(RC[-3]*100/R[-1]C[-3])-100 -> 2.9000000000000057 | BG15: =(RC[-57]*100/R[-1]C[-57])-100 -> 1.2048867966823593 | BH15: =RC[-2]-RC[-1] -> 1.6951132033176464 | BI15: 21293 | CD15: 17.559999999999999 | CG15: =RC[-24]/66 -> 322.62121212121212 | CH15: 322.62121212121212 | CR15: =-0.06*((RC[-95]-1963)^2)+8.5*(RC[-95]-1963)+140 -> 240.36 | CS15: =RC[-1]+50 -> 290.36 | CT15: =RC[-2]-50 -> 190.36 | CU15: =RC[-3]+100 -> 340.36 | CV15: =RC[-4]-100 -> 140.36000000000001 | CW15: =-0.025*((RC[-100]-1963)^2)+5.5*(RC[-100]-1963)+175 -> 242.27500000000001
A16: 1977 | B16: 36564000 | C16: 11966578 | D16: =RC[-1]/26 -> 460253 | E16: =RC[-1]/2 -> 230126.5 | F16: =RC[-1]*1.5 -> 345189.75 | BC16: 13429825.65549757 | BD16: =RC[-1]-R[-1]C[-1] -> 365792.91668670438 | BE16: =(RC[-2]/(RC[-55]))*1000 -> 367.29640234923886 | BF16: =(RC[-3]*100/R[-1]C[-3])-100 -> 2.8000000000000114 | BG16: =(RC[-57]*100/R[-1]C[-57])-100 -> 1.234841353341821 | BH16: =RC[-2]-RC[-1] -> 1.5651586466581904 | BI16: 21710 | CD16: 24.44 | CG16: =RC[-24]/69 -> 314.63768115942031 | CH16: 314.63768115942031 | CR16: =-0.06*((RC[-95]-1963)^2)+8.5*(RC[-95]-1963)+140 -> 247.24 | CS16: =RC[-1]+50 -> 297.24 | CT16: =RC[-2]-50 -> 197.24 | CU16: =RC[-3]+100 -> 347.24 | CV16: =RC[-4]-100 -> 147.24 | CW16: =-0.025*((RC[-100]-1963)^2)+5.5*(RC[-100]-1963)+175 -> 247.1
A17: 1978 | B17: 36741000 | C17: 12024081 | D17: =RC[-1]/26 -> 462464.65384615387 | E17: =RC[-1]/2 -> 231232.32692307694 | F17: =RC[-1]*1.5 -> 346848.49038461538 | BC17: 13792430.948196003 | BD17: =RC[-1]-R[-1]C[-1] -> 362605.29269843362 | BE17: =(RC[-2]/(RC[-55]))*1000 -> 375.39617724601953 | BF17: =(RC[-3]*100/R[-1]C[-3])-100 -> 2.7000000000000028 | BG17: =(RC[-57]*100/R[-1]C[-57])-100 -> 0.48408270429931122 | BH17: =RC[-2]-RC[-1] -> 2.2159172957006916 | BI17: 22028 | CD17: 19.98 | CG17: =RC[-24]/76 -> 289.84210526315792 | CH17: 289.84210526315792 | CR17: =-0.06*((RC[-95]-1963)^2)+8.5*(RC[-95]-1963)+140 -> 254 | CS17: =RC[-1]+50 -> 304 | CT17: =RC[-2]-50 -> 204 | CU17: =RC[-3]+100 -> 354 | CV17: =RC[-4]-100 -> 154 | CW17: =-0.025*((RC[-100]-1963)^2)+5.5*(RC[-100]-1963)+175 -> 251.875
A18: 1979 | B18: 37289000 | C18: 12074990 | D18: =RC[-1]/26 -> 464422.69230769231 | E18: =RC[-1]/2 -> 232211.34615384616 | F18: =RC[-1]*1.5 -> 348317.01923076925 | BC18: 14137241.721900903 | BD18: =RC[-1]-R[-1]C[-1] -> 344810.77370489947 | BE18: =(RC[-2]/(RC[-55]))*1000 -> 379.12633006787263 | BF18: =(RC[-3]*100/R[-1]C[-3])-100 -> 2.4999999999999858 | BG18: =(RC[-57]*100/R[-1]C[-57])-100 -> 1.491521733213574 | BH18: =RC[-2]-RC[-1] -> 1.0084782667864118 | BI18: 20773 | CD18: 15.68 | CG18: =RC[-24]/76 -> 273.32894736842104 | CH18: 273.32894736842104 | CR18: =-0.06*((RC[-95]-1963)^2)+8.5*(RC[-95]-1963)+140 -> 260.64 | CS18: =RC[-1]+50 -> 310.64 | CT18: =RC[-2]-50 -> 210.64 | CU18: =RC[-3]+100 -> 360.64 | CV18: =RC[-4]-100 -> 160.63999999999999 | CW18: =-0.025*((RC[-100]-1963)^2)+5.5*(RC[-100]-1963)+175 -> 256.60000000000002
A19: 1980 | B19: 37527000 | C19: 12092821 | D19: =RC[-1]/26 -> 465108.5 | E19: =RC[-1]/2 -> 232554.25 | F19: =RC[-1]*1.5 -> 348831.375 | BC19: 14476535.523226524 | BD19: =RC[-1]-R[-1]C[-1] -> 339293.80132562108 | BE19: =(RC[-2]/(RC[-55]))*1000 -> 385.76319778363643 | BF19: =(RC[-3]*100/R[-1]C[-3])-100 -> 2.3999999999999915 | BG19: =(RC[-57]*100/R[-1]C[-57])-100 -> 0.6382579312934098 | BH19: =RC[-2]-RC[-1] -> 1.7617420687065817 | BI19: 19725 | CD19: 15.59 | CG19: =RC[-24]/76 -> 259.53947368421052 | CH19: 259.53947368421052 | CR19: =-0.06*((RC[-95]-1963)^2)+8.5*(RC[-95]-1963)+140 -> 267.15999999999997 | CS19: =RC[-1]+50 -> 317.15999999999997 | CT19: =RC[-2]-50 -> 217.15999999999997 | CU19: =RC[-3]+100 -> 367.15999999999997 | CV19: =RC[-4]-100 -> 167.15999999999997 | CW19: =-0.025*((RC[-100]-1963)^2)+5.5*(RC[-100]-1963)+175 -> 261.27499999999998
A20: 1981 | B20: 37741000 | C20: 12135566 | D20: =RC[-1]/26 -> 466752.53846153844 | E20: =RC[-1]/2 -> 233376.26923076922 | F20: =RC[-1]*1.5 -> 350064.40384615381 | BC20: 14726000 | BD20: =RC[-1]-R[-1]C[-1] -> 249464.47677347623 | BE20: =(RC[-2]/(RC[-55]))*1000 -> 390.18573964653825 | BF20: =(RC[-3]*100/R[-1]C[-3])-100 -> 1.7232332720299581 | BG20: =(RC[-57]*100/R[-1]C[-57])-100 -> 0.57025608228741476 | BH20: =RC[-2]-RC[-1] -> 1.1529771897425434 | BI20: 18487 | CD20: 14.56 | CG20: =RC[-24]/88 -> 210.07954545454547 | CH20: 210.07954545454547 | CR20: =-0.06*((RC[-95]-1963)^2)+8.5*(RC[-95]-1963)+140 -> 273.56 | CS20: =RC[-1]+50 -> 323.56 | CT20: =RC[-2]-50 -> 223.56 | CU20: =RC[-3]+100 -> 373.56 | CV20: =RC[-4]-100 -> 173.56 | CW20: =-0.025*((RC[-100]-1963)^2)+5.5*(RC[-100]-1963)+175 -> 265.89999999999998
A21: 1982 | B21: 37942000 | C21: 12166940 | D21: =RC[-1]/26 -> 467959.23076923075 | E21: =RC[-1]/2 -> 233979.61538461538 | F21: =RC[-1]*1.5 -> 350969.42307692306 | BC21: 14951835.891732119 | BD21: =RC[-1]-R[-1]C[-1] -> 225835.89173211902 | BE21: =(RC[-2]/(RC[-55]))*1000 -> 394.07084212039746 | BF21: =(RC[-3]*100/R[-1]C[-3])-100 -> 1.5335861179690227 | BG21: =(RC[-57]*100/R[-1]C[-57])-100 -> 0.53257730319811003 | BH21: =RC[-2]-RC[-1] -> 1.0010088147709126 | BI21: 18528 | CD21: 14.43 | CG21: =RC[-24]/88 -> 210.54545454545453 | CH21: 210.54545454545453 | CR21: =-0.06*((RC[-95]-1963)^2)+8.5*(RC[-95]-1963)+140 -> 279.84000000000003 | CS21: =RC[-1]+50 -> 329.84000000000003 | CT21: =RC[-2]-50 -> 229.84000000000003 | CU21: =RC[-3]+100 -> 379.84000000000003 | CV21: =RC[-4]-100 -> 179.84000000000003 | CW21: =-0.025*((RC[-100]-1963)^2)+5.5*(RC[-100]-1963)+175 -> 270.47500000000002
A22: 1983 | B22: 38122000 | C22: 12255611 | D22: =RC[-1]/26 -> 471369.65384615387 | E22: =RC[-1]/2 -> 235684.82692307694 | F22: =RC[-1]*1.5 -> 353527.24038461538 | BC22: 15170301.157183452 | BD22: =RC[-1]-R[-1]C[-1] -> 218465.26545133255 | BE22: =(RC[-2]/(RC[-55]))*1000 -> 397.94085192758649 | BF22: =(RC[-3]*100/R[-1]C[-3])-100 -> 1.4611266939609493 | BG22: =(RC[-57]*100/R[-1]C[-57])-100 -> 0.47440830741658147 | BH22: =RC[-2]-RC[-1] -> 0.98671838654436783 | BI22: 17923.3 | CD22: 12.19 | CG22: =RC[-24]/88 -> 203.67386363636362 | CH22: 203.67386363636362 | CR22: =-0.06*((RC[-95]-1963)^2)+8.5*(RC[-95]-1963)+140 -> 286 | CS22: =RC[-1]+50 -> 336 | CT22: =RC[-2]-50 -> 236 | CU22: =RC[-3]+100 -> 386 | CV22: =RC[-4]-100 -> 186 | CW22: =-0.025*((RC[-100]-1963)^2)+5.5*(RC[-100]-1963)+175 -> 275
A23: 1984 | B23: 38279000 | C23: 12336331 | D23: =RC[-1]/26 -> 474474.26923076925 | E23: =RC[-1]/2 -> 237237.13461538462 | F23: =RC[-1]*1.5 -> 355855.70192307694 | BC23: 15368227.521006804 | BD23: =RC[-1]-R[-1]C[-1] -> 197926.36382335238 | BE23: =(RC[-2]/(RC[-55]))*1000 -> 401.47933647709721 | BF23: =(RC[-3]*100/R[-1]C[-3])-100 -> 1.3046963390679309 | BG23: =(RC[-57]*100/R[-1]C[-57])-100 -> 0.41183568543098659 | BH23: =RC[-2]-RC[-1] -> 0.89286065363694433 | BI23: 16238.25 | CD23: 11.3 | CG23: =(R[1]C*((RC[-24]*100/R[1]C[-24])/100)) -> 182.53501020832474 | CH23: 182.53501020832474 | CR23: =-0.06*((RC[-95]-1963)^2)+8.5*(RC[-95]-1963)+140 -> 292.03999999999996 | CS23: =RC[-1]+50 -> 342.03999999999996 | CT23: =RC[-2]-50 -> 242.03999999999996 | CU23: =RC[-3]+100 -> 392.03999999999996 | CV23: =RC[-4]-100 -> 192.03999999999996 | CW23: =-0.025*((RC[-100]-1963)^2)+5.5*(RC[-100]-1963)+175 -> 279.47500000000002
A24: 1985 | B24: 38419000 | C24: 12422212 | D24: =RC[-1]/26 -> 477777.38461538462 | E24: =RC[-1]/2 -> 238888.69230769231 | F24: =RC[-1]*1.5 -> 358333.0384615385 | AI24: 223 | BC24: 15569896.729566457 | BD24: =RC[-1]-R[-1]C[-1] -> 201669.20855965279 | BE24: =(RC[-2]/(RC[-55]))*1000 -> 405.26553865447971 | BF24: =(RC[-3]*100/R[-1]C[-3])-100 -> 1.3122476764740298 | BG24: =(RC[-57]*100/R[-1]C[-57])-100 -> 0.36573578202147417 | BH24: =RC[-2]-RC[-1] -> 0.94651189445255568 | BI24: 16545.320000000003 | CC24: 204 | CD24: 8.83 | CE24: 100 | CF24: =((RC[-3]*RC[-2])/100) -> 18.013199999999998 | CG24: =RC[-4]-RC[-1] -> 185.98680000000002 | CH24: =RC[-5]/RC[-3]*R24C83 -> 204 | CI24: =RC[-6]-RC[-1] -> 0 | CJ24: =RC[-2]*100/R24C86 -> 100 | CR24: =-0.06*((RC[-95]-1963)^2)+8.5*(RC[-95]-1963)+140 -> 297.96000000000004 | CS24: =RC[-1]+50 -> 347.96000000000004 | CT24: =RC[-2]-50 -> 247.96000000000004 | CU24: =RC[-3]+100 -> 397.96000000000004 | CV24: =RC[-4]-100 -> 197.96000000000004 | CW24: =-0.025*((RC[-100]-1963)^2)+5.5*(RC[-100]-1963)+175 -> 283.89999999999998
A25: 1986 | B25: 38536000 | C25: 12546626 | D25: =RC[-1]/26 -> 482562.53846153844 | E25: =RC[-1]/2 -> 241281.26923076922 | F25: =RC[-1]*1.5 -> 361921.90384615381 | AI25: 241 | BC25: 15792181.264141027 | BD25: =RC[-1]-R[-1]C[-1] -> 222284.53457457013 | BE25: =(RC[-2]/(RC[-55]))*1000 -> 409.80333361379041 | BF25: =(RC[-3]*100/R[-1]C[-3])-100 -> 1.427655805529298 | BG25: =(RC[-57]*100/R[-1]C[-57])-100 -> 0.30453681772040397 | BH25: =RC[-2]-RC[-1] -> 1.1231189878088941 | BI25: 18236.64 | CC25: 244 | CD25: 8.8000000000000007 | CE25: =R[-1]C+RC[-1] -> 108.8 | CF25: =((RC[-3]*RC[-2])/100)+R[-1]C -> 39.485199999999999 | CG25: =RC[-4]-RC[-1] -> 204.51480000000001 | CH25: =RC[-5]/RC[-3]*R24C83 -> 224.26470588235296 | CI25: =RC[-6]-RC[-1] -> 19.735294117647044 | CJ25: =RC[-2]*100/R24C86 -> 109.93367935409459 | CK25: =(RC[-8]*100/R[-1]C[-8])-100 -> 19.607843137254903 | CL25: =RC[-1]-RC[-8] -> 10.807843137254903 | CM25: =(R[1]C[-89]*100/RC[-89])-100 -> 0.24652273199086494 | CP25: 20.975000000000001 | CQ25: =(RC[-6])+(4) -> 23.607843137254903 | CR25: =-0.06*((RC[-95]-1963)^2)+8.5*(RC[-95]-1963)+140 -> 303.76 | CS25: =RC[-1]+50 -> 353.76 | CT25: =RC[-2]-50 -> 253.76 | CU25: =RC[-3]+100 -> 403.76 | CV25: =RC[-4]-100 -> 203.76 | CW25: =-0.025*((RC[-100]-1963)^2)+5.5*(RC[-100]-1963)+175 -> 288.27499999999998
A26: 1987 | B26: 38631000 | C26: 12668258 | D26: =RC[-1]/26 -> 487240.69230769231 | E26: =RC[-1]/2 -> 243620.34615384616 | F26: =RC[-1]*1.5 -> 365430.51923076925 | AI26: 253 | BC26: 16038832.867361942 | BD26: =RC[-1]-R[-1]C[-1] -> 246651.60322091542 | BE26: =(RC[-2]/(RC[-55]))*1000 -> 415.18036984188717 | BF26: =(RC[-3]*100/R[-1]C[-3])-100 -> 1.5618589927218096 | BG26: =(RC[-57]*100/R[-1]C[-57])-100 -> 0.24652273199086494 | BH26: =RC[-2]-RC[-1] -> 1.3153362607309447 | BI26: 20235.759999999998 | CC26: 308 | CD26: 5.26 | CE26: =R[-1]C+RC[-1] -> 114.06 | CF26: =((RC[-3]*RC[-2])/100)+R[-1]C -> 55.686 | CG26: =RC[-4]-RC[-1] -> 252.31399999999999 | CH26: =RC[-5]/RC[-3]*R24C83 -> 270.03331579870246 | CI26: =RC[-6]-RC[-1] -> 37.966684201297539 | CJ26: =RC[-2]*100/R24C86 -> 132.36927245034434 | CK26: =(RC[-8]*100/R[-1]C[-8])-100 -> 26.229508196721312 | CL26: =RC[-1]-RC[-8] -> 20.969508196721314 | CM26: =(R[1]C[-89]*100/RC[-89])-100 -> 0.22003054541688982 | CP26: 20.2225 | CQ26: =RC[-6]+4 -> 30.229508196721312 | CR26: =-0.06*((RC[-95]-1963)^2)+8.5*(RC[-95]-1963)+140 -> 309.44 | CS26: =RC[-1]+50 -> 359.44 | CT26: =RC[-2]-50 -> 259.44 | CU26: =RC[-3]+100 -> 409.44 | CV26: =RC[-4]-100 -> 209.44 | CW26: =-0.025*((RC[-100]-1963)^2)+5.5*(RC[-100]-1963)+175 -> 292.60000000000002
A27: 1988 | B27: 38716000 | C27: 12781018 | D27: =RC[-1]/26 -> 491577.61538461538 | E27: =RC[-1]/2 -> 245788.80769230769 | F27: =RC[-1]*1.5 -> 368683.2115384615 | AI27: 264 | BC27: 16265162.6075099 | BD27: =RC[-1]-R[-1]C[-1] -> 226329.74014795758 | BE27: =(RC[-2]/(RC[-55]))*1000 -> 420.1147486183981 | BF27: =(RC[-3]*100/R[-1]C[-3])-100 -> 1.4111359724218033 | BG27: =(RC[-57]*100/R[-1]C[-57])-100 -> 0.22003054541688982 | BH27: =RC[-2]-RC[-1] -> 1.1911054270049135 | BI27: 22670.61 | CC27: 403.75 | CD27: 4.83 | CE27: =R[-1]C+RC[-1] -> 118.89 | CF27: =((RC[-3]*RC[-2])/100)+R[-1]C -> 75.187124999999995 | CG27: =RC[-4]-RC[-1] -> 328.56287500000002 | CH27: =RC[-5]/RC[-3]*R24C83 -> 339.59962991000083 | CI27: =RC[-6]-RC[-1] -> 64.150370089999171 | CJ27: =RC[-2]*100/R24C86 -> 166.47040681862785 | CK27: =(RC[-8]*100/R[-1]C[-8])-100 -> 31.087662337662351 | CL27: =RC[-1]-RC[-8] -> 26.257662337662353 | CM27: =(R[1]C[-89]*100/RC[-89])-100 -> 0.19630127079243209 | CP27: 19.237499999999997 | CQ27: =RC[-6]+4 -> 35.087662337662351 | CR27: =-0.06*((RC[-95]-1963)^2)+8.5*(RC[-95]-1963)+140 -> 315 | CS27: =RC[-1]+50 -> 365 | CT27: =RC[-2]-50 -> 265 | CU27: =RC[-3]+100 -> 415 | CV27: =RC[-4]-100 -> 215 | CW27: =-0.025*((RC[-100]-1963)^2)+5.5*(RC[-100]-1963)+175 -> 296.875
A28: 1989 | B28: 38792000 | C28: 12966912 | D28: =RC[-1]/26 -> 498727.38461538462 | E28: =RC[-1]/2 -> 249363.69230769231 | F28: =RC[-1]*1.5 -> 374045.5384615385 | AI28: 280 | BC28: 16552406.6977991 | BD28: =RC[-1]-R[-1]C[-1] -> 287244.09028919972 | BE28: =(RC[-2]/(RC[-55]))*1000 -> 426.6963986852727 | BF28: =(RC[-3]*100/R[-1]C[-3])-100 -> 1.7660081071465754 | BG28: =(RC[-57]*100/R[-1]C[-57])-100 -> 0.19630127079243209 | BH28: =RC[-2]-RC[-1] -> 1.5697068363541433 | BI28: 26027.3 | CC28: 502.5 | CD28: 6.79 | CE28: =R[-1]C+RC[-1] -> 125.68 | CF28: =((RC[-3]*RC[-2])/100)+R[-1]C -> 109.30687499999999 | CG28: =RC[-4]-RC[-1] -> 393.19312500000001 | CH28: =RC[-5]/RC[-3]*R24C83 -> 399.82495225970717 | CI28: =RC[-6]-RC[-1] -> 102.67504774029283 | CJ28: =RC[-2]*100/R24C86 -> 195.99262365671922 | CK28: =(RC[-8]*100/R[-1]C[-8])-100 -> 24.45820433436532 | CL28: =RC[-1]-RC[-8] -> 17.668204334365321 | CM28: =(R[1]C[-89]*100/RC[-89])-100 -> 0.15209321509590268 | CP28: 17.240000000000002 | CQ28: =RC[-6]+4 -> 28.45820433436532 | CR28: =-0.06*((RC[-95]-1963)^2)+8.5*(RC[-95]-1963)+140 -> 320.44 | CS28: =RC[-1]+50 -> 370.44 | CT28: =RC[-2]-50 -> 270.44 | CU28: =RC[-3]+100 -> 420.44 | CV28: =RC[-4]-100 -> 220.44 | CW28: =-0.025*((RC[-100]-1963)^2)+5.5*(RC[-100]-1963)+175 -> 301.10000000000002
A29: 1990 | B29: 38851000 | C29: 13222820 | D29: =RC[-1]/26 -> 508570 | E29: =RC[-1]/2 -> 254285 | F29: =RC[-1]*1.5 -> 381427.5 | AI29: 300 | BC29: 16880663.853062801 | BD29: =RC[-1]-R[-1]C[-1] -> 328257.15526370145 | BE29: =(RC[-2]/(RC[-55]))*1000 -> 434.4975381087437 | BF29: =(RC[-3]*100/R[-1]C[-3])-100 -> 1.9831385324005453 | BG29: =(RC[-57]*100/R[-1]C[-57])-100 -> 0.15209321509590268 | BH29: =RC[-2]-RC[-1] -> 1.8310453173046426 | BI29: 28571.669999999995 | CC29: 572.5 | CD29: 6.72 | CE29: =R[-1]C+RC[-1] -> 132.4 | CF29: =((RC[-3]*RC[-2])/100)+R[-1]C -> 147.778875 | CG29: =RC[-4]-RC[-1] -> 424.72112500000003 | CH29: =RC[-5]/RC[-3]*R24C83 -> 432.40181268882168 | CI29: =RC[-6]-RC[-1] -> 140.09818731117832 | CJ29: =RC[-2]*100/R24C86 -> 211.96167288667729 | CK29: =(RC[-8]*100/R[-1]C[-8])-100 -> 13.930348258706474 | CL29: =RC[-1]-RC[-8] -> 7.2103482587064738 | CM29: =(R[1]C[-89]*100/RC[-89])-100 -> 0.2290803325525701 | CP29: 16.237500000000001 | CQ29: =RC[-6]+4 -> 17.930348258706474 | CR29: =-0.06*((RC[-95]-1963)^2)+8.5*(RC[-95]-1963)+140 -> 325.76 | CS29: =RC[-1]+50 -> 375.76 | CT29: =RC[-2]-50 -> 275.76 | CU29: =RC[-3]+100 -> 425.76 | CV29: =RC[-4]-100 -> 225.76 | CW29: =-0.025*((RC[-100]-1963)^2)+5.5*(RC[-100]-1963)+175 -> 305.27499999999998
A30: 1991 | B30: 38940000 | C30: 13511072 | D30: =RC[-1]/26 -> 519656.61538461538 | E30: =RC[-1]/2 -> 259828.30769230769 | F30: =RC[-1]*1.5 -> 389742.4615384615 | AI30: 320 | AL30: 81900 | AM30: 55104 | AN30: 26124 | AO30: 672 | AP30: 61098 | AQ30: 162.39090328286042 | AR30: 2692233599.9999995 | AS30: =RC[-1]/RC[-3] -> 44064.185407050958 | AT30: =RC[-1]/RC[-3] -> 271.34639019956558 | AU30: 176142 | AV30: 111.14777423345399 | AW30: 5773451400 | AX30: =RC[-1]/RC[-3] -> 32777.255850393434 | AY30: =RC[-1]/RC[-3] -> 294.89799572187854 | AZ30: =RC[29]/((RC[-1]+RC[-6])/2) -> 2.056311778005929 | BC30: 17206000 | BD30: =RC[-1]-R[-1]C[-1] -> 325336.14693719894 | BE30: =(RC[-2]/(RC[-55]))*1000 -> 441.85927067283001 | BF30: =(RC[-3]*100/R[-1]C[-3])-100 -> 1.9272710467377152 | BG30: =(RC[-57]*100/R[-1]C[-57])-100 -> 0.2290803325525701 | BH30: =RC[-2]-RC[-1] -> 1.6981907141851451 | BI30: 28797.27 | CC30: 582.1875 | CD30: 5.94 | CE30: =R[-1]C+RC[-1] -> 138.34 | CF30: =((RC[-3]*RC[-2])/100)+R[-1]C -> 182.36081250000001 | CG30: =RC[-4]-RC[-1] -> 399.82668749999999 | CH30: =RC[-5]/RC[-3]*R24C83 -> 420.83815237819857 | CI30: =RC[-6]-RC[-1] -> 161.34934762180143 | CJ30: =RC[-2]*100/R24C86 -> 206.29321195009734 | CK30: =(RC[-8]*100/R[-1]C[-8])-100 -> 1.692139737991269 | CL30: =RC[-1]-RC[-8] -> -4.2478602620087313 | CM30: =(R[1]C[-89]*100/RC[-89])-100 -> 0.32871083718541172 | CP30: 16.3125 | CQ30: =RC[-6]+4 -> 5.692139737991269 | CR30: =-0.06*((RC[-95]-1963)^2)+8.5*(RC[-95]-1963)+140 -> 330.96000000000004 | CS30: =RC[-1]+50 -> 380.96000000000004 | CT30: =RC[-2]-50 -> 280.96000000000004 | CU30: =RC[-3]+100 -> 430.96000000000004 | CV30: =RC[-4]-100 -> 230.96000000000004 | CW30: =-0.025*((RC[-100]-1963)^2)+5.5*(RC[-100]-1963)+175 -> 309.39999999999998
A31: 1992 | B31: 39068000 | C31: 13710030 | D31: =RC[-1]/26 -> 527308.84615384613 | E31: =RC[-1]/2 -> 263654.42307692306 | F31: =RC[-1]*1.5 -> 395481.63461538462 | AI31: 338 | AL31: 81380 | AM31: 52825 | AN31: 27296 | AO31: 1259 | AP31: 66137 | AQ31: 156.49320362586838 | AR31: 2929328500 | AS31: =RC[-1]/RC[-3] -> 44291.82605803106 | AT31: =RC[-1]/RC[-3] -> 283.02715409878419 | AU31: 152483 | AV31: 109.6253646284643 | AW31: 5082786000 | AX31: =RC[-1]/RC[-3] -> 33333.460123423596 | AY31: =RC[-1]/RC[-3] -> 304.06703992634692 | AZ31: =RC[29]/((RC[-1]+RC[-6])/2) -> 1.9641226429001941 | BA31: =((RC[-7]+RC[-2])*100/(R[-1]C[-7]+R[-1]C[-2]))-100 -> 3.6821218226752706 | BC31: 17558891.149678409 | BD31: =RC[-1]-R[-1]C[-1] -> 352891.1496784091 | BE31: =(RC[-2]/(RC[-55]))*1000 -> 449.44433166986812 | BF31: =(RC[-3]*100/R[-1]C[-3])-100 -> 2.0509772734999956 | BG31: =(RC[-57]*100/R[-1]C[-57])-100 -> 0.32871083718541172 | BH31: =RC[-2]-RC[-1] -> 1.7222664363145839 | BI31: 26051.130000000005 | CC31: 576.5625 | CD31: 5.93 | CE31: =R[-1]C+RC[-1] -> 144.27000000000001 | CF31: =((RC[-3]*RC[-2])/100)+R[-1]C -> 216.55096875000001 | CG31: =RC[-4]-RC[-1] -> 360.01153124999996 | CH31: =RC[-5]/RC[-3]*R24C83 -> 399.64129756706177 | CI31: =RC[-6]-RC[-1] -> 176.92120243293823 | CJ31: =RC[-2]*100/R24C86 -> 195.9025968465989 | CK31: =(RC[-8]*100/R[-1]C[-8])-100 -> -0.96618357487922424 | CL31: =RC[-1]-RC[-8] -> -6.896183574879224 | CM31: =(R[1]C[-89]*100/RC[-89])-100 -> 0.3122760315347648 | CP31: 18.352499999999999 | CQ31: =RC[-6]+4 -> 3.0338164251207758 | CR31: =-0.06*((RC[-95]-1963)^2)+8.5*(RC[-95]-1963)+140 -> 336.03999999999996 | CS31: =RC[-1]+50 -> 386.03999999999996 | CT31: =RC[-2]-50 -> 286.03999999999996 | CU31: =RC[-3]+100 -> 436.03999999999996 | CV31: =RC[-4]-100 -> 236.03999999999996 | CW31: =-0.025*((RC[-100]-1963)^2)+5.5*(RC[-100]-1963)+175 -> 313.47500000000002
A32: 1993 | B32: 39190000 | C32: 14031422 | D32: =RC[-1]/26 -> 539670.07692307688 | E32: =RC[-1]/2 -> 269835.03846153844 | F32: =RC[-1]*1.5 -> 404752.55769230763 | AI32: 351 | AL32: 74158 | AM32: 48588 | AN32: 24533 | AO32: 1037 | AP32: 66788 | AQ32: 148.96771219272443 | AR32: 2966748399.9999995 | AS32: =RC[-1]/RC[-3] -> 44420.380906749706 | AT32: =RC[-1]/RC[-3] -> 298.18797813905871 | AU32: 147981 | AV32: 108.07798596309799 | AW32: 5170784200 | AX32: =RC[-1]/RC[-3] -> 34942.21690622445 | AY32: =RC[-1]/RC[-3] -> 323.3055889675357 | AZ32: =RC[29]/((RC[-1]+RC[-6])/2) -> 1.8453529701672613 | BA32: =((RC[-7]+RC[-2])*100/(R[-1]C[-7]+R[-1]C[-2]))-100 -> 5.8592596267424 | BC32: 17865724.212892946 | BD32: =RC[-1]-R[-1]C[-1] -> 306833.06321453676 | BE32: =(RC[-2]/(RC[-55]))*1000 -> 455.87456526902133 | BF32: =(RC[-3]*100/R[-1]C[-3])-100 -> 1.7474512518984113 | BG32: =(RC[-57]*100/R[-1]C[-57])-100 -> 0.3122760315347648 | BH32: =RC[-2]-RC[-1] -> 1.4351752203636465 | BI32: 22651.03 | CC32: 573.4375 | CD32: 4.5699999999999994 | CE32: =R[-1]C+RC[-1] -> 148.84 | CF32: =((RC[-3]*RC[-2])/100)+R[-1]C -> 242.75706250000002 | CG32: =RC[-4]-RC[-1] -> 330.68043749999998 | CH32: =RC[-5]/RC[-3]*R24C83 -> 385.27109647944104 | CI32: =RC[-6]-RC[-1] -> 188.16640352055896 | CJ32: =RC[-2]*100/R24C86 -> 188.85838062717698 | CK32: =(RC[-8]*100/R[-1]C[-8])-100 -> -0.5420054200541955 | CL32: =RC[-1]-RC[-8] -> -5.1120054200541949 | CM32: =(R[1]C[-89]*100/RC[-89])-100 -> 0.26792549119673481 | CP32: 22.64 | CQ32: =RC[-6]+4 -> 3.4579945799458045 | CR32: =-0.06*((RC[-95]-1963)^2)+8.5*(RC[-95]-1963)+140 -> 341 | CS32: =RC[-1]+50 -> 391 | CT32: =RC[-2]-50 -> 291 | CU32: =RC[-3]+100 -> 441 | CV32: =RC[-4]-100 -> 241 | CW32: =-0.025*((RC[-100]-1963)^2)+5.5*(RC[-100]-1963)+175 -> 317.5
A33: 1994 | B33: 39295000 | C33: 14319606 | D33: =RC[-1]/26 -> 550754.07692307688 | E33: =RC[-1]/2 -> 275377.03846153844 | F33: =RC[-1]*1.5 -> 413065.55769230763 | AI33: 364 | AL33: 85789 | AM33: 56532 | AN33: 28118 | AO33: 1139 | AP33: 86187 | AQ33: 148.88098640885858 | AR33: 4025289699.9999995 | AS33: =RC[-1]/RC[-3] -> 46704.139835474023 | AT33: =RC[-1]/RC[-3] -> 313.70117139884206 | AU33: 180702 | AV33: 107.31739484502098 | AW33: 6401262300 | AX33: =RC[-1]/RC[-3] -> 35424.413122156919 | AY33: =RC[-1]/RC[-3] -> 330.09013285603851 | AZ33: =RC[29]/((RC[-1]+RC[-6])/2) -> 1.8358045412991306 | BA33: =((RC[-7]+RC[-2])*100/(R[-1]C[-7]+R[-1]C[-2]))-100 -> 3.5877663629078 | BC33: 18191342.462421015 | BD33: =RC[-1]-R[-1]C[-1] -> 325618.24952806905 | BE33: =(RC[-2]/(RC[-55]))*1000 -> 462.94293071436607 | BF33: =(RC[-3]*100/R[-1]C[-3])-100 -> 1.8225863426968374 | BG33: =(RC[-57]*100/R[-1]C[-57])-100 -> 0.26792549119673481 | BH33: =RC[-2]-RC[-1] -> 1.5546608515001026 | BI33: 24037.79 | CC33: 590.9375 | CD33: 4.72 | CE33: =R[-1]C+RC[-1] -> 153.56 | CF33: =((RC[-3]*RC[-2])/100)+R[-1]C -> 270.64931250000001 | CG33: =RC[-4]-RC[-1] -> 320.28818749999999 | CH33: =RC[-5]/RC[-3]*R24C83 -> 384.82514977858818 | CI33: =RC[-6]-RC[-1] -> 206.11235022141182 | CJ33: =RC[-2]*100/R24C86 -> 188.63977930322949 | CK33: =(RC[-8]*100/R[-1]C[-8])-100 -> 3.0517711171662114 | CL33: =RC[-1]-RC[-8] -> -1.6682288828337883 | CM33: =(R[1]C[-89]*100/RC[-89])-100 -> 0.23412647919582241 | CP33: 24.1175 | CQ33: =RC[-6]+4 -> 7.0517711171662114 | CR33: =-0.06*((RC[-95]-1963)^2)+8.5*(RC[-95]-1963)+140 -> 345.84000000000003 | CS33: =RC[-1]+50 -> 395.84000000000003 | CT33: =RC[-2]-50 -> 295.84000000000003 | CU33: =RC[-3]+100 -> 445.84000000000003 | CV33: =RC[-4]-100 -> 245.84000000000003 | CW33: =-0.025*((RC[-100]-1963)^2)+5.5*(RC[-100]-1963)+175 -> 321.47500000000002
A34: 1995 | B34: 39387000 | C34: 14555126 | D34: =RC[-1]/26 -> 559812.5384615385 | E34: =RC[-1]/2 -> 279906.26923076925 | F34: =RC[-1]*1.5 -> 419859.40384615387 | R34: 403587 | S34: =RC[-1]/1.5 -> 269058 | T34: 17899907 | U34: =RC[-1]*1000/RC[-3] -> 44352.040576133521 | Z34: 7.0563636363636366 | AI34: 376 | AL34: 87673 | AM34: 57527 | AN34: 28991 | AO34: 1155 | AP34: 92749 | AQ34: 150.39587395661388 | AR34: 4421153500 | AS34: =RC[-1]/RC[-3] -> 47667.937120615854 | AT34: =RC[-1]/RC[-3] -> 316.94976641691028 | AU34: 214997 | AV34: 107.22267784571704 | AW34: 7875175899.999999 | AX34: =RC[-1]/RC[-3] -> 36629.236221900763 | AY34: =RC[-1]/RC[-3] -> 341.61836803410802 | AZ34: =RC[29]/((RC[-1]+RC[-6])/2) -> 1.8629431577686668 | BA34: =((RC[-7]+RC[-2])*100/(R[-1]C[-7]+R[-1]C[-2]))-100 -> 2.29528266357066 | BC34: 18536203.485439684 | BD34: =RC[-1]-R[-1]C[-1] -> 344861.02301866934 | BE34: =(RC[-2]/(RC[-55]))*1000 -> 470.61729721582464 | BF34: =(RC[-3]*100/R[-1]C[-3])-100 -> 1.8957425694726453 | BG34: =(RC[-57]*100/R[-1]C[-57])-100 -> 0.23412647919582241 | BH34: =RC[-2]-RC[-1] -> 1.6616160902768229 | BI34: 25458.329999999998 | CC34: 613.4375 | CD34: 4.67 | CE34: =R[-1]C+RC[-1] -> 158.22999999999999 | CF34: =((RC[-3]*RC[-2])/100)+R[-1]C -> 299.29684374999999 | CG34: =RC[-4]-RC[-1] -> 314.14065625000001 | CH34: =RC[-5]/RC[-3]*R24C83 -> 387.68722745370667 | CI34: =RC[-6]-RC[-1] -> 225.75027254629333 | CJ34: =RC[-2]*100/R24C86 -> 190.04275855573854 | CK34: =(RC[-8]*100/R[-1]C[-8])-100 -> 3.8075092543627704 | CL34: =RC[-1]-RC[-8] -> -0.86249074563722949 | CM34: =(R[1]C[-89]*100/RC[-89])-100 -> 0.23104069870770161 | CP34: 22.9 | CQ34: =RC[-6]+4 -> 7.8075092543627704 | CR34: =-0.06*((RC[-95]-1963)^2)+8.5*(RC[-95]-1963)+140 -> 350.56 | CS34: =RC[-1]+50 -> 400.56 | CT34: =RC[-2]-50 -> 300.56 | CU34: =RC[-3]+100 -> 450.56 | CV34: =RC[-4]-100 -> 250.56 | CW34: =-0.025*((RC[-100]-1963)^2)+5.5*(RC[-100]-1963)+175 -> 325.39999999999998
A35: 1996 | B35: 39478000 | C35: 14798908 | D35: =RC[-1]/26 -> 569188.76923076925 | E35: =RC[-1]/2 -> 284594.38461538462 | F35: =RC[-1]*1.5 -> 426891.57692307694 | R35: 412982 | S35: =RC[-1]/1.5 -> 275321.33333333331 | T35: 19566189 | U35: =RC[-1]*1000/RC[-3] -> 47377.825183664179 | Y35: =((RC[-4]*100/R[-1]C[-4])-100)-RC[57] -> 3.2621993130996452 | Z35: 5.0536363636363637 | AI35: 390 | AL35: 89323 | AM35: 56928 | AN35: 31111 | AO35: 1284 | AP35: 88707 | AQ35: 146.29492017656852 | AR35: 4368693100 | AS35: =RC[-1]/RC[-3] -> 49248.572265999304 | AT35: =RC[-1]/RC[-3] -> 336.63897698265572 | AU35: 192120 | AV35: 106.04233083913887 | AW35: 7125463000 | AX35: =RC[-1]/RC[-3] -> 37088.606079533623 | AY35: =RC[-1]/RC[-3] -> 349.75283724944956 | AZ35: =RC[29]/((RC[-1]+RC[-6])/2) -> 1.8183856131739111 | BA35: =((RC[-7]+RC[-2])*100/(R[-1]C[-7]+R[-1]C[-2]))-100 -> 4.2248748953334569 | BC35: 18871157.299053606 | BD35: =RC[-1]-R[-1]C[-1] -> 334953.8136139214 | BE35: =(RC[-2]/(RC[-55]))*1000 -> 478.0170550446731 | BF35: =(RC[-3]*100/R[-1]C[-3])-100 -> 1.8070249060279764 | BG35: =(RC[-57]*100/R[-1]C[-57])-100 -> 0.23104069870770161 | BH35: =RC[-2]-RC[-1] -> 1.5759842073202748 | BI35: 24726.959999999999 | CC35: 624.0625 | CD35: 3.56 | CE35: =R[-1]C+RC[-1] -> 161.79 | CF35: =((RC[-3]*RC[-2])/100)+R[-1]C -> 321.51346875000002 | CG35: =RC[-4]-RC[-1] -> 302.54903124999998 | CH35: =RC[-5]/RC[-3]*R24C83 -> 385.72377773657212 | CI35: =RC[-6]-RC[-1] -> 238.33872226342788 | CJ35: =RC[-2]*100/R24C86 -> 189.080283204202 | CK35: =(RC[-8]*100/R[-1]C[-8])-100 -> 1.7320427916454406 | CL35: =RC[-1]-RC[-8] -> -1.8279572083545594 | CM35: =(R[1]C[-89]*100/RC[-89])-100 -> 0.26343786412685688 | CO35: 2.33 | CP35: 22.08 | CQ35: =RC[-6]+4 -> 5.7320427916454406 | CR35: =-0.06*((RC[-95]-1963)^2)+8.5*(RC[-95]-1963)+140 -> 355.15999999999997 | CS35: =RC[-1]+50 -> 405.15999999999997 | CT35: =RC[-2]-50 -> 305.15999999999997 | CU35: =RC[-3]+100 -> 455.15999999999997 | CV35: =RC[-4]-100 -> 255.15999999999997 | CW35: =-0.025*((RC[-100]-1963)^2)+5.5*(RC[-100]-1963)+175 -> 329.27499999999998
A36: 1997 | B36: 39582000 | C36: 15027010 | D36: =RC[-1]/26 -> 577961.92307692312 | E36: =RC[-1]/2 -> 288980.96153846156 | F36: =RC[-1]*1.5 -> 433471.44230769237 | R36: 479237 | S36: =RC[-1]/1.5 -> 319491.33333333331 | T36: 24338352 | U36: =RC[-1]*1000/RC[-3] -> 50785.627987822307 | Y36: =((RC[-4]*100/R[-1]C[-4])-100)-RC[57] -> 5.222822361405334 | Z36: 4.4345454545454537 | AI36: 400 | AL36: 104790 | AM36: 66740 | AN36: 36487 | AO36: 1563 | AP36: 104094 | AQ36: 148.00938669993204 | AR36: 5435822699.999999 | AS36: =RC[-1]/RC[-3] -> 52220.326819989612 | AT36: =RC[-1]/RC[-3] -> 352.81766909729106 | AU36: 231524 | AV36: 103.8488448819956 | AW36: 8764069200 | AX36: =RC[-1]/RC[-3] -> 37853.82595324891 | AY36: =RC[-1]/RC[-3] -> 364.50887822837666 | AZ36: =RC[29]/((RC[-1]+RC[-6])/2) -> 1.7913738238055303 | BA36: =((RC[-7]+RC[-2])*100/(R[-1]C[-7]+R[-1]C[-2]))-100 -> 4.5068621816491685 | BC36: 19234119.565917771 | BD36: =RC[-1]-R[-1]C[-1] -> 362962.26686416566 | BE36: =(RC[-2]/(RC[-55]))*1000 -> 485.93096776104721 | BF36: =(RC[-3]*100/R[-1]C[-3])-100 -> 1.9233704701426433 | BG36: =(RC[-57]*100/R[-1]C[-57])-100 -> 0.26343786412685688 | BH36: =RC[-2]-RC[-1] -> 1.6599326060157864 | BI36: 26794.600000000002 | CC36: 642.5 | CD36: 1.97 | CE36: =R[-1]C+RC[-1] -> 163.76 | CF36: =((RC[-3]*RC[-2])/100)+R[-1]C -> 334.17071874999999 | CG36: =RC[-4]-RC[-1] -> 308.32928125000001 | CH36: =RC[-5]/RC[-3]*R24C83 -> 392.34245236932099 | CI36: =RC[-6]-RC[-1] -> 250.15754763067901 | CJ36: =RC[-2]*100/R24C86 -> 192.32473155358872 | CK36: =(RC[-8]*100/R[-1]C[-8])-100 -> 2.9544316474712105 | CL36: =RC[-1]-RC[-8] -> 0.98443164747121048 | CM36: =(R[1]C[-89]*100/RC[-89])-100 -> 0.35116972361174703 | CO36: 16.04 | CP36: 20.61 | CQ36: =RC[-6]+4 -> 6.9544316474712105 | CR36: =-0.06*((RC[-95]-1963)^2)+8.5*(RC[-95]-1963)+140 -> 359.64 | CS36: =RC[-1]+50 -> 409.64 | CT36: =RC[-2]-50 -> 309.64 | CU36: =RC[-3]+100 -> 459.64 | CV36: =RC[-4]-100 -> 259.64 | CW36: =-0.025*((RC[-100]-1963)^2)+5.5*(RC[-100]-1963)+175 -> 333.1
A37: 1998 | B37: 39721000 | C37: 15300398 | D37: =RC[-1]/26 -> 588476.84615384613 | E37: =RC[-1]/2 -> 294238.42307692306 | F37: =RC[-1]*1.5 -> 441357.63461538462 | R37: 529565 | S37: =RC[-1]/1.5 -> 353043.33333333331 | T37: 29595669 | U37: =RC[-1]*1000/RC[-3] -> 55886.75422280551 | Y37: =((RC[-4]*100/R[-1]C[-4])-100)-RC[57] -> 8.2144287825019813 | Z37: 3.877272727272727 | AI37: 408 | AL37: 120765 | AM37: 79803 | AN37: 39195 | AO37: 1767 | AP37: 136282 | AQ37: 149.19655531869017 | AR37: 7090628000 | AS37: =RC[-1]/RC[-3] -> 52029.086746598965 | AT37: =RC[-1]/RC[-3] -> 348.7284718837015 | AU37: 291165 | AV37: 104.35321266364991 | AW37: 10917020500 | AX37: =RC[-1]/RC[-3] -> 37494.274723953771 | AY37: =RC[-1]/RC[-3] -> 359.30158513475664 | AZ37: =RC[29]/((RC[-1]+RC[-6])/2) -> 1.8952232136170706 | BA37: =((RC[-7]+RC[-2])*100/(R[-1]C[-7]+R[-1]C[-2]))-100 -> -1.2959913921865365 | BC37: 19653914.349819176 | BD37: =RC[-1]-R[-1]C[-1] -> 419794.78390140459 | BE37: =(RC[-2]/(RC[-55]))*1000 -> 494.79908234483463 | BF37: =(RC[-3]*100/R[-1]C[-3])-100 -> 2.1825526375809119 | BG37: =(RC[-57]*100/R[-1]C[-57])-100 -> 0.35116972361174703 | BH37: =RC[-2]-RC[-1] -> 1.8313829139691649 | BI37: 30990.089999999997 | CC37: 670.9375 | CD37: 1.83 | CE37: =R[-1]C+RC[-1] -> 165.59 | CF37: =((RC[-3]*RC[-2])/100)+R[-1]C -> 346.44887499999999 | CG37: =RC[-4]-RC[-1] -> 324.48862500000001 | CH37: =RC[-5]/RC[-3]*R24C83 -> 405.17996255812551 | CI37: =RC[-6]-RC[-1] -> 265.75753744187449 | CJ37: =RC[-2]*100/R24C86 -> 198.61762870496347 | CK37: =(RC[-8]*100/R[-1]C[-8])-100 -> 4.4260700389105097 | CL37: =RC[-1]-RC[-8] -> 2.5960700389105096 | CM37: =(R[1]C[-89]*100/RC[-89])-100 -> 0.51861735605851322 | CO37: 10.5 | CP37: 18.61 | CQ37: =RC[-6]+4 -> 8.4260700389105097 | CR37: =-0.06*((RC[-95]-1963)^2)+8.5*(RC[-95]-1963)+140 -> 364 | CS37: =RC[-1]+50 -> 414 | CT37: =RC[-2]-50 -> 314 | CU37: =RC[-3]+100 -> 464 | CV37: =RC[-4]-100 -> 264 | CW37: =-0.025*((RC[-100]-1963)^2)+5.5*(RC[-100]-1963)+175 -> 336.875
A38: 1999 | B38: 39927000 | C38: 15557958 | D38: =RC[-1]/26 -> 598383 | E38: =RC[-1]/2 -> 299191.5 | F38: =RC[-1]*1.5 -> 448787.25 | R38: 585782 | S38: =RC[-1]/1.5 -> 390521.33333333331 | T38: 36218444 | U38: =RC[-1]*1000/RC[-3] -> 61829.21974386376 | Y38: =((RC[-4]*100/R[-1]C[-4])-100)-RC[57] -> 8.3230482127611811 | Z38: 3.1926272727272731 | AE38: 11532.988286089596 | AI38: 416 | AL38: 141338 | AM38: 91284 | AN38: 47753 | AO38: 2301 | AP38: 158487 | AQ38: 146.32930434216055 | AR38: 8253696800 | AS38: =RC[-1]/RC[-3] -> 52078.068232725709 | AT38: =RC[-1]/RC[-3] -> 355.89636995028701 | AU38: 354324 | AV38: 105.76814123949669 | AW38: 13636129599.999998 | AX38: =RC[-1]/RC[-3] -> 38484.91662997708 | AY38: =RC[-1]/RC[-3] -> 363.86114172918616 | AZ38: =RC[29]/((RC[-1]+RC[-6])/2) -> 2.0258558977698327 | BA38: =((RC[-7]+RC[-2])*100/(R[-1]C[-7]+R[-1]C[-2]))-100 -> 1.6563498321525714 | BC38: 20122974.800636135 | BD38: =RC[-1]-R[-1]C[-1] -> 469060.45081695914 | BE38: =(RC[-2]/(RC[-55]))*1000 -> 503.99415935672943 | BF38: =(RC[-3]*100/R[-1]C[-3])-100 -> 2.3866006662498478 | BG38: =(RC[-57]*100/R[-1]C[-57])-100 -> 0.51861735605851322 | BH38: =RC[-2]-RC[-1] -> 1.8679833101913346 | BI38: 34626.979999999996 | CC38: 729.0625 | CD38: 2.31 | CE38: =R[-1]C+RC[-1] -> 167.9 | CF38: =((RC[-3]*RC[-2])/100)+R[-1]C -> 363.29021875000001 | CG38: =RC[-4]-RC[-1] -> 365.77228124999999 | CH38: =RC[-5]/RC[-3]*R24C83 -> 434.22424061941632 | CI38: =RC[-6]-RC[-1] -> 294.83825938058368 | CJ38: =RC[-2]*100/R24C86 -> 212.85501991147859 | CK38: =(RC[-8]*100/R[-1]C[-8])-100 -> 8.6632510479739153 | CL38: =RC[-1]-RC[-8] -> 6.3532510479739148 | CM38: =(R[1]C[-89]*100/RC[-89])-100 -> 0.84404037368196327 | CO38: 10.62 | CP38: 15.64 | CQ38: =RC[-6]+4 -> 12.663251047973915 | CR38: =-0.06*((RC[-95]-1963)^2)+8.5*(RC[-95]-1963)+140 -> 368.24 | CS38: =RC[-1]+50 -> 418.24 | CT38: =RC[-2]-50 -> 318.24 | CU38: =RC[-3]+100 -> 468.24 | CV38: =RC[-4]-100 -> 268.24 | CW38: =-0.025*((RC[-100]-1963)^2)+5.5*(RC[-100]-1963)+175 -> 340.6
A39: 2000 | B39: 40264000 | C39: 15786797 | D39: =RC[-1]/26 -> 607184.5 | E39: =RC[-1]/2 -> 303592.25 | F39: =RC[-1]*1.5 -> 455388.375 | R39: 612852 | S39: =RC[-1]/1.5 -> 408568 | T39: 42325628 | U39: =RC[-1]*1000/RC[-3] -> 69063.375823200375 | Y39: =((RC[-4]*100/R[-1]C[-4])-100)-RC[57] -> 8.2702221753810292 | Z39: 4.8565454545454543 | AE39: 12461.740854901367 | AI39: 424 | AL39: 143902 | AM39: 89889 | AN39: 51570 | AO39: 2443 | AP39: 165400 | AQ39: 146.04556760124009 | AR39: 8895954999.9999981 | AS39: =RC[-1]/RC[-3] -> 53784.492140266011 | AT39: =RC[-1]/RC[-3] -> 368.27199225325427 | AU39: 365833 | AV39: 105.29489313462319 | AW39: 14670248899.999998 | AX39: =RC[-1]/RC[-3] -> 40100.944693343677 | AY39: =RC[-1]/RC[-3] -> 380.84415587062915 | AZ39: =RC[29]/((RC[-1]+RC[-6])/2) -> 2.16838871257568 | BA39: =((RC[-7]+RC[-2])*100/(R[-1]C[-7]+R[-1]C[-2]))-100 -> 4.0789621460018139 | BC39: 20643668.369846933 | BD39: =RC[-1]-R[-1]C[-1] -> 520693.56921079755 | BE39: =(RC[-2]/(RC[-55]))*1000 -> 512.70783751855083 | BF39: =(RC[-3]*100/R[-1]C[-3])-100 -> 2.5875576268889233 | BG39: =(RC[-57]*100/R[-1]C[-57])-100 -> 0.84404037368196327 | BH39: =RC[-2]-RC[-1] -> 1.74351725320696 | BI39: 38438.639999999999 | CC39: 812.1875 | CD39: 3.4299999999999997 | CE39: =R[-1]C+RC[-1] -> 171.33 | CF39: =((RC[-3]*RC[-2])/100)+R[-1]C -> 391.14825000000002 | CG39: =RC[-4]-RC[-1] -> 421.03924999999998 | CH39: =RC[-5]/RC[-3]*R24C83 -> 474.04861962294984 | CI39: =RC[-6]-RC[-1] -> 338.13888037705016 | CJ39: =RC[-2]*100/R24C86 -> 232.3767743249754 | CK39: =(RC[-8]*100/R[-1]C[-8])-100 -> 11.401628804114878 | CL39: =RC[-1]-RC[-8] -> 7.9716288041148786 | CM39: =(R[1]C[-89]*100/RC[-89])-100 -> 0.52652493542618117 | CO39: 4.62 | CP39: 13.87 | CQ39: =RC[-6]+4 -> 15.401628804114878 | CR39: =-0.06*((RC[-95]-1963)^2)+8.5*(RC[-95]-1963)+140 -> 372.36 | CS39: =RC[-1]+50 -> 422.36 | CT39: =RC[-2]-50 -> 322.36 | CU39: =RC[-3]+100 -> 472.36 | CV39: =RC[-4]-100 -> 272.36 | CW39: =-0.025*((RC[-100]-1963)^2)+5.5*(RC[-100]-1963)+175 -> 344.27499999999998
A40: 2001 | B40: 40476000 | C40: 16049762 | D40: =RC[-1]/26 -> 617298.5384615385 | E40: =RC[-1]/2 -> 308649.26923076925 | F40: =RC[-1]*1.5 -> 462973.90384615387 | R40: 615703 | S40: =RC[-1]/1.5 -> 410468.66666666669 | T40: 46574600 | U40: =RC[-1]*1000/RC[-3] -> 75644.588381086331 | Y40: =((RC[-4]*100/R[-1]C[-4])-100)-RC[57] -> 5.9392367038842799 | Z40: 4.0391181818181821 | AE40: 13289.187559203525 | AI40: 433 | AL40: 140616 | AM40: 82802 | AN40: 55042 | AO40: 2772 | AP40: 144937 | AQ40: 150.93763104378507 | AR40: 8477207199.999999 | AS40: =RC[-1]/RC[-3] -> 58488.910354153864 | AT40: =RC[-1]/RC[-3] -> 387.50383154739575 | AU40: 354248 | AV40: 104.14976299989212 | AW40: 14853672299.999998 | AX40: =RC[-1]/RC[-3] -> 41930.15147580226 | AY40: =RC[-1]/RC[-3] -> 402.59478531742502 | AZ40: =RC[29]/((RC[-1]+RC[-6])/2) -> 2.2592116501646764 | BA40: =((RC[-7]+RC[-2])*100/(R[-1]C[-7]+R[-1]C[-2]))-100 -> 5.4707763066615911 | BC40: 21033759 | BD40: =RC[-1]-R[-1]C[-1] -> 390090.63015306741 | BE40: =(RC[-2]/(RC[-55]))*1000 -> 519.66002075303891 | BF40: =(RC[-3]*100/R[-1]C[-3])-100 -> 1.8896381358404852 | BG40: =(RC[-57]*100/R[-1]C[-57])-100 -> 0.52652493542618117 | BH40: =RC[-2]-RC[-1] -> 1.3631132004143041 | BI40: 42150.579999999994 | CC40: 892.5 | CD40: 3.5900000000000003 | CE40: =R[-1]C+RC[-1] -> 174.92000000000002 | CF40: =((RC[-3]*RC[-2])/100)+R[-1]C -> 423.18900000000002 | CG40: =RC[-4]-RC[-1] -> 469.31099999999998 | CH40: =RC[-5]/RC[-3]*R24C83 -> 510.23324948547906 | CI40: =RC[-6]-RC[-1] -> 382.26675051452094 | CJ40: =RC[-2]*100/R24C86 -> 250.11433798307795 | CK40: =(RC[-8]*100/R[-1]C[-8])-100 -> 9.8884186225471353 | CL40: =RC[-1]-RC[-8] -> 6.2984186225471355 | CM40: =(R[1]C[-89]*100/RC[-89])-100 -> 1.3810653226603478 | CO40: 0.47 | CP40: 10.55 | CQ40: =RC[-6]+4 -> 13.888418622547135 | CR40: =-0.06*((RC[-95]-1963)^2)+8.5*(RC[-95]-1963)+140 -> 376.36 | CS40: =RC[-1]+50 -> 426.36 | CT40: =RC[-2]-50 -> 326.36 | CU40: =RC[-3]+100 -> 476.36 | CV40: =RC[-4]-100 -> 276.36 | CW40: =-0.025*((RC[-100]-1963)^2)+5.5*(RC[-100]-1963)+175 -> 347.9
A41: 2002 | B41: 41035000 | C41: 16417960 | D41: =RC[-1]/26 -> 631460 | E41: =RC[-1]/2 -> 315730 | F41: =RC[-1]*1.5 -> 473595 | R41: 690230 | S41: =RC[-1]/1.5 -> 460153.33333333331 | T41: 58985647 | U41: =RC[-1]*1000/RC[-3] -> 85457.958941222489 | Y41: =((RC[-4]*100/R[-1]C[-4])-100)-RC[57] -> 9.9029975007568751 | Z41: 3.4943 | AE41: 13869.014738714315 | AI41: 442 | AL41: 136544 | AM41: 82569 | AN41: 50771 | AO41: 3204 | AP41: 145368 | AQ41: 154.80400172476095 | AR41: 9087576399.9999981 | AS41: =RC[-1]/RC[-3] -> 62514.283748830538 | AT41: =RC[-1]/RC[-3] -> 403.82860295808075 | AU41: 375292 | AV41: 103.38487494805224 | AW41: 16380710700 | AX41: =RC[-1]/RC[-3] -> 43647.908028948128 | AY41: =RC[-1]/RC[-3] -> 422.1885266184234 | AZ41: =RC[29]/((RC[-1]+RC[-6])/2) -> 2.4424432953761679 | BA41: =((RC[-7]+RC[-2])*100/(R[-1]C[-7]+R[-1]C[-2]))-100 -> 4.5460796848640541 | BC41: 21487307 | BD41: =RC[-1]-R[-1]C[-1] -> 453548 | BE41: =(RC[-2]/(RC[-55]))*1000 -> 523.63365419763613 | BF41: =(RC[-3]*100/R[-1]C[-3])-100 -> 2.1562859971914605 | BG41: =(RC[-57]*100/R[-1]C[-57])-100 -> 1.3810653226603478 | BH41: =RC[-2]-RC[-1] -> 0.77522067453111276 | BI41: 44119.82 | CC41: 1008.75 | CD41: 3.0700000000000003 | CE41: =R[-1]C+RC[-1] -> 177.99 | CF41: =((RC[-3]*RC[-2])/100)+R[-1]C -> 454.15762500000005 | CG41: =RC[-4]-RC[-1] -> 554.59237499999995 | CH41: =RC[-5]/RC[-3]*R24C83 -> 566.74532277094215 | CI41: =RC[-6]-RC[-1] -> 442.00467722905785 | CJ41: =RC[-2]*100/R24C86 -> 277.8163346916383 | CK41: =(RC[-8]*100/R[-1]C[-8])-100 -> 13.025210084033617 | CL41: =RC[-1]-RC[-8] -> 9.9552100840336166 | CM41: =(R[1]C[-89]*100/RC[-89])-100 -> 1.9300597051297643 | CO41: 12.1 | CP41: 11.45 | CQ41: =RC[-6]+4 -> 17.025210084033617 | CR41: =-0.06*((RC[-95]-1963)^2)+8.5*(RC[-95]-1963)+140 -> 380.24 | CS41: =RC[-1]+50 -> 430.24 | CT41: =RC[-2]-50 -> 330.24 | CU41: =RC[-3]+100 -> 480.24 | CV41: =RC[-4]-100 -> 280.24 | CW41: =-0.025*((RC[-100]-1963)^2)+5.5*(RC[-100]-1963)+175 -> 351.47500000000002
A42: 2003 | B42: 41827000 | C42: 16984055 | D42: =RC[-1]/26 -> 653232.88461538462 | E42: =RC[-1]/2 -> 326616.44230769231 | F42: =RC[-1]*1.5 -> 489924.6634615385 | G42: 718536 | H42: =RC[-1]/2 -> 359268 | I42: 643990 | J42: =RC[-1]/2 -> 321995 | K42: 519454 | L42: =RC[-1]/2 -> 259727 | M42: =(R[1]C*((RC[5]*100/R[1]C[5])/100)) -> 619193.03303763864 | N42: =R[1]C*0.97 -> 116138.90786547 | R42: 989439 | S42: =RC[-1]/2 -> 494719.5 | T42: 96175561 | U42: =RC[-1]*1000/RC[-3] -> 97202.112510220439 | X42: =RC[-6]/RC[-11] -> 1.5979491809622079 | Y42: =((RC[-4]*100/R[-1]C[-4])-100)-RC[57] -> 10.70260948248896 | Z42: 2.3030454545454542 | AA42: 4.3099999999999996 | AB42: 2.9 | AC42: 97.1 | AD42: 23 | AE42: 14544.28237935013 | AF42: =RC[-11]/RC[-1] -> 6.6831838089328706 | AG42: =RC[-12]/5 -> 19440.422502044086 | AH42: =100-((RC[-3]*100)/RC[-1]) -> 25.185358611311784 | AI42: 451 | AL42: 152785 | AM42: 94476 | AN42: 54505 | AO42: 3804 | AP42: 183411 | AQ42: 151.72747698417351 | AR42: 11731425600 | AS42: =RC[-1]/RC[-3] -> 63962.497342035102 | AT42: =RC[-1]/RC[-3] -> 421.56172773311812 | AU42: 448260 | AV42: 101.16659898776612 | AW42: 20112128800 | AX42: =RC[-1]/RC[-3] -> 44867.105697586223 | AY42: =RC[-1]/RC[-3] -> 443.49722286316961 | AZ42: =RC[29]/((RC[-1]+RC[-6])/2) -> 2.6970705272649567 | BA42: =((RC[-7]+RC[-2])*100/(R[-1]C[-7]+R[-1]C[-2]))-100 -> 4.7265146958635285 | BC42: 21926409 | BD42: =RC[-1]-R[-1]C[-1] -> 439102 | BE42: =(RC[-2]/(RC[-55]))*1000 -> 524.21663040619694 | BF42: =(RC[-3]*100/R[-1]C[-3])-100 -> 2.0435413334951704 | BG42: =(RC[-57]*100/R[-1]C[-57])-100 -> 1.9300597051297643 | BH42: =RC[-2]-RC[-1] -> 0.1134816283654061 | BI42: 46223.24 | CC42: 1166.5625 | CD42: 3.04 | CE42: =R[-1]C+RC[-1] -> 181.03 | CF42: =((RC[-3]*RC[-2])/100)+R[-1]C -> 489.62112500000006 | CG42: =RC[-4]-RC[-1] -> 676.94137499999988 | CH42: =RC[-5]/RC[-3]*R24C83 -> 644.40286140418721 | CI42: =RC[-6]-RC[-1] -> 522.15963859581279 | CJ42: =RC[-2]*100/R24C86 -> 315.88375559028782 | CK42: =(RC[-8]*100/R[-1]C[-8])-100 -> 15.644361833952914 | CL42: =RC[-1]-RC[-8] -> 12.604361833952915 | CM42: =(R[1]C[-89]*100/RC[-89])-100 -> 1.7213761445955953 | CO42: 14.45 | CP42: 11.49 | CQ42: =RC[-6]+4 -> 19.644361833952914 | CR42: =-0.06*((RC[-95]-1963)^2)+8.5*(RC[-95]-1963)+140 -> 384 | CS42: =RC[-1]+50 -> 434 | CT42: =RC[-2]-50 -> 334 | CU42: =RC[-3]+100 -> 484 | CV42: =RC[-4]-100 -> 284 | CW42: =-0.025*((RC[-100]-1963)^2)+5.5*(RC[-100]-1963)+175 -> 355
A43: 2004 | B43: 42547000 | C43: 17468532 | D43: =RC[-1]/26 -> 671866.61538461538 | E43: =RC[-1]/2 -> 335933.30769230769 | F43: =RC[-1]*1.5 -> 503899.9615384615 | G43: 736869 | H43: =RC[-1]/2 -> 368434.5 | I43: 674206 | J43: =RC[-1]/2 -> 337103 | K43: 523975 | L43: =RC[-1]/2 -> 261987.5 | M43: =(R[1]C*((RC[5]*100/R[1]C[5])/100)) -> 693178.48977713939 | N43: =R[1]C*0.97 -> 119730.832851 | R43: 1107664 | S43: =RC[-1]/2 -> 553832 | T43: 122147451 | U43: =RC[-1]*1000/RC[-3] -> 110274.82250935302 | X43: =RC[-6]/RC[-11] -> 1.5979491809622077 | Y43: =((RC[-4]*100/R[-1]C[-4])-100)-RC[57] -> 10.408997826830181 | Z43: 2.2788909090909093 | AA43: 3.61 | AB43: 2.9 | AC43: 97.1 | AD43: 24 | AE43: 15066.525106753867 | AF43: =RC[-11]/RC[-1] -> 7.319194155785806 | AG43: =RC[-12]/5 -> 22054.964501870603 | AH43: =100-((RC[-3]*100)/RC[-1]) -> 31.686468570484465 | AI43: 460 | AJ43: 227 | AK43: 86898 | AL43: 166437 | AM43: 102121 | AN43: 59594 | AO43: 4722 | AP43: 186728 | AQ43: 158.916614292796 | AR43: 13060840900 | AS43: =RC[-1]/RC[-3] -> 69945.808341544922 | AT43: =RC[-1]/RC[-3] -> 440.14157143238168 | AU43: 498250 | AV43: 102.45204288804246 | AW43: 23448077600 | AX43: =RC[-1]/RC[-3] -> 47060.868238835923 | AY43: =RC[-1]/RC[-3] -> 459.34533770364249 | AZ43: =RC[29]/((RC[-1]+RC[-6])/2) -> 3.0135235682347075 | BA43: =((RC[-7]+RC[-2])*100/(R[-1]C[-7]+R[-1]C[-2]))-100 -> 3.9798395838809739 | BC43: 22417950 | BD43: =RC[-1]-R[-1]C[-1] -> 491541 | BE43: =(RC[-2]/(RC[-55]))*1000 -> 526.89848873011022 | BF43: =(RC[-3]*100/R[-1]C[-3])-100 -> 2.241776115733316 | BG43: =(RC[-57]*100/R[-1]C[-57])-100 -> 1.7213761445955953 | BH43: =RC[-2]-RC[-1] -> 0.52039997113772074 | BI43: 48003.11 | CC43: 1355.3125 | CD43: 3.04 | CE43: =R[-1]C+RC[-1] -> 184.07 | CF43: =((RC[-3]*RC[-2])/100)+R[-1]C -> 530.82262500000002 | CG43: =RC[-4]-RC[-1] -> 824.48987499999998 | CH43: =RC[-5]/RC[-3]*R24C83 -> 736.30276525234967 | CI43: =RC[-6]-RC[-1] -> 619.00973474765033 | CJ43: =RC[-2]*100/R24C86 -> 360.93272806487727 | CK43: =(RC[-8]*100/R[-1]C[-8])-100 -> 16.180016072863651 | CL43: =RC[-1]-RC[-8] -> 13.140016072863652 | CM43: =(R[1]C[-89]*100/RC[-89])-100 -> 1.7604061390932344 | CN43: =(RC[-79]*100/R[-1]C[-79])-100 -> 11.94869011631846 | CO43: =(RC[-75]*100/R[-1]C[-75])-100 -> 11.948690116318446 | CP43: 10.97 | CQ43: =RC[-6]+4 -> 20.180016072863651 | CR43: =-0.06*((RC[-95]-1963)^2)+8.5*(RC[-95]-1963)+140 -> 387.64 | CS43: =RC[-1]+50 -> 437.64 | CT43: =RC[-2]-50 -> 337.64 | CU43: =RC[-3]+100 -> 487.64 | CV43: =RC[-4]-100 -> 287.64 | CW43: =-0.025*((RC[-100]-1963)^2)+5.5*(RC[-100]-1963)+175 -> 358.47500000000002
A44: 2005 | B44: 43296000 | C44: 17953604 | D44: =RC[-1]/26 -> 690523.23076923075 | E44: =RC[-1]/2 -> 345261.61538461538 | F44: =RC[-1]*1.5 -> 517892.42307692306 | G44: 771189 | H44: =RC[-1]/2 -> 385594.5 | I44: 716343 | J44: =RC[-1]/2 -> 358171.5 | K44: 526025 | L44: =RC[-1]/2 -> 263012.5 | M44: =(R[1]C*((RC[5]*100/R[1]C[5])/100)) -> 787016.8932673604 | N44: =R[1]C*0.97 -> 123433.8483 | R44: 1257613 | S44: =RC[-1]/2 -> 628806.5 | T44: 156946440 | U44: =RC[-1]*1000/RC[-3] -> 124797.08781636322 | X44: =RC[-6]/RC[-11] -> 1.5979491809622079 | Y44: =((RC[-4]*100/R[-1]C[-4])-100)-RC[57] -> 9.7991577248092945 | Z44: 2.3361545454545456 | AA44: 3.35 | AB44: 3 | AC44: 97 | AD44: 25 | AE44: 15783.0837263832 | AF44: =RC[-11]/RC[-1] -> 7.9070155097606714 | AG44: =RC[-12]/5 -> 24959.417563272644 | AH44: =100-((RC[-3]*100)/RC[-1]) -> 36.765015904827287 | AI44: 490 | AJ44: 261 | AK44: 75538 | AL44: 179257 | AM44: 107577 | AN44: 65368 | AO44: 6312 | AP44: 193468 | AQ44: 159.93556798953756 | AR44: 14401052899.999998 | AS44: =RC[-1]/RC[-3] -> 74436.355883143449 | AT44: =RC[-1]/RC[-3] -> 465.41464677833778 | AU44: 534859 | AV44: 99.557311813912108 | AW44: 25597812799.999992 | AX44: =RC[-1]/RC[-3] -> 47858.992369951695 | AY44: =RC[-1]/RC[-3] -> 480.718005518344 | AZ44: =RC[29]/((RC[-1]+RC[-6])/2) -> 3.240824627029685 | BA44: =((RC[-7]+RC[-2])*100/(R[-1]C[-7]+R[-1]C[-2]))-100 -> 5.1858167903145755 | BB44: 82.324366364621127 | BC44: 22927382 | BD44: =RC[-1]-R[-1]C[-1] -> 509432 | BE44: =(RC[-2]/(RC[-55]))*1000 -> 529.54965816703623 | BF44: =(RC[-3]*100/R[-1]C[-3])-100 -> 2.2724290133575948 | BG44: =(RC[-57]*100/R[-1]C[-57])-100 -> 1.7604061390932344 | BH44: =RC[-2]-RC[-1] -> 0.51202287426436044 | BI44: 51509.639999999992 | CC44: 1533.125 | CD44: 3.37 | CE44: =R[-1]C+RC[-1] -> 187.44 | CF44: =((RC[-3]*RC[-2])/100)+R[-1]C -> 582.48893750000002 | CG44: =RC[-4]-RC[-1] -> 950.63606249999998 | CH44: =RC[-5]/RC[-3]*R24C83 -> 817.92840375586854 | CI44: =RC[-6]-RC[-1] -> 715.19659624413146 | CJ44: =RC[-2]*100/R24C86 -> 400.94529595875906 | CK44: =(RC[-8]*100/R[-1]C[-8])-100 -> 13.119667973253399 | CL44: =RC[-1]-RC[-8] -> 9.7496679732533984 | CM44: =(R[1]C[-89]*100/RC[-89])-100 -> 1.6468033998521747 | CN44: =(RC[-79]*100/R[-1]C[-79])-100 -> 13.537408455993855 | CO44: =(RC[-75]*100/R[-1]C[-75])-100 -> 13.537408455993869 | CP44: 9.15 | CQ44: =RC[-6]+4 -> 17.119667973253399 | CR44: =-0.06*((RC[-95]-1963)^2)+8.5*(RC[-95]-1963)+140 -> 391.16 | CS44: =RC[-1]+50 -> 441.16 | CT44: =RC[-2]-50 -> 341.16 | CU44: =RC[-3]+100 -> 491.16 | CV44: =RC[-4]-100 -> 291.16000000000003 | CW44: =-0.025*((RC[-100]-1963)^2)+5.5*(RC[-100]-1963)+175 -> 361.9
A45: 2006 | B45: 44009000 | C45: 18401584 | D45: =RC[-1]/26 -> 707753.23076923075 | E45: =RC[-1]/2 -> 353876.61538461538 | F45: =RC[-1]*1.5 -> 530814.92307692301 | G45: 792819 | H45: =RC[-1]/2 -> 396409.5 | I45: 714420 | J45: =RC[-1]/2 -> 357210 | K45: 554330 | L45: =RC[-1]/2 -> 277165 | M45: =(R[1]C*((RC[5]*100/R[1]C[5])/100)) -> 839933.46971886128 | N45: =R[1]C*0.97 -> 127251.39 | R45: 1342171 | S45: 650836 | T45: 188339112 | U45: =RC[-1]*1000/RC[-3] -> 140324.22992301278 | V45: 44335 | W45: 17733 | X45: =RC[-6]/RC[-11] -> 1.5979491809622082 | Y45: =((RC[-4]*100/R[-1]C[-4])-100)-RC[57] -> 8.9219106073192158 | Z45: 3.491090909090909 | AA45: 3.76 | AB45: 2.2999999999999998 | AC45: 97.7 | AD45: 27 | AE45: 16394.110912608547 | AF45: =RC[-11]/RC[-1] -> 8.5594290944494471 | AG45: =RC[-12]/5 -> 28064.845984602558 | AH45: =100-((RC[-3]*100)/RC[-1]) -> 41.58488907581043 | AI45: 513 | AJ45: 269 | AK45: 58479 | AL45: 181702 | AM45: 113041 | AN45: 60548 | AO45: 8113 | AP45: 165988 | AQ45: 166.23240380210862 | AR45: 14037838399.999998 | AS45: =RC[-1]/RC[-3] -> 84571.405161818911 | AT45: =RC[-1]/RC[-3] -> 508.75402886248912 | AU45: 699162 | AV45: 99.186175801707236 | AW45: 35593133099.999992 | AX45: =RC[-1]/RC[-3] -> 50908.277480755525 | AY45: =RC[-1]/RC[-3] -> 513.2598073196333 | AZ45: =RC[29]/((RC[-1]+RC[-6])/2) -> 3.3255420618340281 | BA45: =((RC[-7]+RC[-2])*100/(R[-1]C[-7]+R[-1]C[-2]))-100 -> 8.0201421757555522 | BB45: 85.808933073493904 | BC45: 23493772 | BD45: =RC[-1]-R[-1]C[-1] -> 566390 | BE45: =(RC[-2]/(RC[-55]))*1000 -> 533.84016905632939 | BF45: =(RC[-3]*100/R[-1]C[-3])-100 -> 2.4703649112663584 | BG45: =(RC[-57]*100/R[-1]C[-57])-100 -> 1.6468033998521747 | BH45: =RC[-2]-RC[-1] -> 0.82356151141418366 | BI45: 55896.39 | BV45: 9.15 | CC45: 1699.375 | CD45: 3.52 | CE45: =R[-1]C+RC[-1] -> 190.96 | CF45: =((RC[-3]*RC[-2])/100)+R[-1]C -> 642.3069375 | CG45: =RC[-4]-RC[-1] -> 1057.0680625 | CH45: =RC[-5]/RC[-3]*R24C83 -> 889.91149979053205 | CI45: =RC[-6]-RC[-1] -> 809.46350020946795 | CJ45: =RC[-2]*100/R24C86 -> 436.23112734830005 | CK45: =(RC[-8]*100/R[-1]C[-8])-100 -> 10.843864655523845 | CL45: =RC[-1]-RC[-8] -> 7.3238646555238454 | CM45: =(R[1]C[-89]*100/RC[-89])-100 -> 1.7610034311163645 | CN45: =(RC[-79]*100/R[-1]C[-79])-100 -> 6.7236900381913927 | CO45: =(RC[-75]*100/R[-1]C[-75])-100 -> 6.7236900381913927 | CP45: 8.4499999999999993 | CQ45: =RC[-6]+4 -> 14.843864655523845 | CR45: =-0.06*((RC[-95]-1963)^2)+8.5*(RC[-95]-1963)+140 -> 394.56 | CS45: =RC[-1]+50 -> 444.56 | CT45: =RC[-2]-50 -> 344.56 | CU45: =RC[-3]+100 -> 494.56 | CV45: =RC[-4]-100 -> 294.56 | CW45: =-0.025*((RC[-100]-1963)^2)+5.5*(RC[-100]-1963)+175 -> 365.27499999999998
A46: 2007 | B46: 44784000 | C46: 18807430 | D46: =RC[-1]/26 -> 723362.69230769225 | E46: =RC[-1]/2 -> 361681.34615384613 | F46: =RC[-1]*1.5 -> 542522.01923076925 | G46: 813429 | H46: =RC[-1]/2 -> 406714.5 | I46: 742545 | J46: =RC[-1]/2 -> 371272.5 | K46: 574966 | L46: =RC[-1]/2 -> 287483 | M46: 775300 | N46: 131187 | O46: 19567 | P46: 11231 | Q46: 244856 | R46: 1238890 | S46: 640693 | T46: 184427159 | U46: =RC[-1]*1000/RC[-3] -> 148864.83787906918 | V46: 55159 | W46: 23084 | X46: =RC[-6]/RC[-11] -> 1.5979491809622082 | Y46: =((RC[-4]*100/R[-1]C[-4])-100)-RC[57] -> 3.2963387319083131 | Z46: 4.4847090909090914 | AA46: 4.6399999999999997 | AB46: 1.9 | AC46: 98.1 | AD46: 28 | AE46: 16941.921292094805 | AF46: =RC[-11]/RC[-1] -> 8.7867742573287924 | AG46: =RC[-12]/5 -> 29772.967575813836 | AH46: =100-((RC[-3]*100)/RC[-1]) -> 43.096296165459748 | AI46: 540 | AJ46: 279 | AK46: 46437 | AL46: 151730 | AM46: 86357 | AN46: 58193 | AO46: 7180 | AP46: 101152 | AQ46: 167.6163251138089 | AR46: 9562511100 | AS46: =RC[-1]/RC[-3] -> 94536.055639038284 | AT46: =RC[-1]/RC[-3] -> 564.00267441044161 | AU46: 550093 | AV46: 98.261833760132035 | AW46: 29850899100 | AX46: =RC[-1]/RC[-3] -> 54265.186250324943 | AY46: =RC[-1]/RC[-3] -> 552.25090122775691 | AZ46: =RC[29]/((RC[-1]+RC[-6])/2) -> 3.2077941292322016 | BA46: =((RC[-7]+RC[-2])*100/(R[-1]C[-7]+R[-1]C[-2]))-100 -> 9.2209846990058395 | BB46: 90.622368038503751 | BC46: 24034966 | BD46: =RC[-1]-R[-1]C[-1] -> 541194 | BE46: =(RC[-2]/(RC[-55]))*1000 -> 536.68645051804219 | BF46: =(RC[-3]*100/R[-1]C[-3])-100 -> 2.3035636848778438 | BG46: =(RC[-57]*100/R[-1]C[-57])-100 -> 1.7610034311163645 | BH46: =RC[-2]-RC[-1] -> 0.54256025376147932 | BI46: 55997.069999999992 | BV46: 8.4499999999999993 | BW46: =((RC[-1]*100)/R[-1]C[-1])-100 -> -7.6502732240437297 | BX46: =RC[4]/(RC[-2]*12) -> 19.970414201183434 | BY46: =100/RC[-1] -> 5.0074074074074071 | BZ46: =RC[2]/((RC[-4]*12)*0.75) -> 26.627218934911244 | CA46: =100/RC[-1] -> 3.7555555555555551 | CB46: =AVERAGE(Quarterly!R[-44]C[-76]:R[-41]C[-76]) -> 2025 | CC46: 1790.3558333333333 | CD46: 2.79 | CE46: =R[-1]C+RC[-1] -> 193.75 | CF46: =((RC[-3]*RC[-2])/100)+R[-1]C -> 692.25786525000001 | CG46: =RC[-4]-RC[-1] -> 1098.0979680833334 | CH46: =RC[-5]/RC[-3]*R24C83 -> 924.05462365591404 | CI46: =RC[-6]-RC[-1] -> 866.30120967741925 | CJ46: =RC[-2]*100/R24C86 -> 452.96795277250686 | CK46: =(RC[-8]*100/R[-1]C[-8])-100 -> 5.3537820277062735 | CL46: =RC[-1]-RC[-8] -> 2.5637820277062735 | CM46: =(R[1]C[-89]*100/RC[-89])-100 -> 1.9739192568774513 | CN46: =(RC[-79]*100/R[-1]C[-79])-100 -> -7.6950701512698458 | CO46: =(RC[-75]*100/R[-1]C[-75])-100 -> -7.6950701512698458 | CP46: 8.23 | CQ46: =(RC[-16]+RC[-6]) -> 9.1093375832618282 | CR46: =-0.06*((RC[-95]-1963)^2)+8.5*(RC[-95]-1963)+140 -> 397.84000000000003 | CS46: =RC[-1]+50 -> 447.84000000000003 | CT46: =RC[-2]-50 -> 347.84000000000003 | CU46: =RC[-3]+100 -> 497.84000000000003 | CV46: =RC[-4]-100 -> 297.84000000000003 | CW46: =-0.025*((RC[-100]-1963)^2)+5.5*(RC[-100]-1963)+175 -> 368.6
A47: 2008 | B47: 45668000 | C47: 19246126 | D47: =RC[-1]/26 -> 740235.61538461538 | E47: =RC[-1]/2 -> 370117.80769230769 | F47: =RC[-1]*1.5 -> 555176.7115384615 | G47: 817295 | H47: =RC[-1]/2 -> 408647.5 | I47: 760332 | J47: =RC[-1]/2 -> 380166 | K47: 620629 | L47: =RC[-1]/2 -> 310314.5 | M47: 552080 | N47: 130481 | O47: 23507 | P47: 10653 | Q47: 208499 | R47: 836419 | S47: 481028 | T47: 116809939 | U47: =RC[-1]*1000/RC[-3] -> 139654.81295857698 | V47: 59375 | W47: 43992 | X47: =RC[-6]/RC[-11] -> 1.5150322417041009 | Y47: =((RC[-4]*100/R[-1]C[-4])-100)-RC[57] -> -10.266837033990514 | Z47: 4.8421636363636358 | AA47: 5.12 | AB47: 2.1 | AC47: 97.9 | AD47: 27 | AE47: 17512.579556614142 | AF47: =RC[-11]/RC[-1] -> 7.9745426712898055 | AG47: =RC[-12]/5 -> 27930.962591715397 | AH47: =100-((RC[-3]*100)/RC[-1]) -> 37.300479712759532 | AI47: 570 | AJ47: 254.63333333333335 | AK47: 31479 | AL47: 108332 | AM47: 50959 | AN47: 53623 | AO47: 3750 | AP47: 53031 | AQ47: 172.45045712159359 | AR47: 5718860600.000001 | AS47: =RC[-1]/RC[-3] -> 107839.95398917617 | AT47: =RC[-1]/RC[-3] -> 625.33875403495733 | AU47: 211758 | AV47: 97.004441921524517 | AW47: 12685046799.999998 | AX47: =RC[-1]/RC[-3] -> 59903.506833271931 | AY47: =RC[-1]/RC[-3] -> 617.53364739455105 | AZ47: =RC[29]/((RC[-1]+RC[-6])/2) -> 2.8418041915949028 | BA47: =((RC[-7]+RC[-2])*100/(R[-1]C[-7]+R[-1]C[-2]))-100 -> 11.343195538604917 | BB47: 95.253208100834399 | BC47: 24569715 | BD47: =RC[-1]-R[-1]C[-1] -> 534749 | BE47: =(RC[-2]/(RC[-55]))*1000 -> 538.00724796356315 | BF47: =(RC[-3]*100/R[-1]C[-3])-100 -> 2.2248793694985949 | BG47: =(RC[-57]*100/R[-1]C[-57])-100 -> 1.9739192568774513 | BH47: =RC[-2]-RC[-1] -> 0.25096011262114359 | BI47: 42695.54 | BV47: 8 | BW47: =((RC[-1]*100)/R[-1]C[-1])-100 -> -5.325443786982234 | BX47: =RC[4]/(RC[-2]*12) -> 20.627604166666668 | BY47: =100/RC[-1] -> 4.8478727433404867 | BZ47: =RC[2]/((RC[-4]*12)*0.75) -> 27.503472222222221 | CA47: =100/RC[-1] -> 3.6359045575053655 | CB47: =AVERAGE(Quarterly!R[-41]C[-76]:R[-38]C[-76]) -> 1980.25 | CC47: 1766 | CD47: 4.08 | CE47: =R[-1]C+RC[-1] -> 197.83 | CF47: =((RC[-3]*RC[-2])/100)+R[-1]C -> 764.31066525000006 | CG47: =RC[-4]-RC[-1] -> 1001.6893347499999 | CH47: =RC[-5]/RC[-3]*R24C83 -> 892.68563918515883 | CI47: =RC[-6]-RC[-1] -> 873.31436081484117 | CJ47: =RC[-2]*100/R24C86 -> 437.59099960056801 | CK47: =(RC[-8]*100/R[-1]C[-8])-100 -> -1.3603906486001165 | CL47: =RC[-1]-RC[-8] -> -5.4403906486001166 | CM47: =(R[1]C[-89]*100/RC[-89])-100 -> 1.2503284575632847 | CN47: =(RC[-79]*100/R[-1]C[-79])-100 -> -28.791435573326453 | CO47: =(RC[-75]*100/R[-1]C[-75])-100 -> -32.486419294691217 | CP47: 11.25 | CQ47: =(RC[-16]+RC[-6]) -> 2.275513908905249 | CR47: =-0.06*((RC[-95]-1963)^2)+8.5*(RC[-95]-1963)+140 -> 401 | CS47: =RC[-1]+50 -> 451 | CT47: =RC[-2]-50 -> 351 | CU47: =RC[-3]+100 -> 501 | CV47: =RC[-4]-100 -> 301 | CW47: =-0.025*((RC[-100]-1963)^2)+5.5*(RC[-100]-1963)+175 -> 371.875
A48: 2009 | B48: 46239000 | C48: 19428733 | D48: =RC[-1]/26 -> 747258.9615384615 | E48: =RC[-1]/2 -> 373629.48076923075 | F48: =RC[-1]*1.5 -> 560444.22115384613 | G48: 816375 | H48: =RC[-1]/2 -> 408187.5 | I48: 764551 | J48: =RC[-1]/2 -> 382275.5 | K48: 638318 | L48: =RC[-1]/2 -> 319159 | M48: 413393 | N48: 122546 | O48: 22765 | P48: 7512 | Q48: 200749 | R48: 650889 | S48: 360397 | T48: 76677074 | U48: =RC[-1]*1000/RC[-3] -> 117803.61013936324 | V48: 70471 | W48: 27640 | X48: =RC[-6]/RC[-11] -> 1.5745041643182154 | Y48: =((RC[-4]*100/R[-1]C[-4])-100)-RC[57] -> -15.356580562672782 | Z48: 1.5266454545454544 | AA48: 4.34 | AB48: 3.1 | AC48: 96.9 | AD48: 24 | AE48: 17213.60358419663 | AF48: =RC[-11]/RC[-1] -> 6.8436344291973663 | AG48: =RC[-12]/5 -> 23560.722027872649 | AH48: =100-((RC[-3]*100)/RC[-1]) -> 26.93940549091532 | AI48: 600 | AJ48: 239.02499999999998 | AK48: 22656 | AL48: 89108 | AM48: 31595 | AN48: 55012 | AO48: 2501 | AP48: 27072 | AQ48: 183.24247835965181 | AR48: 3199472400.0000005 | AS48: =RC[-1]/RC[-3] -> 118183.82092198584 | AT48: =RC[-1]/RC[-3] -> 644.95864703393329 | AU48: 83750 | AV48: 99.153449626823587 | AW48: 5318232000 | AX48: =RC[-1]/RC[-3] -> 63501.277611940299 | AY48: =RC[-1]/RC[-3] -> 640.43437571698519 | AZ48: =RC[29]/((RC[-1]+RC[-6])/2) -> 2.6326578253535038 | BA48: =((RC[-7]+RC[-2])*100/(R[-1]C[-7]+R[-1]C[-2]))-100 -> 3.4211574150736936 | BB48: 96.384006819595854 | BC48: 24908126 | BD48: =RC[-1]-R[-1]C[-1] -> 338411 | BE48: =(RC[-2]/(RC[-55]))*1000 -> 538.68219468414111 | BF48: =(RC[-3]*100/R[-1]C[-3])-100 -> 1.3773501239228807 | BG48: =(RC[-57]*100/R[-1]C[-57])-100 -> 1.2503284575632847 | BH48: =RC[-2]-RC[-1] -> 0.127021666359596 | BI48: 28911.140000000003 | BV48: 7.65 | BW48: =((RC[-1]*100)/R[-1]C[-1])-100 -> -4.375 | BX48: =RC[4]/(RC[-2]*12) -> 20.687182280319533 | BY48: =100/RC[-1] -> 4.8339110974593007 | BZ48: =RC[2]/((RC[-4]*12)*0.75) -> 27.582909707092714 | CA48: =100/RC[-1] -> 3.6254333230944753 | CB48: =AVERAGE(Quarterly!R[-38]C[-76]:R[-35]C[-76]) -> 1899.0833333333335 | CC48: 1692 | CD48: -0.28999999999999998 | CE48: =R[-1]C+RC[-1] -> 197.54000000000002 | CF48: =((RC[-3]*RC[-2])/100)+R[-1]C -> 759.40386525000008 | CG48: =RC[-4]-RC[-1] -> 932.59613474999992 | CH48: =RC[-5]/RC[-3]*R24C83 -> 856.5353852384327 | CI48: =RC[-6]-RC[-1] -> 835.4646147615673 | CJ48: =RC[-2]*100/R24C86 -> 419.8702868815846 | CK48: =(RC[-8]*100/R[-1]C[-8])-100 -> -4.1902604756511863 | CL48: =RC[-1]-RC[-8] -> -3.9002604756511863 | CM48: =(R[1]C[-89]*100/RC[-89])-100 -> 0.53418110253250006 | CN48: =(RC[-79]*100/R[-1]C[-79])-100 -> -25.120815823793649 | CO48: =(RC[-75]*100/R[-1]C[-75])-100 -> -22.181466465969805 | CP48: 17.86 | CQ48: =(RC[-16]+RC[-6]) -> -0.56482715255671101 | CR48: =-0.06*((RC[-95]-1963)^2)+8.5*(RC[-95]-1963)+140 -> 404.04 | CS48: =RC[-1]+50 -> 454.04 | CT48: =RC[-2]-50 -> 354.04 | CU48: =RC[-3]+100 -> 504.04 | CV48: =RC[-4]-100 -> 304.04000000000002 | CW48: =-0.025*((RC[-100]-1963)^2)+5.5*(RC[-100]-1963)+175 -> 375.1
A49: 2010 | B49: 46486000 | C49: 19403020 | D49: =RC[-1]/26 -> 746270 | E49: =RC[-1]/2 -> 373135 | F49: =RC[-1]*1.5 -> 559702.5 | G49: 779876 | H49: =RC[-1]/2 -> 389938 | I49: 771872 | J49: =RC[-1]/2 -> 385936 | K49: 652384 | L49: =RC[-1]/2 -> 326192 | M49: 439591 | N49: 132407 | O49: 21986 | P49: 5885 | Q49: 194221 | R49: 607535 | S49: 370543 | T49: 71041231 | U49: =RC[-1]*1000/RC[-3] -> 116933.56102940571 | V49: 57697 | W49: 23852 | X49: =RC[-6]/RC[-11] -> 1.3820460382491908 | Y49: =((RC[-4]*100/R[-1]C[-4])-100)-RC[57] -> -2.5385589532682813 | Z49: 1.361181818181818 | AA49: 3.59 | AB49: 2.7 | AC49: 97.3 | AD49: 24 | AE49: 17210.40711623021 | AF49: =RC[-11]/RC[-1] -> 6.7943518267578895 | AG49: =RC[-12]/5 -> 23386.712205881144 | AH49: =100-((RC[-3]*100)/RC[-1]) -> 26.409462926121591 | AI49: 624 | AJ49: 208.47500000000002 | AK49: 21220 | AL49: 89788 | AM49: 29715 | AN49: 56957 | AO49: 3116 | AP49: 24633 | AQ49: 188.56656918891656 | AR49: 3009437099.999999 | AS49: =RC[-1]/RC[-3] -> 122170.95359883079 | AT49: =RC[-1]/RC[-3] -> 647.89296493183303 | AU49: 66994 | AV49: 100.52870557289202 | AW49: 4380167900 | AX49: =RC[-1]/RC[-3] -> 65381.495357793232 | AY49: =RC[-1]/RC[-3] -> 650.37637742570939 | AZ49: =RC[29]/((RC[-1]+RC[-6])/2) -> 2.5603315826313127 | BA49: =((RC[-7]+RC[-2])*100/(R[-1]C[-7]+R[-1]C[-2]))-100 -> 1.0017418313868518 | BB49: 96.803079050758882 | BC49: 25106251 | BD49: =RC[-1]-R[-1]C[-1] -> 198125 | BE49: =(RC[-2]/(RC[-55]))*1000 -> 540.08198167190119 | BF49: =(RC[-3]*100/R[-1]C[-3])-100 -> 0.79542314825290816 | BG49: =(RC[-57]*100/R[-1]C[-57])-100 -> 0.53418110253250006 | BH49: =RC[-2]-RC[-1] -> 0.2612420457204081 | BI49: 24456.010000000002 | BV49: 7.65 | BW49: =((RC[-1]*100)/R[-1]C[-1])-100 -> 0 | BX49: =RC[4]/(RC[-2]*12) -> 20.875998547567171 | BY49: =100/RC[-1] -> 4.7901900247858427 | BZ49: =RC[2]/((RC[-4]*12)*0.75) -> 27.83466473008956 | CA49: =100/RC[-1] -> 3.5926425185893822 | CB49: =AVERAGE(Quarterly!R[-35]C[-76]:R[-32]C[-76]) -> 1916.4166666666665 | CC49: 1662 | CD49: 1.7999999999999998 | CE49: =R[-1]C+RC[-1] -> 199.34000000000003 | CF49: =((RC[-3]*RC[-2])/100)+R[-1]C -> 789.31986525000013 | CG49: =RC[-4]-RC[-1] -> 872.68013474999987 | CH49: =RC[-5]/RC[-3]*R24C83 -> 833.7513795525233 | CI49: =RC[-6]-RC[-1] -> 828.2486204474767 | CJ49: =RC[-2]*100/R24C86 -> 408.70165664339379 | CK49: =(RC[-8]*100/R[-1]C[-8])-100 -> -1.7730496453900741 | CL49: =RC[-1]-RC[-8] -> -3.573049645390074 | CM49: =(R[1]C[-89]*100/RC[-89])-100 -> 0.38936453986146091 | CN49: =(RC[-79]*100/R[-1]C[-79])-100 -> 6.3373109849465266 | CO49: =(RC[-75]*100/R[-1]C[-75])-100 -> -6.6607363160231614 | CP49: 19.86 | CQ49: =(RC[-16]+RC[-6]) -> 1.8195928731993081 | CR49: =-0.06*((RC[-95]-1963)^2)+8.5*(RC[-95]-1963)+140 -> 406.96000000000004 | CS49: =RC[-1]+50 -> 456.96000000000004 | CT49: =RC[-2]-50 -> 356.96000000000004 | CU49: =RC[-3]+100 -> 506.96000000000004 | CV49: =RC[-4]-100 -> 306.96000000000004 | CW49: =-0.025*((RC[-100]-1963)^2)+5.5*(RC[-100]-1963)+175 -> 378.27499999999998
A50: 2011 | B50: 46667000 | C50: 19304501 | D50: =RC[-1]/26 -> 742480.80769230775 | E50: =RC[-1]/2 -> 371240.40384615387 | F50: =RC[-1]*1.5 -> 556860.60576923075 | G50: 754073 | H50: =RC[-1]/2 -> 377036.5 | I50: 780597 | J50: =RC[-1]/2 -> 390298.5 | K50: 670579 | L50: =RC[-1]/2 -> 335289.5 | M50: 359824 | N50: 134536 | O50: 18875 | P50: 4310 | Q50: 191539 | R50: 408461 | S50: 320866 | T50: 45715937 | U50: =RC[-1]*1000/RC[-3] -> 111922.40385250979 | V50: 38155 | W50: 16266 | X50: =RC[-6]/RC[-11] -> 1.1351688603317178 | Y50: =((RC[-4]*100/R[-1]C[-4])-100)-RC[57] -> -7.4854738475259071 | Z50: 2.0471727272727271 | AA50: 3.75 | AB50: 3.4 | AC50: 96.6 | AD50: 24 | AE50: 17290.887015308257 | AF50: =RC[-11]/RC[-1] -> 6.472912798135849 | AG50: =RC[-12]/5 -> 22384.480770501956 | AH50: =100-((RC[-3]*100)/RC[-1]) -> 22.755023033216759 | AI50: 633 | AJ50: 194.6 | AK50: 16796 | AL50: 76339 | AM50: 24285 | AN50: 49199 | AO50: 2855 | AP50: 19914 | AQ50: 189.77535706948277 | AR50: 2440981800.0000005 | AS50: =RC[-1]/RC[-3] -> 122576.16752033748 | AT50: =RC[-1]/RC[-3] -> 645.90139316907448 | AU50: 58346 | AV50: 104.08889406620307 | AW50: 3923135000 | AX50: =RC[-1]/RC[-3] -> 67239.142357659483 | AY50: =RC[-1]/RC[-3] -> 645.9780648153851 | AZ50: =RC[29]/((RC[-1]+RC[-6])/2) -> 2.3810271004688444 | BA50: =((RC[-7]+RC[-2])*100/(R[-1]C[-7]+R[-1]C[-2]))-100 -> -0.49218480053448843 | BB50: 100.27227714631812 | BC50: 25249053 | BD50: =RC[-1]-R[-1]C[-1] -> 142802 | BE50: =(RC[-2]/(RC[-55]))*1000 -> 541.04727109092073 | BF50: =(RC[-3]*100/R[-1]C[-3])-100 -> 0.5687906171255861 | BG50: =(RC[-57]*100/R[-1]C[-57])-100 -> 0.38936453986146091 | BH50: =RC[-2]-RC[-1] -> 0.17942607726412518 | BI50: 20441.07 | BJ50: 12.77 | BK50: =100-(RC[-1]+RC[1]) -> 81.961308000000002 | BL50: =(RC[1]*(100-RC[-2]))/100 -> 5.2686919999999997 | BM50: 6.04 | BV50: 7.9 | BW50: =((RC[-1]*100)/R[-1]C[-1])-100 -> 3.2679738562091387 | BX50: =RC[4]/(RC[-2]*12) -> 20.683895921237688 | BY50: =100/RC[-1] -> 4.8346791330216758 | BZ50: =RC[2]/((RC[-4]*12)*0.75) -> 27.578527894983587 | CA50: =100/RC[-1] -> 3.6260093497662562 | CB50: =AVERAGE(Quarterly!R[-32]C[-76]:R[-29]C[-76]) -> 1960.8333333333333 | CC50: 1538 | CD50: 3.2 | CE50: =R[-1]C+RC[-1] -> 202.54000000000002 | CF50: =((RC[-3]*RC[-2])/100)+R[-1]C -> 838.53586525000014 | CG50: =RC[-4]-RC[-1] -> 699.46413474999986 | CH50: =RC[-5]/RC[-3]*R24C83 -> 759.35617655771694 | CI50: =RC[-6]-RC[-1] -> 778.64382344228306 | CJ50: =RC[-2]*100/R24C86 -> 372.23341988123383 | CK50: =(RC[-8]*100/R[-1]C[-8])-100 -> -7.4608904933814699 | CL50: =RC[-1]-RC[-8] -> -10.660890493381469 | CM50: =(R[1]C[-89]*100/RC[-89])-100 -> 0.32356911736344784 | CN50: =(RC[-79]*100/R[-1]C[-79])-100 -> -18.145730918057922 | CO50: =(RC[-75]*100/R[-1]C[-75])-100 -> -32.76749487683837 | CP50: 21.39 | CQ50: =(RC[-16]+RC[-6]) -> -3.8348811436152137 | CR50: =-0.06*((RC[-95]-1963)^2)+8.5*(RC[-95]-1963)+140 -> 409.76 | CS50: =RC[-1]+50 -> 459.76 | CT50: =RC[-2]-50 -> 359.76 | CU50: =RC[-3]+100 -> 509.76 | CV50: =RC[-4]-100 -> 309.76 | CW50: =-0.025*((RC[-100]-1963)^2)+5.5*(RC[-100]-1963)+175 -> 381.4
A51: 2012 | B51: 46818000 | C51: 19150018 | D51: =RC[-1]/26 -> 736539.15384615387 | E51: =RC[-1]/2 -> 368269.57692307694 | F51: =RC[-1]*1.5 -> 552404.36538461538 | G51: 712602 | H51: =RC[-1]/2 -> 356301 | I51: 789026 | J51: =RC[-1]/2 -> 394513 | K51: 666360 | L51: =RC[-1]/2 -> 333180 | M51: 318534 | N51: 136922 | O51: 19901 | P51: 2890 | Q51: 201009 | R51: 273873 | S51: 294261 | T51: 28328881 | U51: =RC[-1]*1000/RC[-3] -> 103438.02054236818 | V51: 37108 | W51: 17271 | X51: =RC[-6]/RC[-11] -> 0.85979204731676995 | Y51: =((RC[-4]*100/R[-1]C[-4])-100)-RC[57] -> -10.030594249317797 | Z51: 1.0449181818181819 | AA51: 4.13 | AB51: 4.7 | AC51: 95.3 | AD51: 24 | AE51: 16365.786136376784 | AF51: =RC[-11]/RC[-1] -> 6.3203820262842738 | AG51: =RC[-12]/5 -> 20687.604108473635 | AH51: =100-((RC[-3]*100)/RC[-1]) -> 20.890857875256017 | AI51: 641 | AJ51: 182.22499999999999 | AK51: 14908 | AL51: 60670 | AM51: 18289 | AN51: 40094 | AO51: 2287 | AP51: 14515 | AQ51: 196.6635838317799 | AR51: 1816255299.9999998 | AS51: =RC[-1]/RC[-3] -> 125129.54185325524 | AT51: =RC[-1]/RC[-3] -> 636.26188140803572 | AU51: 29611 | AV51: 108.01988521501141 | AW51: 2082608800.0000002 | AX51: =RC[-1]/RC[-3] -> 70332.268413765167 | AY51: =RC[-1]/RC[-3] -> 651.10482457716182 | AZ51: =RC[29]/((RC[-1]+RC[-6])/2) -> 2.1190543357359184 | BA51: =((RC[-7]+RC[-2])*100/(R[-1]C[-7]+R[-1]C[-2]))-100 -> -0.34931680129837162 | BB51: 101.29567221861966 | BC51: 25382415 | BD51: =RC[-1]-R[-1]C[-1] -> 133362 | BE51: =(RC[-2]/(RC[-55]))*1000 -> 542.15077534281681 | BF51: =(RC[-3]*100/R[-1]C[-3])-100 -> 0.52818614622893278 | BG51: =(RC[-57]*100/R[-1]C[-57])-100 -> 0.32356911736344784 | BH51: =RC[-2]-RC[-1] -> 0.20461702886548494 | BI51: 13581.800000000001 | BJ51: 18.649999999999999 | BK51: =100-(RC[-1]+RC[1]) -> 74.744380000000007 | BL51: =(RC[1]*(100-RC[-2]))/100 -> 6.6056199999999992 | BM51: 8.1199999999999992 | BV51: 7.75 | BW51: =((RC[-1]*100)/R[-1]C[-1])-100 -> -1.8987341772151893 | BX51: =RC[4]/(RC[-2]*12) -> 19.378136200716845 | BY51: =100/RC[-1] -> 5.1604550078609082 | BZ51: =RC[2]/((RC[-4]*12)*0.75) -> 25.837514934289125 | CA51: =100/RC[-1] -> 3.8703412558956818 | CB51: =AVERAGE(Quarterly!R[-29]C[-76]:R[-26]C[-76]) -> 1802.1666666666665 | CC51: 1364 | CD51: 2.4500000000000002 | CE51: =R[-1]C+RC[-1] -> 204.99 | CF51: =((RC[-3]*RC[-2])/100)+R[-1]C -> 871.95386525000015 | CG51: =RC[-4]-RC[-1] -> 492.04613474999985 | CH51: =RC[-5]/RC[-3]*R24C83 -> 665.39831211278602 | CI51: =RC[-6]-RC[-1] -> 698.60168788721398 | CJ51: =RC[-2]*100/R24C86 -> 326.17564319254217 | CK51: =(RC[-8]*100/R[-1]C[-8])-100 -> -11.313394018205457 | CL51: =RC[-1]-RC[-8] -> -13.763394018205457 | CM51: =(R[1]C[-89]*100/RC[-89])-100 -> -0.19223375624760308 | CN51: =(RC[-79]*100/R[-1]C[-79])-100 -> -11.475054471074742 | CO51: =(RC[-75]*100/R[-1]C[-75])-100 -> -32.950024604552212 | CP51: 24.79 | CQ51: =(RC[-16]+RC[-6]) -> -7.443052762309776 | CR51: =-0.06*((RC[-95]-1963)^2)+8.5*(RC[-95]-1963)+140 -> 412.44 | CS51: =RC[-1]+50 -> 462.44 | CT51: =RC[-2]-50 -> 362.44 | CU51: =RC[-3]+100 -> 512.44000000000005 | CV51: =RC[-4]-100 -> 312.44 | CW51: =-0.025*((RC[-100]-1963)^2)+5.5*(RC[-100]-1963)+175 -> 384.47500000000002
A52: 2013 | B52: 46728000 | C52: 18863926 | D52: =RC[-1]/26 -> 725535.61538461538 | E52: =RC[-1]/2 -> 362767.80769230769 | F52: =RC[-1]*1.5 -> 544151.7115384615 | G52: 671705 | H52: =RC[-1]/2 -> 335852.5 | I52: 790313 | J52: =RC[-1]/2 -> 395156.5 | K52: 679546 | L52: =RC[-1]/2 -> 339773 | M52: 312593 | N52: 132980 | O52: 15898 | P52: 2351 | Q52: 231836 | R52: 199703 | S52: 283488 | T52: 19972573 | U52: =RC[-1]*1000/RC[-3] -> 100011.38190212466 | V52: 36877 | W52: 11325 | X52: =RC[-6]/RC[-11] -> 0.63885947542011501 | Y52: =((RC[-4]*100/R[-1]C[-4])-100)-RC[57] -> -4.7227457604817324 | Z52: 0.53268181818181815 | AA52: 4.21 | AB52: 5.9 | AC52: 94.1 | AD52: 23 | AE52: 16402.678656625441 | AF52: =RC[-11]/RC[-1] -> 6.0972591121101809 | AG52: =RC[-12]/5 -> 20002.276380424933 | AH52: =100-((RC[-3]*100)/RC[-1]) -> 17.995940338681706 | AI52: 641 | AJ52: 153.52500000000001 | AK52: 14555 | AL52: 56436 | AM52: 15025 | AN52: 38894 | AO52: 2517 | AP52: 11311 | AQ52: 197.77760310692932 | AR52: 1487085500.0000002 | AS52: =RC[-1]/RC[-3] -> 131472.50464149946 | AT52: =RC[-1]/RC[-3] -> 664.74920605857619 | AU52: 22961 | AV52: 106.78645446722538 | AW52: 1620894999.9999998 | AX52: =RC[-1]/RC[-3] -> 70593.397500108869 | AY52: =RC[-1]/RC[-3] -> 661.0707121264636 | AZ52: =RC[29]/((RC[-1]+RC[-6])/2) -> 1.8856256160507345 | BA52: =((RC[-7]+RC[-2])*100/(R[-1]C[-7]+R[-1]C[-2]))-100 -> 2.9869664968859553 | BB52: 101.1237404705056 | BC52: 25441306 | BD52: =RC[-1]-R[-1]C[-1] -> 58891 | BE52: =(RC[-2]/(RC[-55]))*1000 -> 544.45527306967983 | BF52: =(RC[-3]*100/R[-1]C[-3])-100 -> 0.23201495996342203 | BG52: =(RC[-57]*100/R[-1]C[-57])-100 -> -0.19223375624760308 | BH52: =RC[-2]-RC[-1] -> 0.42424871621102511 | BI52: 10742.990000000002 | BJ52: 21.93 | BK52: =100-(RC[-1]+RC[1]) -> 69.365195 | BL52: =(RC[1]*(100-RC[-2]))/100 -> 8.7048050000000003 | BM52: 11.15 | BN52: 8893100 | BO52: 5485900 | BP52: 2939400 | BQ52: 898900 | BR52: =((RC[-4]*100)/SUM(R52C66:R52C69)) -> 48.816784045934362 | BS52: =((RC[-4]*100)/SUM(R52C66:R52C69)) -> 30.113683147337969 | BT52: =((RC[-4]*100)/SUM(R52C66:R52C69)) -> 16.135212133521431 | BU52: =((RC[-4]*100)/SUM(R52C66:R52C69)) -> 4.9343206732062379 | BV52: 7.3 | BW52: =((RC[-1]*100)/R[-1]C[-1])-100 -> -5.8064516129032313 | BX52: =RC[4]/(RC[-2]*12) -> 18.774733637747335 | BY52: =100/RC[-1] -> 5.3263072557762472 | BZ52: =RC[2]/((RC[-4]*12)*0.75) -> 25.032978183663118 | CA52: =100/RC[-1] -> 3.9947304418321843 | CB52: =AVERAGE(Quarterly!R[-26]C[-76]:R[-23]C[-76]) -> 1644.6666666666665 | CC52: 1250 | CD52: 1.41 | CE52: =R[-1]C+RC[-1] -> 206.4 | CF52: =((RC[-3]*RC[-2])/100)+R[-1]C -> 889.57886525000015 | CG52: =RC[-4]-RC[-1] -> 360.42113474999985 | CH52: =RC[-5]/RC[-3]*R24C83 -> 605.62015503875966 | CI52: =RC[-6]-RC[-1] -> 644.37984496124034 | CJ52: =RC[-2]*100/R24C86 -> 296.87262501899983 | CK52: =(RC[-8]*100/R[-1]C[-8])-100 -> -8.3577712609970689 | CL52: =RC[-1]-RC[-8] -> -9.767771260997069 | CM52: =(R[1]C[-89]*100/RC[-89])-100 -> -0.47080979284369562 | CN52: =(RC[-79]*100/R[-1]C[-79])-100 -> -1.8651070215424426 | CO52: =(RC[-75]*100/R[-1]C[-75])-100 -> -27.081895623153798 | CP52: 26.09 | CQ52: =(RC[-16]+RC[-6]) -> -4.3630408191648851 | CR52: =-0.06*((RC[-95]-1963)^2)+8.5*(RC[-95]-1963)+140 -> 415 | CS52: =RC[-1]+50 -> 465 | CT52: =RC[-2]-50 -> 365 | CU52: =RC[-3]+100 -> 515 | CV52: =RC[-4]-100 -> 315 | CW52: =-0.025*((RC[-100]-1963)^2)+5.5*(RC[-100]-1963)+175 -> 387.5
A53: 2014 | B53: 46508000 | C53: 18485411 | D53: =RC[-1]/26 -> 710977.34615384613 | E53: =RC[-1]/2 -> 355488.67307692306 | F53: =RC[-1]*1.5 -> 533233.00961538462 | G53: 619820 | H53: =RC[-1]/2 -> 309910 | I53: 795232 | J53: =RC[-1]/2 -> 397616 | K53: 698441 | L53: =RC[-1]/2 -> 349220.5 | M53: 318830 | N53: 137594 | O53: 14306 | P53: 1827 | Q53: 196646 | R53: 204302 | S53: 282360 | T53: 20890540 | U53: =RC[-1]*1000/RC[-3] -> 102253.23295905082 | V53: 33601 | W53: 9547 | X53: =RC[-6]/RC[-11] -> 0.64078662610168424 | Y53: =((RC[-4]*100/R[-1]C[-4])-100)-RC[57] -> 2.391595920672438 | Z53: 0.46862727272727284 | AA53: 3.83 | AB53: 5.4 | AC53: 94.6 | AD53: 23 | AE53: 16480.969714502153 | AF53: =RC[-11]/RC[-1] -> 6.2043213919066185 | AG53: =RC[-12]/5 -> 20450.646591810164 | AH53: =100-((RC[-3]*100)/RC[-1]) -> 19.411009131113445 | AI53: 645 | AJ53: 146.52500000000001 | AK53: 15899 | AL53: 56606 | AM53: 14934 | AN53: 39293 | AO53: 2379 | AP53: 11550 | AQ53: 198.73922895243689 | AR53: 1527021399.9999998 | AS53: =RC[-1]/RC[-3] -> 132209.645021645 | AT53: =RC[-1]/RC[-3] -> 665.24181319675927 | AU53: 23301 | AV53: 112.14759479853062 | AW53: 1719056499.9999998 | AX53: =RC[-1]/RC[-3] -> 73776.082571563442 | AY53: =RC[-1]/RC[-3] -> 657.84810368960382 | AZ53: =RC[29]/((RC[-1]+RC[-6])/2) -> 1.8940511661500588 | BA53: =((RC[-7]+RC[-2])*100/(R[-1]C[-7]+R[-1]C[-2]))-100 -> -0.2059104152254605 | BB53: 101.11235098230269 | BC53: 25492335 | BD53: =RC[-1]-R[-1]C[-1] -> 51029 | BE53: =(RC[-2]/(RC[-55]))*1000 -> 548.12795648060558 | BF53: =(RC[-3]*100/R[-1]C[-3])-100 -> 0.20057539498955634 | BG53: =(RC[-57]*100/R[-1]C[-57])-100 -> -0.47080979284369562 | BH53: =RC[-2]-RC[-1] -> 0.67138518783325196 | BI53: 10833.2 | BJ53: 15.28 | BK53: =100-(RC[-1]+RC[1]) -> 73.69792799999999 | BL53: =(RC[1]*(100-RC[-2]))/100 -> 11.022072000000001 | BM53: 13.01 | BN53: 8885000 | BO53: 5396300 | BP53: 3044500 | BQ53: 977300 | BR53: =((RC[-4]*100)/SUM(R53C66:R53C69)) -> 48.543689320388353 | BS53: =((RC[-4]*100)/SUM(R53C66:R53C69)) -> 29.482983756849933 | BT53: =((RC[-4]*100)/SUM(R53C66:R53C69)) -> 16.6337942752867 | BU53: =((RC[-4]*100)/SUM(R53C66:R53C69)) -> 5.3395326474750178 | BV53: 7.25 | BW53: =((RC[-1]*100)/R[-1]C[-1])-100 -> -0.68493150684930981 | BX53: =RC[4]/(RC[-2]*12) -> 17.995210727969351 | BY53: =100/RC[-1] -> 5.557034119337839 | BZ53: =RC[2]/((RC[-4]*12)*0.75) -> 23.993614303959134 | CA53: =100/RC[-1] -> 4.1677755895033792 | CB53: =AVERAGE(Quarterly!R[-23]C[-76]:R[-20]C[-76]) -> 1565.5833333333335 | CC53: 1253 | CD53: -0.15 | CE53: =R[-1]C+RC[-1] -> 206.25 | CF53: =((RC[-3]*RC[-2])/100)+R[-1]C -> 887.69936525000014 | CG53: =RC[-4]-RC[-1] -> 365.30063474999986 | CH53: =RC[-5]/RC[-3]*R24C83 -> 607.5151515151515 | CI53: =RC[-6]-RC[-1] -> 645.4848484848485 | CJ53: =RC[-2]*100/R24C86 -> 297.80154486036838 | CK53: =(RC[-8]*100/R[-1]C[-8])-100 -> 0.23999999999999488 | CL53: =RC[-1]-RC[-8] -> 0.38999999999999491 | CM53: =(R[1]C[-89]*100/RC[-89])-100 -> -0.12685989507181716 | CN53: =(RC[-79]*100/R[-1]C[-79])-100 -> 1.9952462147264924 | CO53: =(RC[-75]*100/R[-1]C[-75])-100 -> 2.302919835956402 | CP53: 24.44 | CQ53: =(RC[-16]+RC[-6]) -> 4.4077755895033741 | CR53: =-0.06*((RC[-95]-1963)^2)+8.5*(RC[-95]-1963)+140 -> 417.44 | CS53: =RC[-1]+50 -> 467.44 | CT53: =RC[-2]-50 -> 367.44 | CU53: =RC[-3]+100 -> 517.44000000000005 | CV53: =RC[-4]-100 -> 317.44 | CW53: =-0.025*((RC[-100]-1963)^2)+5.5*(RC[-100]-1963)+175 -> 390.47500000000002
A54: 2015 | B54: 46449000 | C54: 18171401 | D54: =RC[-1]/26 -> 698900.0384615385 | E54: =RC[-1]/2 -> 349450.01923076925 | F54: =RC[-1]*1.5 -> 524175.02884615387 | G54: 591237 | H54: =RC[-1]/2 -> 295618.5 | I54: 803340 | J54: =RC[-1]/2 -> 401670 | K54: 730731 | L54: =RC[-1]/2 -> 365365.5 | M54: 355556 | N54: 151206 | O54: 14992 | P54: 1720 | Q54: 196668 | R54: 246767 | S54: 302418 | T54: 26338940 | U54: =RC[-1]*1000/RC[-3] -> 106736.07086847107 | V54: 29029 | W54: 7055 | X54: =RC[-6]/RC[-11] -> 0.6940313199608501 | Y54: =((RC[-4]*100/R[-1]C[-4])-100)-RC[57] -> 4.8840549386008121 | Z54: 0.15673636363636365 | AA54: 3.31 | AB54: 7.4 | AC54: 92.6 | AD54: 23 | AE54: 17159.32578363661 | AF54: =RC[-11]/RC[-1] -> 6.220295145293889 | AG54: =RC[-12]/5 -> 21347.214173694214 | AH54: =100-((RC[-3]*100)/RC[-1]) -> 19.617962119002229 | AI54: 645 | AJ54: 152.875 | AK54: 15718 | AL54: 64156 | AM54: 17915 | AN54: 43700 | AO54: 2541 | AP54: 14651 | AQ54: 201.52778170772271 | AR54: 2013348599.9999998 | AS54: =RC[-1]/RC[-3] -> 137420.55832366389 | AT54: =RC[-1]/RC[-3] -> 681.89386673727188 | AU54: 35025 | AV54: 113.62321060148459 | AW54: 2698152700 | AX54: =RC[-1]/RC[-3] -> 77035.052105638824 | AY54: =RC[-1]/RC[-3] -> 677.98693328449474 | AZ54: =RC[29]/((RC[-1]+RC[-6])/2) -> 1.879576504028212 | BA54: =((RC[-7]+RC[-2])*100/(R[-1]C[-7]+R[-1]C[-2]))-100 -> 2.7806789747127567 | BB54: 100.00061646188163 | BC54: 25541915 | BD54: =RC[-1]-R[-1]C[-1] -> 49580 | BE54: =(RC[-2]/(RC[-55]))*1000 -> 549.89160154147567 | BF54: =(RC[-3]*100/R[-1]C[-3])-100 -> 0.19448983390498142 | BG54: =(RC[-57]*100/R[-1]C[-57])-100 -> -0.12685989507181716 | BH54: =RC[-2]-RC[-1] -> 0.32134972897679859 | BI54: 11491.999999999998 | BJ54: 12.71 | BK54: =100-(RC[-1]+RC[1]) -> 75.785178000000002 | BL54: =(RC[1]*(100-RC[-2]))/100 -> 11.504821999999999 | BM54: 13.18 | BN54: 8975000 | BO54: 5199800 | BP54: 3203500 | BQ54: 967900 | BR54: =((RC[-4]*100)/SUM(R54C66:R54C69)) -> 48.920212360052766 | BS54: =((RC[-4]*100)/SUM(R54C66:R54C69)) -> 28.342654064601934 | BT54: =((RC[-4]*100)/SUM(R54C66:R54C69)) -> 17.461381648515768 | BU54: =((RC[-4]*100)/SUM(R54C66:R54C69)) -> 5.2757519268295345 | BV54: 7.4 | BW54: =((RC[-1]*100)/R[-1]C[-1])-100 -> 2.0689655172413808 | BX54: =RC[4]/(RC[-2]*12) -> 17.334834834834833 | BY54: =100/RC[-1] -> 5.7687310524036386 | BZ54: =RC[2]/((RC[-4]*12)*0.75) -> 23.113113113113108 | CA54: =100/RC[-1] -> 4.3265482893027292 | CB54: =AVERAGE(Quarterly!R[-20]C[-76]:R[-17]C[-76]) -> 1539.3333333333333 | CC54: 1278 | CD54: -0.5 | CE54: =R[-1]C+RC[-1] -> 205.75 | CF54: =((RC[-3]*RC[-2])/100)+R[-1]C -> 881.30936525000016 | CG54: =RC[-4]-RC[-1] -> 396.69063474999984 | CH54: =RC[-5]/RC[-3]*R24C83 -> 621.14216281895506 | CI54: =RC[-6]-RC[-1] -> 656.85783718104494 | CJ54: =RC[-2]*100/R24C86 -> 304.48145236223286 | CK54: =(RC[-8]*100/R[-1]C[-8])-100 -> 1.9952114924181927 | CL54: =RC[-1]-RC[-8] -> 2.4952114924181927 | CM54: =(R[1]C[-89]*100/RC[-89])-100 -> -1.9376089905051685E-2 | CN54: =(RC[-79]*100/R[-1]C[-79])-100 -> 11.518991311984436 | CO54: =(RC[-75]*100/R[-1]C[-75])-100 -> 20.785405918688994 | CP54: 22.06 | CQ54: =(RC[-16]+RC[-6]) -> 6.3217597817209219 | CR54: =-0.06*((RC[-95]-1963)^2)+8.5*(RC[-95]-1963)+140 -> 419.76 | CS54: =RC[-1]+50 -> 469.76 | CT54: =RC[-2]-50 -> 369.76 | CU54: =RC[-3]+100 -> 519.76 | CV54: =RC[-4]-100 -> 319.76 | CW54: =-0.025*((RC[-100]-1963)^2)+5.5*(RC[-100]-1963)+175 -> 393.4
A55: 2016 | B55: 46440000 | C55: 17870984 | D55: =RC[-1]/26 -> 687345.5384615385 | E55: =RC[-1]/2 -> 343672.76923076925 | F55: =RC[-1]*1.5 -> 515509.15384615387 | G55: 563692 | H55: =RC[-1]/2 -> 281846 | I55: 805801 | J55: =RC[-1]/2 -> 402900.5 | K55: 719688 | L55: =RC[-1]/2 -> 359844 | M55: 405385 | N55: 159988 | O55: 16148 | P55: 1313 | Q55: 187238 | R55: 282707 | S55: 309357 | T55: 31036970 | U55: =RC[-1]*1000/RC[-3] -> 109784.93634752589 | V55: 22583 | W55: 7440 | X55: =RC[-6]/RC[-11] -> 0.69737903474474883 | Y55: =((RC[-4]*100/R[-1]C[-4])-100)-RC[57] -> 3.056452794493322 | Z55: -4.1390909090909096E-2 | AA55: 3.21 | AB55: 23.7 | AC55: 76.3 | AD55: 23 | AE55: 17620.136831208958 | AF55: =RC[-11]/RC[-1] -> 6.2306517480087749 | AG55: =RC[-12]/5 -> 21956.987269505178 | AH55: =100-((RC[-3]*100)/RC[-1]) -> 19.751573314975801 | AI55: 648 | AJ55: 160.92500000000001 | AK55: 17396 | AL55: 66417 | AM55: 19285 | AN55: 44361 | AO55: 2771 | AP55: 17134 | AQ55: 198.13151507455737 | AR55: 2337858800.0000005 | AS55: =RC[-1]/RC[-3] -> 136445.59355667097 | AT55: =RC[-1]/RC[-3] -> 688.66173816581454 | AU55: 46889 | AV55: 116.65208387727343 | AW55: 3646366499.9999995 | AX55: =RC[-1]/RC[-3] -> 77765.925910128164 | AY55: =RC[-1]/RC[-3] -> 666.64840717242259 | AZ55: =RC[29]/((RC[-1]+RC[-6])/2) -> 1.9331368609700337 | BA55: =((RC[-7]+RC[-2])*100/(R[-1]C[-7]+R[-1]C[-2]))-100 -> -0.3361070090449374 | BB55: 98.831387763584075 | BC55: 25586279 | BD55: =RC[-1]-R[-1]C[-1] -> 44364 | BE55: =(RC[-2]/(RC[-55]))*1000 -> 550.95346683893194 | BF55: =(RC[-3]*100/R[-1]C[-3])-100 -> 0.17369097031291858 | BG55: =(RC[-57]*100/R[-1]C[-57])-100 -> -1.9376089905051685E-2 | BH55: =RC[-2]-RC[-1] -> 0.19306706021797027 | BI55: 11157.839999999998 | BJ55: 12.54 | BK55: =100-(RC[-1]+RC[1]) -> 75.871549999999999 | BL55: =(RC[1]*(100-RC[-2]))/100 -> 11.58845 | BM55: 13.25 | BN55: 8963700 | BO55: 5306900 | BP55: 3190600 | BQ55: 944800 | BR55: =((RC[-4]*100)/SUM(R55C66:R55C69)) -> 48.699880473758554 | BS55: =((RC[-4]*100)/SUM(R55C66:R55C69)) -> 28.832445941540801 | BT55: =((RC[-4]*100)/SUM(R55C66:R55C69)) -> 17.334564815820929 | BU55: =((RC[-4]*100)/SUM(R55C66:R55C69)) -> 5.1331087688797128 | BV55: 7.9 | BW55: =((RC[-1]*100)/R[-1]C[-1])-100 -> 6.7567567567567579 | BX55: =RC[4]/(RC[-2]*12) -> 15.974859353023909 | BY55: =100/RC[-1] -> 6.2598360204699279 | BZ55: =RC[2]/((RC[-4]*12)*0.75) -> 21.299812470698544 | CA55: =100/RC[-1] -> 4.6948770153524464 | CB55: =AVERAGE(Quarterly!R[-17]C[-76]:R[-14]C[-76]) -> 1514.4166666666667 | CC55: 1310 | CD55: -0.2 | CE55: =R[-1]C+RC[-1] -> 205.55 | CF55: =((RC[-3]*RC[-2])/100)+R[-1]C -> 878.68936525000015 | CG55: =RC[-4]-RC[-1] -> 431.31063474999985 | CH55: =RC[-5]/RC[-3]*R24C83 -> 637.31452201410855 | CI55: =RC[-6]-RC[-1] -> 672.68547798589145 | CJ55: =RC[-2]*100/R24C86 -> 312.40907941868062 | CK55: =(RC[-8]*100/R[-1]C[-8])-100 -> 2.5039123630672862 | CL55: =RC[-1]-RC[-8] -> 2.7039123630672863 | CM55: =(R[1]C[-89]*100/RC[-89])-100 -> 0.23471145564168694 | CN55: =(RC[-79]*100/R[-1]C[-79])-100 -> 14.014388732014083 | CO55: =(RC[-75]*100/R[-1]C[-75])-100 -> 14.564346124076565 | CP55: 19.63 | CQ55: =(RC[-16]+RC[-6]) -> 7.1987893784197325 | CR55: =-0.06*((RC[-95]-1963)^2)+8.5*(RC[-95]-1963)+140 -> 421.96000000000004 | CS55: =RC[-1]+50 -> 471.96000000000004 | CT55: =RC[-2]-50 -> 371.96000000000004 | CU55: =RC[-3]+100 -> 521.96 | CV55: =RC[-4]-100 -> 321.96000000000004 | CW55: =-0.025*((RC[-100]-1963)^2)+5.5*(RC[-100]-1963)+175 -> 396.27499999999998
A56: 2017 | B56: 46549000 | C56: 17626310 | D56: =RC[-1]/26 -> 677935 | E56: =RC[-1]/2 -> 338967.5 | F56: =RC[-1]*1.5 -> 508451.25 | G56: 543363 | H56: =RC[-1]/2 -> 271681.5 | I56: 798927 | J56: =RC[-1]/2 -> 399463.5 | K56: 724119 | L56: =RC[-1]/2 -> 362059.5 | M56: 467644 | N56: 169851 | O56: 15865 | P56: 1407 | Q56: 179964 | R56: 312843 | S56: 313911 | T56: 36664867 | U56: =RC[-1]*1000/RC[-3] -> 117198.93684691683 | V56: 14469 | W56: 4572 | X56: =RC[-6]/RC[-11] -> 0.66897682852768348 | Y56: =((RC[-4]*100/R[-1]C[-4])-100)-RC[57] -> 4.7932038055947936 | Z56: -0.14981818181818179 | AA56: 2.89 | AB56: 37.799999999999997 | AC56: 62.2 | AD56: 23 | AE56: 18142.504030136399 | AF56: =RC[-11]/RC[-1] -> 6.4599096493096217 | AG56: =RC[-12]/5 -> 23439.787369383364 | AH56: =100-((RC[-3]*100)/RC[-1]) -> 22.599536658622526 | AI56: 655 | AJ56: 162.22499999999999 | AK56: 20789 | AL56: 70982 | AM56: 22041 | AN56: 45719 | AO56: 3222 | AP56: 19411 | AQ56: 199.19877171105509 | AR56: 2714055300 | AS56: =RC[-1]/RC[-3] -> 139820.47807943949 | AT56: =RC[-1]/RC[-3] -> 701.91435859983153 | AU56: 61337 | AV56: 118.89275319185471 | AW56: 4978249800 | AX56: =RC[-1]/RC[-3] -> 81162.264212465554 | AY56: =RC[-1]/RC[-3] -> 682.65106184811566 | AZ56: =RC[29]/((RC[-1]+RC[-6])/2) -> 1.9818492932693901 | BA56: =((RC[-7]+RC[-2])*100/(R[-1]C[-7]+R[-1]C[-2]))-100 -> 2.158566820320587 | BB56: 100.53840530111977 | BC56: 25645100 | BD56: =RC[-1]-R[-1]C[-1] -> 58821 | BE56: =(RC[-2]/(RC[-55]))*1000 -> 550.92698017143232 | BF56: =(RC[-3]*100/R[-1]C[-3])-100 -> 0.22989274837502194 | BG56: =(RC[-57]*100/R[-1]C[-57])-100 -> 0.23471145564168694 | BH56: =RC[-2]-RC[-1] -> -4.818707266665001E-3 | BI56: 12392.989999999998 | BJ56: 12.55 | BK56: =100-(RC[-1]+RC[1]) -> 75.985304999999997 | BL56: =(RC[1]*(100-RC[-2]))/100 -> 11.464694999999999 | BM56: 13.11 | BN56: 9005600 | BO56: 5169000 | BP56: 3330900 | BQ56: 967300 | BR56: =((RC[-4]*100)/SUM(R56C66:R56C69)) -> 48.750595470096577 | BS56: =((RC[-4]*100)/SUM(R56C66:R56C69)) -> 27.981681174483565 | BT56: =((RC[-4]*100)/SUM(R56C66:R56C69)) -> 18.031375860724957 | BU56: =((RC[-4]*100)/SUM(R56C66:R56C69)) -> 5.2363474946949031 | BV56: 8.9499999999999993 | BW56: =((RC[-1]*100)/R[-1]C[-1])-100 -> 13.291139240506311 | BX56: =RC[4]/(RC[-2]*12) -> 14.351334574798262 | BY56: =100/RC[-1] -> 6.9679930795847751 | BZ56: =RC[2]/((RC[-4]*12)*0.75) -> 19.135112766397683 | CA56: =100/RC[-1] -> 5.2259948096885811 | CB56: =AVERAGE(Quarterly!R[-14]C[-76]:R[-11]C[-76]) -> 1541.3333333333333 | CC56: 1372 | CD56: 1.96 | CE56: =R[-1]C+RC[-1] -> 207.51000000000002 | CF56: =((RC[-3]*RC[-2])/100)+R[-1]C -> 905.58056525000018 | CG56: =RC[-4]-RC[-1] -> 466.41943474999982 | CH56: =RC[-5]/RC[-3]*R24C83 -> 661.17295552021585 | CI56: =RC[-6]-RC[-1] -> 710.82704447978415 | CJ56: =RC[-2]*100/R24C86 -> 324.10438996089016 | CK56: =(RC[-8]*100/R[-1]C[-8])-100 -> 4.7328244274809208 | CL56: =RC[-1]-RC[-8] -> 2.7728244274809208 | CM56: =(R[1]C[-89]*100/RC[-89])-100 -> 0.23512212936904575 | CN56: =(RC[-79]*100/R[-1]C[-79])-100 -> 15.357993018981958 | CO56: =(RC[-75]*100/R[-1]C[-75])-100 -> 10.659799721973627 | CP56: 17.22 | CQ56: =(RC[-16]+RC[-6]) -> 9.9588192371695019 | CR56: =-0.06*((RC[-95]-1963)^2)+8.5*(RC[-95]-1963)+140 -> 424.04 | CS56: =RC[-1]+50 -> 474.04 | CT56: =RC[-2]-50 -> 374.04 | CU56: =RC[-3]+100 -> 524.04 | CV56: =RC[-4]-100 -> 324.04000000000002 | CW56: =-0.025*((RC[-100]-1963)^2)+5.5*(RC[-100]-1963)+175 -> 399.1
A57: 2018 | B57: 46658447 | C57: 17425139 | D57: =RC[-1]/26 -> 670197.65384615387 | E57: =RC[-1]/2 -> 335098.82692307694 | F57: =RC[-1]*1.5 -> 502648.24038461538 | G57: 531498 | H57: =RC[-1]/2 -> 265749 | I57: 791467.40806499997 | J57: =RC[-1]/2 -> 395733.70403249998 | K57: 741197 | L57: =RC[-1]/2 -> 370598.5 | M57: 517984 | N57: 179385 | O57: 16278 | P57: 1338 | Q57: 210091 | R57: 348326 | S57: 342799 | T57: 43284882 | U57: =RC[-1]*1000/RC[-3] -> 124265.43525318237 | V57: 11970 | W57: 4049 | X57: =RC[-6]/RC[-11] -> 0.67246478655711373 | Y57: =((RC[-4]*100/R[-1]C[-4])-100)-RC[57] -> 4.3594901953724037 | Z57: -0.17148181818181818 | AA57: 2.63 | AB57: 39.200000000000003 | AC57: 60.8 | AD57: 24 | AE57: 18592.418122523672 | AF57: =RC[-11]/RC[-1] -> 6.6836618257117273 | AG57: =RC[-12]/5 -> 24853.087050636474 | AH57: =100-((RC[-3]*100)/RC[-1]) -> 25.190709368848687 | AI57: 707 | AJ57: 159.69999999999999 | AK57: 21901 | AL57: 74081 | AM57: 24175 | AN57: 46560 | AO57: 3346 | AP57: 21254 | AQ57: 200.23759273547648 | AR57: 3063400400 | AS57: =RC[-1]/RC[-3] -> 144132.88792697844 | AT57: =RC[-1]/RC[-3] -> 719.80933229348659 | AU57: 79453 | AV57: 117.0283231932777 | AW57: 6541922000 | AX57: =RC[-1]/RC[-3] -> 82337.004266673379 | AY57: =RC[-1]/RC[-3] -> 703.56476124749736 | AZ57: =RC[29]/((RC[-1]+RC[-6])/2) -> 1.9769925648987337 | BA57: =((RC[-7]+RC[-2])*100/(R[-1]C[-7]+R[-1]C[-2]))-100 -> 2.8029497573672728 | BB57: 102.65783758787809 | BC57: 25712558 | BD57: =RC[-1]-R[-1]C[-1] -> 67458 | BE57: =(RC[-2]/(RC[-55]))*1000 -> 551.08045066309217 | BF57: =(RC[-3]*100/R[-1]C[-3])-100 -> 0.26304440224448911 | BG57: =(RC[-57]*100/R[-1]C[-57])-100 -> 0.23512212936904575 | BH57: =RC[-2]-RC[-1] -> 2.7922272875443355E-2 | BI57: 13461.079999999998 | BJ57: 12.18 | BK57: =100-(RC[-1]+RC[1]) -> 76.719551999999993 | BL57: =(RC[1]*(100-RC[-2]))/100 -> 11.100447999999998 | BM57: 12.64 | BN57: 9104600 | BO57: 5119400 | BP57: 3291300 | BQ57: 1020600 | BR57: =((RC[-4]*100)/SUM(R57C66:R57C69)) -> 49.118737153307904 | BS57: =((RC[-4]*100)/SUM(R57C66:R57C69)) -> 27.618836959629693 | BT57: =((RC[-4]*100)/SUM(R57C66:R57C69)) -> 17.756353886242373 | BU57: =((RC[-4]*100)/SUM(R57C66:R57C69)) -> 5.5060720008200299 | BV57: 10.050000000000001 | BW57: =((RC[-1]*100)/R[-1]C[-1])-100 -> 12.290502793296113 | BX57: =RC[4]/(RC[-2]*12) -> 13.574488667772249 | BY57: =100/RC[-1] -> 7.3667599898192933 | BZ57: =RC[2]/((RC[-4]*12)*0.75) -> 18.099318223696333 | CA57: =100/RC[-1] -> 5.5250699923644691 | CB57: =AVERAGE(Quarterly!R[-11]C[-76]:R[-8]C[-76]) -> 1637.0833333333333 | CC57: 1407 | CD57: 1.67 | CE57: =R[-1]C+RC[-1] -> 209.18 | CF57: =((RC[-3]*RC[-2])/100)+R[-1]C -> 929.07746525000016 | CG57: =RC[-4]-RC[-1] -> 477.92253474999984 | CH57: =RC[-5]/RC[-3]*R24C83 -> 672.62644612295628 | CI57: =RC[-6]-RC[-1] -> 734.37355387704372 | CJ57: =RC[-2]*100/R24C86 -> 329.71884613870407 | CK57: =(RC[-8]*100/R[-1]C[-8])-100 -> 2.5510204081632679 | CL57: =RC[-1]-RC[-8] -> 0.88102040816326799 | CM57: =(R[1]C[-89]*100/RC[-89])-100 -> 0.59713303359625058 | CN57: =(RC[-79]*100/R[-1]C[-79])-100 -> 10.764598711840634 | CO57: =(RC[-75]*100/R[-1]C[-75])-100 -> 11.34211089907717 | CP57: 15.25 | CQ57: =(RC[-16]+RC[-6]) -> 8.0760904005277361 | CR57: =-0.06*((RC[-95]-1963)^2)+8.5*(RC[-95]-1963)+140 -> 426 | CS57: =RC[-1]+50 -> 476 | CT57: =RC[-2]-50 -> 376 | CU57: =RC[-3]+100 -> 526 | CV57: =RC[-4]-100 -> 326 | CW57: =-0.025*((RC[-100]-1963)^2)+5.5*(RC[-100]-1963)+175 -> 401.875
A58: 2019 | B58: 46937060 | C58: 17297371 | D58: =RC[-1]/26 -> 665283.5 | E58: =RC[-1]/2 -> 332641.75 | F58: =RC[-1]*1.5 -> 498962.625 | G58: 531765 | H58: =RC[-1]/2 -> 265882.5 | I58: 779874.82120899996 | J58: =RC[-1]/2 -> 389937.41060449998 | K58: 737469 | L58: =RC[-1]/2 -> 368734.5 | M58: 503546 | N58: 176046 | O58: 18764 | P58: 1355 | Q58: 249414 | R58: 361291 | S58: 340776 | T58: 45383450 | U58: =RC[-1]*1000/RC[-3] -> 125614.67072249239 | V58: 11183 | W58: 3607 | X58: =RC[-6]/RC[-11] -> 0.71749353584379583 | Y58: =((RC[-4]*100/R[-1]C[-4])-100)-RC[57] -> 0.38576891599908258 | Z58: -0.22453636363636367 | AA58: 2.57 | AB58: 42.1 | AC58: 57.9 | AD58: 23 | AE58: 19374.718026230894 | AF58: =RC[-11]/RC[-1] -> 6.4834322002738913 | AG58: =RC[-12]/5 -> 25122.934144498478 | AH58: =100-((RC[-3]*100)/RC[-1]) -> 22.880353406197784 | AI58: 735 | AJ58: 160.9 | AK58: 19047 | AL58: 78325 | AM58: 24947 | AN58: 50024 | AO58: 3354 | AP58: 21982 | AQ58: 197.91902503962376 | AR58: 3245249300 | AS58: =RC[-1]/RC[-3] -> 147632.1217359658 | AT58: =RC[-1]/RC[-3] -> 745.92183195329289 | AU58: 84223 | AV58: 112.47271621837696 | AW58: 6965173000 | AX58: =RC[-1]/RC[-3] -> 82699.17955902782 | AY58: =RC[-1]/RC[-3] -> 735.28214076789197 | AZ58: =RC[29]/((RC[-1]+RC[-6])/2) -> 1.9416637093650067 | BA58: =((RC[-7]+RC[-2])*100/(R[-1]C[-7]+R[-1]C[-2]))-100 -> 4.062872820477935 | BB58: 103.99901420426859 | BC58: 25793043 | BD58: =RC[-1]-R[-1]C[-1] -> 80485 | BE58: =(RC[-2]/(RC[-55]))*1000 -> 549.52404347438892 | BF58: =(RC[-3]*100/R[-1]C[-3])-100 -> 0.31301825357088831 | BG58: =(RC[-57]*100/R[-1]C[-57])-100 -> 0.59713303359625058 | BH58: =RC[-2]-RC[-1] -> -0.28411478002536228 | BI58: 14718.939999999997 | BJ58: 12.03 | BK58: =100-(RC[-1]+RC[1]) -> 76.876982999999996 | BL58: =(RC[1]*(100-RC[-2]))/100 -> 11.093017 | BM58: 12.61 | BN58: 9153900 | BO58: 5031700 | BP58: 3401200 | BQ58: 1038800 | BR58: =((RC[-4]*100)/SUM(R58C66:R58C69)) -> 49.146873120865905 | BS58: =((RC[-4]*100)/SUM(R58C66:R58C69)) -> 27.014968645305387 | BT58: =((RC[-4]*100)/SUM(R58C66:R58C69)) -> 18.26088823984194 | BU58: =((RC[-4]*100)/SUM(R58C66:R58C69)) -> 5.5772699939867705 | BV58: 10.65 | BW58: =((RC[-1]*100)/R[-1]C[-1])-100 -> 5.9701492537313356 | BX58: =RC[4]/(RC[-2]*12) -> 13.513302034428794 | BY58: =100/RC[-1] -> 7.4001158077591205 | BZ58: =RC[2]/((RC[-4]*12)*0.75) -> 18.017736045905057 | CA58: =100/RC[-1] -> 5.550086855819341 | CB58: =AVERAGE(Quarterly!R[-8]C[-76]:R[-5]C[-76]) -> 1727 | CC58: 1438 | CD58: 0.70000000000000007 | CE58: =R[-1]C+RC[-1] -> 209.88 | CF58: =((RC[-3]*RC[-2])/100)+R[-1]C -> 939.14346525000019 | CG58: =RC[-4]-RC[-1] -> 498.85653474999981 | CH58: =RC[-5]/RC[-3]*R24C83 -> 685.15342100247767 | CI58: =RC[-6]-RC[-1] -> 752.84657899752233 | CJ58: =RC[-2]*100/R24C86 -> 335.85952009925376 | CK58: =(RC[-8]*100/R[-1]C[-8])-100 -> 2.2032693674484705 | CL58: =RC[-1]-RC[-8] -> 1.5032693674484703 | CM58: =(R[1]C[-89]*100/RC[-89])-100 -> 0.84273280005182016 | CN58: =(RC[-79]*100/R[-1]C[-79])-100 -> -2.7873447828504396 | CO58: =(RC[-75]*100/R[-1]C[-75])-100 -> 3.7220879291238731 | CP58: 14.1 | CQ58: =(RC[-16]+RC[-6]) -> 7.7533562232678115 | CR58: =-0.06*((RC[-95]-1963)^2)+8.5*(RC[-95]-1963)+140 -> 427.84000000000003 | CS58: =RC[-1]+50 -> 477.84000000000003 | CT58: =RC[-2]-50 -> 377.84000000000003 | CU58: =RC[-3]+100 -> 527.84 | CV58: =RC[-4]-100 -> 327.84000000000003 | CW58: =-0.025*((RC[-100]-1963)^2)+5.5*(RC[-100]-1963)+175 -> 404.6
A59: 2020 | B59: 47332614 | C59: 17226469 | D59: =RC[-1]/26 -> 662556.5 | E59: =RC[-1]/2 -> 331278.25 | F59: =RC[-1]*1.5 -> 496917.375 | G59: 533950 | H59: =RC[-1]/2 -> 266975 | I59: 752076.17524500005 | J59: =RC[-1]/2 -> 376038.08762250002 | K59: 746118 | L59: =RC[-1]/2 -> 373059 | M59: 415748 | N59: 151533 | O59: 20020 | P59: 1028 | Q59: 178365 | R59: 333721 | S59: 274789 | T59: 45020403 | U59: =RC[-1]*1000/RC[-3] -> 134904.31528132781 | V59: 14717 | W59: 4716 | X59: =RC[-6]/RC[-11] -> 0.80270019338637832 | Y59: =((RC[-4]*100/R[-1]C[-4])-100)-RC[57] -> 7.7153500060180775 | Z59: -0.30785454545454549 | AA59: 2.4900000000000002 | AB59: 47.4 | AC59: 52.6 | AD59: 24 | AE59: 18741.448458664589 | AF59: =RC[-11]/RC[-1] -> 7.1981797767054951 | AG59: =RC[-12]/5 -> 26980.863056265564 | AH59: =100-((RC[-3]*100)/RC[-1]) -> 30.537994950045146 | AI59: 900 | AJ59: 145.81 | AK59: 16207 | AL59: 71099 | AM59: 22808 | AN59: 45317 | AO59: 2974 | AP59: 20314 | AQ59: 195.01493287086069 | AR59: 2987751300.0000005 | AS59: =RC[-1]/RC[-3] -> 147078.43359259627 | AT59: =RC[-1]/RC[-3] -> 754.19062236629804 | AU59: 65191 | AV59: 109.57353420146507 | AW59: 5413764100.000001 | AX59: =RC[-1]/RC[-3] -> 83044.654937031199 | AY59: =RC[-1]/RC[-3] -> 757.8897180074789 | AZ59: =RC[29]/((RC[-1]+RC[-6])/2) -> 1.8834978036259582 | BA59: =((RC[-7]+RC[-2])*100/(R[-1]C[-7]+R[-1]C[-2]))-100 -> 2.0845452902659645 | BB59: 102.77458176611511 | BC59: 25882055 | BD59: =RC[-1]-R[-1]C[-1] -> 89012 | BE59: =(RC[-2]/(RC[-55]))*1000 -> 546.81228887971406 | BF59: =(RC[-3]*100/R[-1]C[-3])-100 -> 0.34510080877234373 | BG59: =(RC[-57]*100/R[-1]C[-57])-100 -> 0.84273280005182016 | BH59: =RC[-2]-RC[-1] -> -0.49763199127947644 | BI59: 13287.560000000001 | BJ59: 11.16 | BK59: =100-(RC[-1]+RC[1]) -> 78.783311999999995 | BL59: =(RC[1]*(100-RC[-2]))/100 -> 10.056688000000001 | BM59: 11.32 | BN59: 9212400 | BO59: 5201200 | BP59: 3244400 | BQ59: 1096700 | BR59: =((RC[-4]*100)/SUM(R59C66:R59C69)) -> 49.120487131225772 | BS59: =((RC[-4]*100)/SUM(R59C66:R59C69)) -> 27.732781649399882 | BT59: =((RC[-4]*100)/SUM(R59C66:R59C69)) -> 17.299130351325267 | BU59: =((RC[-4]*100)/SUM(R59C66:R59C69)) -> 5.8476008680490761 | BV59: 11.05 | BW59: =((RC[-1]*100)/R[-1]C[-1])-100 -> 3.7558685446009292 | BX59: =RC[4]/(RC[-2]*12) -> 13.10646053293112 | BY59: =100/RC[-1] -> 7.6298249820187012 | BZ59: =RC[2]/((RC[-4]*12)*0.75) -> 17.475280710574825 | CA59: =100/RC[-1] -> 5.7223687365140261 | CB59: =AVERAGE(Quarterly!R[-5]C[-76]:R[-2]C[-76]) -> 1737.9166666666667 | CC59: 1424 | CD59: -0.32 | CE59: =R[-1]C+RC[-1] -> 209.56 | CF59: =((RC[-3]*RC[-2])/100)+R[-1]C -> 934.58666525000024 | CG59: =RC[-4]-RC[-1] -> 489.41333474999976 | CH59: =RC[-5]/RC[-3]*R24C83 -> 679.51899217407902 | CI59: =RC[-6]-RC[-1] -> 744.48100782592098 | CJ59: =RC[-2]*100/R24C86 -> 333.09754518337206 | CK59: =(RC[-8]*100/R[-1]C[-8])-100 -> -0.97357440890125702 | CL59: =RC[-1]-RC[-8] -> -0.65357440890125695 | CM59: =(R[1]C[-89]*100/RC[-89])-100 -> 0.13954648691068883 | CN59: =(RC[-79]*100/R[-1]C[-79])-100 -> -17.43594428314394 | CO59: =(RC[-75]*100/R[-1]C[-75])-100 -> -7.6309678347924574 | CP59: 15.53 | CQ59: =(RC[-16]+RC[-6]) -> 4.7487943276127691 | CR59: =-0.06*((RC[-95]-1963)^2)+8.5*(RC[-95]-1963)+140 -> 429.56 | CS59: =RC[-1]+50 -> 479.56 | CT59: =RC[-2]-50 -> 379.56 | CU59: =RC[-3]+100 -> 529.55999999999995 | CV59: =RC[-4]-100 -> 329.56 | CW59: =-0.025*((RC[-100]-1963)^2)+5.5*(RC[-100]-1963)+175 -> 407.27499999999998
A60: 2021 | B60: 47398665 | C60: 17044268 | D60: =RC[-1]/26 -> 655548.76923076925 | E60: =RC[-1]/2 -> 327774.38461538462 | F60: =RC[-1]*1.5 -> 491661.57692307694 | G60: 531524 | H60: =RC[-1]/2 -> 265762 | I60: 731583 | J60: =RC[-1]/2 -> 365791.5 | K60: 753583 | L60: =RC[-1]/2 -> 376791.5 | M60: 565523 | N60: 198939 | O60: 25062 | P60: 1500 | Q60: 195881 | R60: 417501 | S60: 372543 | T60: 57582131 | U60: =RC[-1]*1000/RC[-3] -> 137920.94150672693 | V60: 33455 | W60: 10539 | X60: =RC[-6]/RC[-11] -> 0.73825644580326533 | Y60: =((RC[-4]*100/R[-1]C[-4])-100)-RC[57] -> -0.85387714573230866 | Z60: -0.4896727272727272 | AA60: 2.5099999999999998 | AB60: 62.9 | AC60: 37.1 | AD60: 25 | AE60: 19224.054569848919 | AF60: =RC[-11]/RC[-1] -> 7.1743939867421451 | AG60: =RC[-12]/5 -> 27584.188301345384 | AH60: =100-((RC[-3]*100)/RC[-1]) -> 30.307702514808867 | AI60: 950 | AJ60: 151.19999999999999 | AK60: 29826 | AL60: 82647 | AM60: 28465 | AN60: 50560 | AO60: 3622 | AP60: 26576 | AQ60: 192.91200151575268 | AR60: 3909758900 | AS60: =RC[-1]/RC[-3] -> 147116.15367248646 | AT60: =RC[-1]/RC[-3] -> 762.60757504230935 | AU60: 81561 | AV60: 107.58787794061321 | AW60: 6738291700 | AX60: =RC[-1]/RC[-3] -> 82616.59003690489 | AY60: =RC[-1]/RC[-3] -> 767.89868541238377 | AZ60: =RC[29]/((RC[-1]+RC[-6])/2) -> 1.9784303261199476 | BA60: =((RC[-7]+RC[-2])*100/(R[-1]C[-7]+R[-1]C[-2]))-100 -> 1.2185807585039754 | BB60: 111.49696262134763 | BC60: 25976305 | BD60: =RC[-1]-R[-1]C[-1] -> 94250 | BE60: =(RC[-2]/(RC[-55]))*1000 -> 548.03874750480838 | BF60: =(RC[-3]*100/R[-1]C[-3])-100 -> 0.3641519191578908 | BG60: =(RC[-57]*100/R[-1]C[-57])-100 -> 0.13954648691068883 | BH60: =RC[-2]-RC[-1] -> 0.22460543224720197 | BI60: 14933 | BJ60: 9.44 | BK60: =100-(RC[-1]+RC[1]) -> 80.779519999999991 | BL60: =(RC[1]*(100-RC[-2]))/100 -> 9.7804800000000007 | BM60: 10.8 | BV60: 10.85 | BW60: =((RC[-1]*100)/R[-1]C[-1])-100 -> -1.8099547511312295 | BX60: =RC[4]/(RC[-2]*12) -> 13.886328725038402 | BY60: =100/RC[-1] -> 7.2013274336283191 | BZ60: =RC[2]/((RC[-4]*12)*0.75) -> 18.515104966717868 | CA60: =100/RC[-1] -> 5.4009955752212395 | CB60: =AVERAGE(Quarterly!R[-2]C[-76]:R[1]C[-76]) -> 1807.9999999999998 | CC60: 1514 | CD60: 3.09 | CE60: =R[-1]C+RC[-1] -> 212.65 | CF60: =((RC[-3]*RC[-2])/100)+R[-1]C -> 981.36926525000024 | CG60: =RC[-4]-RC[-1] -> 532.63073474999976 | CH60: =RC[-5]/RC[-3]*R24C83 -> 711.96802257230183 | CI60: =RC[-6]-RC[-1] -> 802.03197742769817 | CJ60: =RC[-2]*100/R24C86 -> 349.00393263348133 | CK60: =(RC[-8]*100/R[-1]C[-8])-100 -> 6.3202247191011196 | CL60: =RC[-1]-RC[-8] -> 3.2302247191011197 | CM60: =(R[1]C[-89]*100/RC[-89])-100 -> 7.2027345073962579E-2 | CN60: =(RC[-79]*100/R[-1]C[-79])-100 -> 36.025428865562787 | CO60: =(RC[-75]*100/R[-1]C[-75])-100 -> 25.104803113978448 | CP60: 14.8 | CQ60: =(RC[-16]+RC[-6]) -> 11.721220294322359 | CR60: =-0.06*((RC[-95]-1963)^2)+8.5*(RC[-95]-1963)+140 -> 431.15999999999997 | CS60: =RC[-1]+50 -> 481.15999999999997 | CT60: =RC[-2]-50 -> 381.15999999999997 | CU60: =RC[-3]+100 -> 531.16 | CV60: =RC[-4]-100 -> 331.15999999999997 | CW60: =-0.025*((RC[-100]-1963)^2)+5.5*(RC[-100]-1963)+175 -> 409.9
A61: 2022 | B61: 47432805 | C61: 16745758.088183999 | D61: =RC[-1]/26 -> 644067.61877630767 | E61: =RC[-1]/2 -> 322033.80938815384 | F61: =RC[-1]*1.5 -> 483050.71408223076 | G61: 528019.09555600001 | H61: =RC[-1]/2 -> 264009.54777800001 | I61: 696564.92515599995 | J61: =RC[-1]/2 -> 348282.46257799998 | K61: 763428.68024699995 | L61: =RC[-1]/2 -> 381714.34012349998 | M61: 665836 | N61: 203007 | R61: 463641 | S61: 419332 | T61: 67303636 | U61: =RC[-1]*1000/RC[-3] -> 145163.25346550456 | V61: 26384 | W61: 7196 | X61: =RC[-6]/RC[-11] -> 0.69632912609110953 | Y61: =((RC[-4]*100/R[-1]C[-4])-100)-RC[57] -> -3.1989395883913794 | Z61: 1.03 | AA61: 2.5 | AB61: 73.125 | AC61: 26.88 | AD61: 25 | AE61: 19922 | AF61: =RC[-11]/RC[-1] -> 7.2865803365879209 | AG61: =RC[-12]/5 -> 29032.650693100913 | AH61: =100-((RC[-3]*100)/RC[-1]) -> 31.380705776430858 | AJ61: 162 | AL61: 80433 | AM61: 27504 | AN61: 45434 | AO61: 3091 | AP61: 26871 | AQ61: 196.39370586211422 | AR61: 4316299542.8571444 | AS61: =RC[-1]/RC[-3] -> 160630.40239876241 | AT61: =RC[-1]/RC[-3] -> 817.89995098691804 | AU61: 78073 | AV61: 109.87686066317193 | AW61: 6858606342.8571424 | AX61: =RC[-1]/RC[-3] -> 87848.633238855211 | AY61: =RC[-1]/RC[-3] -> 799.51895884753787 | AZ61: =RC[29]/((RC[-1]+RC[-6])/2) -> 2.0007185400912664 | BA61: =((RC[-7]+RC[-2])*100/(R[-1]C[-7]+R[-1]C[-2]))-100 -> 5.6786863030499575 | BB61: 125.39 | BC61: 26074305 | BD61: =RC[-1]-R[-1]C[-1] -> 98000 | BE61: =(RC[-2]/(RC[-55]))*1000 -> 549.7103744971439 | BF61: =(RC[-3]*100/R[-1]C[-3])-100 -> 0.37726689765922572 | BG61: =(RC[-57]*100/R[-1]C[-57])-100 -> 7.2027345073962579E-2 | BH61: =RC[-2]-RC[-1] -> 0.30523955258526314 | BI61: 14724 | BV61: 11 | BW61: =((RC[-1]*100)/R[-1]C[-1])-100 -> 1.3824884792626762 | BX61: =RC[4]/(RC[-2]*12) -> 14.121212121212121 | BY61: =100/RC[-1] -> 7.0815450643776821 | BZ61: =RC[2]/((RC[-4]*12)*0.75) -> 18.828282828282827 | CA61: =100/RC[-1] -> 5.3111587982832624 | CB61: 1864 | CC61: 1618 | CD61: 8.4499999999999993 | CE61: =R[-1]C+RC[-1] -> 221.1 | CF61: =((RC[-3]*RC[-2])/100)+R[-1]C -> 1118.0902652500001 | CG61: =RC[-4]-RC[-1] -> 499.90973474999987 | CH61: =RC[-5]/RC[-3]*R24C83 -> 731.79556761646313 | CI61: =RC[-6]-RC[-1] -> 886.20443238353687 | CJ61: =RC[-2]*100/R24C86 -> 358.72331745905052 | CK61: =(RC[-8]*100/R[-1]C[-8])-100 -> 6.8692206076618163 | CL61: =RC[-1]-RC[-8] -> -1.580779392338183 | CM61: =(R[1]C[-89]*100/RC[-89])-100 -> 0.10541227743119919 | CN61: =(RC[-79]*100/R[-1]C[-79])-100 -> 17.738093764533005 | CO61: =(RC[-75]*100/R[-1]C[-75])-100 -> 11.051470535399915 | CP61: 12.93 | CQ61: =(RC[-16]+RC[-6]) -> 12.180379405945079 | CR61: =-0.06*((RC[-95]-1963)^2)+8.5*(RC[-95]-1963)+140 -> 432.64 | CS61: =RC[-1]+50 -> 482.64 | CT61: =RC[-2]-50 -> 382.64 | CU61: =RC[-3]+100 -> 532.64 | CV61: =RC[-4]-100 -> 332.64 | CW61: =-0.025*((RC[-100]-1963)^2)+5.5*(RC[-100]-1963)+175 -> 412.47500000000002
A62: 2023 | B62: 47482805 | C62: 16502601.299354004 | D62: =RC[-1]/26 -> 634715.43459053861 | E62: =RC[-1]/2 -> 317357.71729526931 | F62: =RC[-1]*1.5 -> 476036.57594290399 | G62: 523292.16734799999 | H62: =RC[-1]/2 -> 261646.08367399999 | I62: 667442.91504500003 | J62: =RC[-1]/2 -> 333721.45752250002 | K62: 774828.89329200005 | L62: =RC[-1]/2 -> 387414.44664600003 | N62: =R[-1]C*1.03 -> 209097.21 | CR62: =-0.06*((RC[-95]-1963)^2)+8.5*(RC[-95]-1963)+140 -> 434 | CS62: =RC[-1]+50 -> 484 | CT62: =RC[-2]-50 -> 384 | CU62: =RC[-3]+100 -> 534 | CV62: =RC[-4]-100 -> 334 | CW62: =-0.025*((RC[-100]-1963)^2)+5.5*(RC[-100]-1963)+175 -> 415
A63: 2024 | B63: 47508101.693512447 | C63: 16250838.702938998 | D63: =RC[-1]/26 -> 625032.25780534605 | E63: =RC[-1]/2 -> 312516.12890267302 | F63: =RC[-1]*1.5 -> 468774.19335400953 | G63: 516126.85299799999 | H63: =RC[-1]/2 -> 258063.42649899999 | I63: 632727.36444599996 | J63: =RC[-1]/2 -> 316363.68222299998 | K63: 778332.34440099995 | L63: =RC[-1]/2 -> 389166.17220049998 | N63: =R[-1]C*1.03 -> 215370.1263 | CR63: =-0.06*((RC[-95]-1963)^2)+8.5*(RC[-95]-1963)+140 -> 435.24 | CS63: =RC[-1]+50 -> 485.24 | CT63: =RC[-2]-50 -> 385.24 | CU63: =RC[-3]+100 -> 535.24 | CV63: =RC[-4]-100 -> 335.24 | CW63: =-0.025*((RC[-100]-1963)^2)+5.5*(RC[-100]-1963)+175 -> 417.47500000000002
A64: 2025 | B64: 47544784.05866617 | C64: 16015363.242989998 | D64: =RC[-1]/26 -> 615975.50934576918 | E64: =RC[-1]/2 -> 307987.75467288459 | F64: =RC[-1]*1.5 -> 461981.63200932689 | G64: 501837.52931900002 | H64: =RC[-1]/2 -> 250918.76465950001 | I64: 614866.50834099995 | J64: =RC[-1]/2 -> 307433.25417049997 | K64: 797242.68682499998 | L64: =RC[-1]/2 -> 398621.34341249999 | N64: =R[-1]C*1.03 -> 221831.23008900002 | CR64: =-0.06*((RC[-95]-1963)^2)+8.5*(RC[-95]-1963)+140 -> 436.36 | CS64: =RC[-1]+50 -> 486.36 | CT64: =RC[-2]-50 -> 386.36 | CU64: =RC[-3]+100 -> 536.36 | CV64: =RC[-4]-100 -> 336.36 | CW64: =-0.025*((RC[-100]-1963)^2)+5.5*(RC[-100]-1963)+175 -> 419.9
A65: 2026 | B65: 47587609.722386882 | C65: 15778182.705500999 | D65: =RC[-1]/26 -> 606853.18098080764 | E65: =RC[-1]/2 -> 303426.59049040382 | F65: =RC[-1]*1.5 -> 455139.88573560573 | G65: 498581.19506400003 | H65: =RC[-1]/2 -> 249290.59753200001 | I65: 594746.80457599997 | J65: =RC[-1]/2 -> 297373.40228799998 | K65: 803005.67792499997 | L65: =RC[-1]/2 -> 401502.83896249998 | N65: =R[-1]C*1.03 -> 228486.16699167003 | CR65: =-0.06*((RC[-95]-1963)^2)+8.5*(RC[-95]-1963)+140 -> 437.36 | CS65: =RC[-1]+50 -> 487.36 | CT65: =RC[-2]-50 -> 387.36 | CU65: =RC[-3]+100 -> 537.36 | CV65: =RC[-4]-100 -> 337.36 | CW65: =-0.025*((RC[-100]-1963)^2)+5.5*(RC[-100]-1963)+175 -> 422.27499999999998
A66: 2027 | B66: 47638217.871348262 | C66: 15542821.275544999 | D66: =RC[-1]/26 -> 597800.81829019228 | E66: =RC[-1]/2 -> 298900.40914509614 | F66: =RC[-1]*1.5 -> 448350.61371764424 | G66: 501622.98487599997 | H66: =RC[-1]/2 -> 250811.49243799999 | I66: 578267.86841300002 | J66: =RC[-1]/2 -> 289133.93420650001 | K66: 809048.22265100002 | L66: =RC[-1]/2 -> 404524.11132550001 | N66: =R[-1]C*1.03 -> 235340.75200142013 | CR66: =-0.06*((RC[-95]-1963)^2)+8.5*(RC[-95]-1963)+140 -> 438.24 | CS66: =RC[-1]+50 -> 488.24 | CT66: =RC[-2]-50 -> 388.24 | CU66: =RC[-3]+100 -> 538.24 | CV66: =RC[-4]-100 -> 338.24 | CW66: =-0.025*((RC[-100]-1963)^2)+5.5*(RC[-100]-1963)+175 -> 424.6
A67: 2028 | B67: 47697038.863705635 | C67: 15311447.272689998 | D67: =RC[-1]/26 -> 588901.81818038458 | E67: =RC[-1]/2 -> 294450.90909019229 | F67: =RC[-1]*1.5 -> 441676.36363528844 | G67: 508279.06743200001 | H67: =RC[-1]/2 -> 254139.53371600001 | I67: 567956.33869799995 | J67: =RC[-1]/2 -> 283978.16934899997 | K67: 794816.13369699998 | L67: =RC[-1]/2 -> 397408.06684849999 | N67: =R[-1]C*1.03 -> 242400.97456146273 | CR67: =-0.06*((RC[-95]-1963)^2)+8.5*(RC[-95]-1963)+140 -> 439 | CS67: =RC[-1]+50 -> 489 | CT67: =RC[-2]-50 -> 389 | CU67: =RC[-3]+100 -> 539 | CV67: =RC[-4]-100 -> 339 | CW67: =-0.025*((RC[-100]-1963)^2)+5.5*(RC[-100]-1963)+175 -> 426.875
A68: 2029 | B68: 47765912.282433301 | C68: 15122609.461375 | D68: =RC[-1]/26 -> 581638.82543750003 | E68: =RC[-1]/2 -> 290819.41271875001 | F68: =RC[-1]*1.5 -> 436229.11907812499 | G68: 508058.566513 | H68: =RC[-1]/2 -> 254029.2832565 | I68: 564293.06015399995 | J68: =RC[-1]/2 -> 282146.53007699997 | K68: 784884.00837199995 | L68: =RC[-1]/2 -> 392442.00418599998 | N68: =R[-1]C*1.03 -> 249673.00379830663 | CR68: =-0.06*((RC[-95]-1963)^2)+8.5*(RC[-95]-1963)+140 -> 439.64 | CS68: =RC[-1]+50 -> 489.64 | CT68: =RC[-2]-50 -> 389.64 | CU68: =RC[-3]+100 -> 539.64 | CV68: =RC[-4]-100 -> 339.64 | CW68: =-0.025*((RC[-100]-1963)^2)+5.5*(RC[-100]-1963)+175 -> 429.1
A69: 2030 | B69: 47844504.864883363 | C69: 14963067.481815998 | D69: =RC[-1]/26 -> 575502.59545446141 | E69: =RC[-1]/2 -> 287751.2977272307 | F69: =RC[-1]*1.5 -> 431626.94659084606 | G69: 523717.15349900001 | H69: =RC[-1]/2 -> 261858.5767495 | I69: 559083.86880399997 | J69: =RC[-1]/2 -> 279541.93440199998 | K69: 752345.64312699996 | L69: =RC[-1]/2 -> 376172.82156349998 | N69: =R[-1]C*1.03 -> 257163.19391225584 | CR69: =-0.06*((RC[-95]-1963)^2)+8.5*(RC[-95]-1963)+140 -> 440.16 | CS69: =RC[-1]+50 -> 490.16 | CT69: =RC[-2]-50 -> 390.16 | CU69: =RC[-3]+100 -> 540.16000000000008 | CV69: =RC[-4]-100 -> 340.16 | CW69: =-0.025*((RC[-100]-1963)^2)+5.5*(RC[-100]-1963)+175 -> 431.27499999999998
A70: 2031 | B70: 47933476.592197433 | C70: 14852312.461092999 | D70: =RC[-1]/26 -> 571242.78696511535 | E70: =RC[-1]/2 -> 285621.39348255767 | F70: =RC[-1]*1.5 -> 428432.09022383648 | G70: 537265.87975299999 | H70: =RC[-1]/2 -> 268632.93987649999 | I70: 555269.61271400005 | J70: =RC[-1]/2 -> 277634.80635700002 | K70: 731890.16582400003 | L70: =RC[-1]/2 -> 365945.08291200001 | N70: =R[-1]C*1.03 -> 264878.08972962352 | CR70: =-0.06*((RC[-95]-1963)^2)+8.5*(RC[-95]-1963)+140 -> 440.56 | CS70: =RC[-1]+50 -> 490.56 | CT70: =RC[-2]-50 -> 390.56 | CU70: =RC[-3]+100 -> 540.55999999999995 | CV70: =RC[-4]-100 -> 340.56 | CW70: =-0.025*((RC[-100]-1963)^2)+5.5*(RC[-100]-1963)+175 -> 433.4
A71: 2032 | B71: 48033534.852555975 | C71: 14783361.233756999 | D71: =RC[-1]/26 -> 568590.81668296154 | E71: =RC[-1]/2 -> 284295.40834148077 | F71: =RC[-1]*1.5 -> 426443.11251222115 | G71: 541285.71918000001 | H71: =RC[-1]/2 -> 270642.85959000001 | I71: 552826.453094 | J71: =RC[-1]/2 -> 276413.226547 | K71: 700885.24506999995 | L71: =RC[-1]/2 -> 350442.62253499997 | N71: =R[-1]C*1.03 -> 272824.43242151226 | CR71: =-0.06*((RC[-95]-1963)^2)+8.5*(RC[-95]-1963)+140 -> 440.84000000000003 | CS71: =RC[-1]+50 -> 490.84000000000003 | CT71: =RC[-2]-50 -> 390.84000000000003 | CU71: =RC[-3]+100 -> 540.84 | CV71: =RC[-4]-100 -> 340.84000000000003 | CW71: =-0.025*((RC[-100]-1963)^2)+5.5*(RC[-100]-1963)+175 -> 435.47500000000002
A72: 2033 | B72: 48142740.303703368 | C72: 14758746.278947001 | D72: =RC[-1]/26 -> 567644.0876518077 | E72: =RC[-1]/2 -> 283822.04382590385 | F72: =RC[-1]*1.5 -> 425733.06573885574 | G72: 547262.77626399999 | H72: =RC[-1]/2 -> 273631.38813199999 | I72: 559843.03749799996 | J72: =RC[-1]/2 -> 279921.51874899998 | K72: 673963.80887900002 | L72: =RC[-1]/2 -> 336981.90443950001 | N72: =R[-1]C*1.03 -> 281009.16539415764 | CR72: =-0.06*((RC[-95]-1963)^2)+8.5*(RC[-95]-1963)+140 -> 441 | CS72: =RC[-1]+50 -> 491 | CT72: =RC[-2]-50 -> 391 | CU72: =RC[-3]+100 -> 541 | CV72: =RC[-4]-100 -> 341 | CW72: =-0.025*((RC[-100]-1963)^2)+5.5*(RC[-100]-1963)+175 -> 437.5
A73: 2034 | B73: 48259785.798996463 | C73: 14787697.648329997 | D73: =RC[-1]/26 -> 568757.60185884603 | E73: =RC[-1]/2 -> 284378.80092942301 | F73: =RC[-1]*1.5 -> 426568.20139413455 | G73: 569863.08283900004 | H73: =RC[-1]/2 -> 284931.54141950002 | I73: 550137.95979200001 | J73: =RC[-1]/2 -> 275068.979896 | K73: 642334.66037599999 | L73: =RC[-1]/2 -> 321167.33018799999 | N73: =R[-1]C*1.03 -> 289439.4403559824 | CR73: =-0.06*((RC[-95]-1963)^2)+8.5*(RC[-95]-1963)+140 -> 441.04 | CS73: =RC[-1]+50 -> 491.04 | CT73: =RC[-2]-50 -> 391.04 | CU73: =RC[-3]+100 -> 541.04 | CV73: =RC[-4]-100 -> 341.04 | CW73: =-0.025*((RC[-100]-1963)^2)+5.5*(RC[-100]-1963)+175 -> 439.47500000000002
A74: 2035 | B74: 48381047.466654271 | C74: 14829571.839248 | D74: =RC[-1]/26 -> 570368.14766338456 | E74: =RC[-1]/2 -> 285184.07383169228 | F74: =RC[-1]*1.5 -> 427776.11074753839 | G74: 583682.82952300005 | H74: =RC[-1]/2 -> 291841.41476150003 | I74: 538417.16963300004 | J74: =RC[-1]/2 -> 269208.58481650002 | K74: 626364.595462 | L74: =RC[-1]/2 -> 313182.297731 | N74: =R[-1]C*1.03 -> 298122.6235666619 | CR74: =-0.06*((RC[-95]-1963)^2)+8.5*(RC[-95]-1963)+140 -> 440.96000000000004 | CS74: =RC[-1]+50 -> 490.96000000000004 | CT74: =RC[-2]-50 -> 390.96000000000004 | CU74: =RC[-3]+100 -> 540.96 | CV74: =RC[-4]-100 -> 340.96000000000004 | CW74: =-0.025*((RC[-100]-1963)^2)+5.5*(RC[-100]-1963)+175 -> 441.4
A75: 2036 | B75: 48503785.095665723 | C75: 14882895.773574 | D75: =RC[-1]/26 -> 572419.06821438461 | E75: =RC[-1]/2 -> 286209.5341071923 | F75: =RC[-1]*1.5 -> 429314.30116078845 | G75: 594269.732158 | H75: =RC[-1]/2 -> 297134.866079 | I75: 537284.04368300003 | J75: =RC[-1]/2 -> 268642.02184150001 | K75: 608319.40208499995 | L75: =RC[-1]/2 -> 304159.70104249998 | N75: =R[-1]C*1.03 -> 307066.30227366177 | CR75: =-0.06*((RC[-95]-1963)^2)+8.5*(RC[-95]-1963)+140 -> 440.76 | CS75: =RC[-1]+50 -> 490.76 | CT75: =RC[-2]-50 -> 390.76 | CU75: =RC[-3]+100 -> 540.76 | CV75: =RC[-4]-100 -> 340.76 | CW75: =-0.025*((RC[-100]-1963)^2)+5.5*(RC[-100]-1963)+175 -> 443.27499999999998
A76: 2037 | B76: 48627701.326035887 | C76: 14954760.163189 | D76: =RC[-1]/26 -> 575183.08319957694 | E76: =RC[-1]/2 -> 287591.54159978847 | F76: =RC[-1]*1.5 -> 431387.31239968271 | G76: 609334.76270700002 | H76: =RC[-1]/2 -> 304667.38135350001 | I76: 542303.42929700005 | J76: =RC[-1]/2 -> 271151.71464850003 | K76: 593674.78396799997 | L76: =RC[-1]/2 -> 296837.39198399999 | N76: =R[-1]C*1.03 -> 316278.29134187161 | CR76: =-0.06*((RC[-95]-1963)^2)+8.5*(RC[-95]-1963)+140 -> 440.44 | CS76: =RC[-1]+50 -> 490.44 | CT76: =RC[-2]-50 -> 390.44 | CU76: =RC[-3]+100 -> 540.44000000000005 | CV76: =RC[-4]-100 -> 340.44 | CW76: =-0.025*((RC[-100]-1963)^2)+5.5*(RC[-100]-1963)+175 -> 445.1
A77: 2038 | B77: 48752553.429691613 | C77: 15029028.105377 | D77: =RC[-1]/26 -> 578039.54251449998 | E77: =RC[-1]/2 -> 289019.77125724999 | F77: =RC[-1]*1.5 -> 433529.65688587498 | G77: 617660.20342499996 | H77: =RC[-1]/2 -> 308830.10171249998 | I77: 550740.32585400005 | J77: =RC[-1]/2 -> 275370.16292700003 | K77: 584560.39363900002 | L77: =RC[-1]/2 -> 292280.19681950001 | N77: =R[-1]C*1.03 -> 325766.64008212776 | CR77: =-0.06*((RC[-95]-1963)^2)+8.5*(RC[-95]-1963)+140 -> 440 | CS77: =RC[-1]+50 -> 490 | CT77: =RC[-2]-50 -> 390 | CU77: =RC[-3]+100 -> 540 | CV77: =RC[-4]-100 -> 340 | CW77: =-0.025*((RC[-100]-1963)^2)+5.5*(RC[-100]-1963)+175 -> 446.875
A78: 2039 | B78: 48877868.11065834 | C78: 15093518.648398999 | D78: =RC[-1]/26 -> 580519.94801534608 | E78: =RC[-1]/2 -> 290259.97400767304 | F78: =RC[-1]*1.5 -> 435389.96101150953 | G78: 639491.91223799996 | H78: =RC[-1]/2 -> 319745.95611899998 | I78: 552444.51035999996 | J78: =RC[-1]/2 -> 276222.25517999998 | K78: 581838.15139000001 | L78: =RC[-1]/2 -> 290919.07569500001 | N78: =R[-1]C*1.03 -> 335539.6392845916 | CR78: =-0.06*((RC[-95]-1963)^2)+8.5*(RC[-95]-1963)+140 -> 439.44 | CS78: =RC[-1]+50 -> 489.44 | CT78: =RC[-2]-50 -> 389.44 | CU78: =RC[-3]+100 -> 539.44000000000005 | CV78: =RC[-4]-100 -> 339.44 | CW78: =-0.025*((RC[-100]-1963)^2)+5.5*(RC[-100]-1963)+175 -> 448.6
A79: 2040 | B79: 49002929.918841965 | C79: 15169158.629735995 | D79: =RC[-1]/26 -> 583429.17806676903 | E79: =RC[-1]/2 -> 291714.58903338452 | F79: =RC[-1]*1.5 -> 437571.88355007675 | G79: 618982.15285199997 | H79: =RC[-1]/2 -> 309491.07642599999 | I79: 568977.81809800002 | J79: =RC[-1]/2 -> 284488.90904900001 | K79: 577653.51198800001 | L79: =RC[-1]/2 -> 288826.75599400001 | N79: =R[-1]C*1.03 -> 345605.82846312935 | CR79: =-0.06*((RC[-95]-1963)^2)+8.5*(RC[-95]-1963)+140 -> 438.76 | CS79: =RC[-1]+50 -> 488.76 | CT79: =RC[-2]-50 -> 388.76 | CU79: =RC[-3]+100 -> 538.76 | CV79: =RC[-4]-100 -> 338.76 | CW79: =-0.025*((RC[-100]-1963)^2)+5.5*(RC[-100]-1963)+175 -> 450.27499999999998
A80: 2041 | B80: 49126151.839667745 | C80: 15246490.584249001 | D80: =RC[-1]/26 -> 586403.48400957696 | E80: =RC[-1]/2 -> 293201.74200478848 | F80: =RC[-1]*1.5 -> 439802.61300718272 | G80: 613338.11364200001 | H80: =RC[-1]/2 -> 306669.05682100001 | I80: 583919.06793200003 | J80: =RC[-1]/2 -> 291959.53396600002 | K80: 574622.97465999995 | L80: =RC[-1]/2 -> 287311.48732999997 | N80: =R[-1]C*1.03 -> 355974.00331702322 | CR80: =-0.06*((RC[-95]-1963)^2)+8.5*(RC[-95]-1963)+140 -> 437.96000000000004 | CS80: =RC[-1]+50 -> 487.96000000000004 | CT80: =RC[-2]-50 -> 387.96000000000004 | CU80: =RC[-3]+100 -> 537.96 | CV80: =RC[-4]-100 -> 337.96000000000004 | CW80: =-0.025*((RC[-100]-1963)^2)+5.5*(RC[-100]-1963)+175 -> 451.9
A81: 2042 | B81: 49247167.391090572 | C81: 15321019.512600997 | D81: =RC[-1]/26 -> 589269.9812538845 | E81: =RC[-1]/2 -> 294634.99062694225 | F81: =RC[-1]*1.5 -> 441952.48594041337 | G81: 612730.43044999999 | H81: =RC[-1]/2 -> 306365.21522499999 | I81: 589991.54116699996 | J81: =RC[-1]/2 -> 294995.77058349998 | K81: 573000.78647000005 | L81: =RC[-1]/2 -> 286500.39323500003 | N81: =R[-1]C*1.03 -> 366653.2234165339 | CR81: =-0.06*((RC[-95]-1963)^2)+8.5*(RC[-95]-1963)+140 -> 437.04 | CS81: =RC[-1]+50 -> 487.04 | CT81: =RC[-2]-50 -> 387.04 | CU81: =RC[-3]+100 -> 537.04 | CV81: =RC[-4]-100 -> 337.04 | CW81: =-0.025*((RC[-100]-1963)^2)+5.5*(RC[-100]-1963)+175 -> 453.47500000000002
A82: 2043 | B82: 49364737.686195284 | C82: 15381511.786623001 | D82: =RC[-1]/26 -> 591596.60717780772 | E82: =RC[-1]/2 -> 295798.30358890386 | F82: =RC[-1]*1.5 -> 443697.45538335579 | G82: 599797.708109 | H82: =RC[-1]/2 -> 299898.8540545 | I82: 597351.37133600004 | J82: =RC[-1]/2 -> 298675.68566800002 | K82: 580118.29448499996 | L82: =RC[-1]/2 -> 290059.14724249998 | N82: =R[-1]C*1.03 -> 377652.82011902996 | CR82: =-0.06*((RC[-95]-1963)^2)+8.5*(RC[-95]-1963)+140 -> 436 | CS82: =RC[-1]+50 -> 486 | CT82: =RC[-2]-50 -> 386 | CU82: =RC[-3]+100 -> 536 | CV82: =RC[-4]-100 -> 336 | CW82: =-0.025*((RC[-100]-1963)^2)+5.5*(RC[-100]-1963)+175 -> 455
A83: 2044 | B83: 49477578.420258403 | C83: 15416632.274981001 | D83: =RC[-1]/26 -> 592947.39519157703 | E83: =RC[-1]/2 -> 296473.69759578852 | F83: =RC[-1]*1.5 -> 444710.54639368277 | G83: 580320.59249299997 | H83: =RC[-1]/2 -> 290160.29624649999 | I83: 619978.41002299997 | J83: =RC[-1]/2 -> 309989.20501149999 | K83: 570967.30337600003 | L83: =RC[-1]/2 -> 285483.65168800001 | N83: =R[-1]C*1.03 -> 388982.40472260088 | CR83: =-0.06*((RC[-95]-1963)^2)+8.5*(RC[-95]-1963)+140 -> 434.84000000000003 | CS83: =RC[-1]+50 -> 484.84000000000003 | CT83: =RC[-2]-50 -> 384.84000000000003 | CU83: =RC[-3]+100 -> 534.84 | CV83: =RC[-4]-100 -> 334.84000000000003 | CW83: =-0.025*((RC[-100]-1963)^2)+5.5*(RC[-100]-1963)+175 -> 456.47500000000002
A84: 2045 | B84: 49584782.126845665 | C84: 15449757.744016998 | D84: =RC[-1]/26 -> 594221.45169296139 | E84: =RC[-1]/2 -> 297110.72584648069 | F84: =RC[-1]*1.5 -> 445666.08876972104 | G84: 587533.97195000004 | H84: =RC[-1]/2 -> 293766.98597500002 | I84: 633902.83918200003 | J84: =RC[-1]/2 -> 316951.41959100001 | K84: 559868.301661 | L84: =RC[-1]/2 -> 279934.1508305 | N84: =R[-1]C*1.03 -> 400651.87686427892 | CR84: =-0.06*((RC[-95]-1963)^2)+8.5*(RC[-95]-1963)+140 -> 433.56 | CS84: =RC[-1]+50 -> 483.56 | CT84: =RC[-2]-50 -> 383.56 | CU84: =RC[-3]+100 -> 533.55999999999995 | CV84: =RC[-4]-100 -> 333.56 | CW84: =-0.025*((RC[-100]-1963)^2)+5.5*(RC[-100]-1963)+175 -> 457.9
A85: 2046 | B85: 49685418.072702073 | C85: 15493204.036145002 | D85: =RC[-1]/26 -> 595892.46292865393 | E85: =RC[-1]/2 -> 297946.23146432696 | F85: =RC[-1]*1.5 -> 446919.34719649045 | G85: 584296.48870800005 | H85: =RC[-1]/2 -> 292148.24435400002 | I85: 644827.18512100005 | J85: =RC[-1]/2 -> 322413.59256050002 | K85: 559091.64473199996 | L85: =RC[-1]/2 -> 279545.82236599998 | N85: =R[-1]C*1.03 -> 412671.43317020731 | CR85: =-0.06*((RC[-95]-1963)^2)+8.5*(RC[-95]-1963)+140 -> 432.16 | CS85: =RC[-1]+50 -> 482.16 | CT85: =RC[-2]-50 -> 382.16 | CU85: =RC[-3]+100 -> 532.16000000000008 | CV85: =RC[-4]-100 -> 332.16 | CW85: =-0.025*((RC[-100]-1963)^2)+5.5*(RC[-100]-1963)+175 -> 459.27499999999998
A86: 2047 | B86: 49778917.360551126 | C86: 15535540.571142998 | D86: =RC[-1]/26 -> 597520.79119780764 | E86: =RC[-1]/2 -> 298760.39559890382 | F86: =RC[-1]*1.5 -> 448140.59339835576 | G86: 577912.05363099999 | H86: =RC[-1]/2 -> 288956.02681549999 | I86: 659860.91756500001 | J86: =RC[-1]/2 -> 329930.45878250001 | K86: 564429.679978 | L86: =RC[-1]/2 -> 282214.839989 | N86: =R[-1]C*1.03 -> 425051.57616531354 | CR86: =-0.06*((RC[-95]-1963)^2)+8.5*(RC[-95]-1963)+140 -> 430.64000000000004 | CS86: =RC[-1]+50 -> 480.64000000000004 | CT86: =RC[-2]-50 -> 380.64000000000004 | CU86: =RC[-3]+100 -> 530.6400000000001 | CV86: =RC[-4]-100 -> 330.64000000000004 | CW86: =-0.025*((RC[-100]-1963)^2)+5.5*(RC[-100]-1963)+175 -> 460.6
A87: 2048 | B87: 49864546.976396024 | C87: 15571393.184582001 | D87: =RC[-1]/26 -> 598899.73786853848 | E87: =RC[-1]/2 -> 299449.86893426924 | F87: =RC[-1]*1.5 -> 449174.80340140383 | G87: 562100.74759399996 | H87: =RC[-1]/2 -> 281050.37379699998 | I87: 668505.77418099996 | J87: =RC[-1]/2 -> 334252.88709049998 | K87: 573124.04590899998 | L87: =RC[-1]/2 -> 286562.02295449999 | N87: =R[-1]C*1.03 -> 437803.12345027295 | CR87: =-0.06*((RC[-95]-1963)^2)+8.5*(RC[-95]-1963)+140 -> 429 | CS87: =RC[-1]+50 -> 479 | CT87: =RC[-2]-50 -> 379 | CU87: =RC[-3]+100 -> 529 | CV87: =RC[-4]-100 -> 329 | CW87: =-0.025*((RC[-100]-1963)^2)+5.5*(RC[-100]-1963)+175 -> 461.875
A88: 2049 | B88: 49941713.753195614 | C88: 15598248.556383003 | D88: =RC[-1]/26 -> 599932.63678396167 | E88: =RC[-1]/2 -> 299966.31839198084 | F88: =RC[-1]*1.5 -> 449949.47758797125 | G88: 543585.78637300001 | H88: =RC[-1]/2 -> 271792.8931865 | I88: 689937.76326200005 | J88: =RC[-1]/2 -> 344968.88163100003 | K88: 575273.36152599996 | L88: =RC[-1]/2 -> 287636.68076299998 | N88: =R[-1]C*1.03 -> 450937.21715378115 | CR88: =-0.06*((RC[-95]-1963)^2)+8.5*(RC[-95]-1963)+140 -> 427.24 | CS88: =RC[-1]+50 -> 477.24 | CT88: =RC[-2]-50 -> 377.24 | CU88: =RC[-3]+100 -> 527.24 | CV88: =RC[-4]-100 -> 327.24 | CW88: =-0.025*((RC[-100]-1963)^2)+5.5*(RC[-100]-1963)+175 -> 463.1
A89: 2050 | B89: 50010474.681963421 | C89: 15623460.734751001 | D89: =RC[-1]/26 -> 600902.33595196158 | E89: =RC[-1]/2 -> 300451.16797598079 | F89: =RC[-1]*1.5 -> 450676.75196397118 | G89: 531833.41655700002 | H89: =RC[-1]/2 -> 265916.70827850001 | I89: 670493.07671099994 | J89: =RC[-1]/2 -> 335246.53835549997 | K89: 591763.24234700005 | L89: =RC[-1]/2 -> 295881.62117350003 | N89: =R[-1]C*1.03 -> 464465.3336683946 | CR89: =-0.06*((RC[-95]-1963)^2)+8.5*(RC[-95]-1963)+140 -> 425.36 | CS89: =RC[-1]+50 -> 475.36 | CT89: =RC[-2]-50 -> 375.36 | CU89: =RC[-3]+100 -> 525.36 | CV89: =RC[-4]-100 -> 325.36 | CW89: =-0.025*((RC[-100]-1963)^2)+5.5*(RC[-100]-1963)+175 -> 464.27499999999998
A90: 2051 | B90: 50070954.666849136 | C90: 15633517.401560001 | D90: =RC[-1]/26 -> 601289.13082923077 | E90: =RC[-1]/2 -> 300644.56541461538 | F90: =RC[-1]*1.5 -> 450966.84812192305 | G90: 529925.15949400002 | H90: =RC[-1]/2 -> 264962.57974700001 | I90: 665417.00624300004 | J90: =RC[-1]/2 -> 332708.50312150002 | K90: 607008.90193599998 | L90: =RC[-1]/2 -> 303504.45096799999 | N90: =R[-1]C*1.03 -> 478399.29367844644 | CR90: =-0.06*((RC[-95]-1963)^2)+8.5*(RC[-95]-1963)+140 -> 423.36 | CS90: =RC[-1]+50 -> 473.36 | CT90: =RC[-2]-50 -> 373.36 | CU90: =RC[-3]+100 -> 523.36 | CV90: =RC[-4]-100 -> 323.36 | CW90: =-0.025*((RC[-100]-1963)^2)+5.5*(RC[-100]-1963)+175 -> 465.4
A91: 2052 | B91: 50123269.931741543 | C91: 15630458.182469003 | D91: =RC[-1]/26 -> 601171.46855650016 | E91: =RC[-1]/2 -> 300585.73427825008 | F91: =RC[-1]*1.5 -> 450878.60141737515 | G91: 526875.09718200006 | H91: =RC[-1]/2 -> 263437.54859100003 | I91: 665186.07899199997 | J91: =RC[-1]/2 -> 332593.03949599998 | K91: 613860.458537 | L91: =RC[-1]/2 -> 306930.2292685 | N91: =R[-1]C*1.03 -> 492751.27248879982 | CR91: =-0.06*((RC[-95]-1963)^2)+8.5*(RC[-95]-1963)+140 -> 421.24 | CS91: =RC[-1]+50 -> 471.24 | CT91: =RC[-2]-50 -> 371.24 | CU91: =RC[-3]+100 -> 521.24 | CV91: =RC[-4]-100 -> 321.24 | CW91: =-0.025*((RC[-100]-1963)^2)+5.5*(RC[-100]-1963)+175 -> 466.47500000000002
A92: 2053 | B92: 50167704.432710245 | C92: 15623440.200875001 | D92: =RC[-1]/26 -> 600901.5461875 | E92: =RC[-1]/2 -> 300450.77309375 | F92: =RC[-1]*1.5 -> 450676.159640625 | G92: 524562.76788099995 | H92: =RC[-1]/2 -> 262281.38394049997 | I92: 653098.32527000003 | J92: =RC[-1]/2 -> 326549.16263500002 | K92: 621746.51673599996 | L92: =RC[-1]/2 -> 310873.25836799998 | N92: =R[-1]C*1.03 -> 507533.81066346384 | CR92: =-0.06*((RC[-95]-1963)^2)+8.5*(RC[-95]-1963)+140 -> 419 | CS92: =RC[-1]+50 -> 469 | CT92: =RC[-2]-50 -> 369 | CU92: =RC[-3]+100 -> 519 | CV92: =RC[-4]-100 -> 319 | CW92: =-0.025*((RC[-100]-1963)^2)+5.5*(RC[-100]-1963)+175 -> 467.5
A93: 2054 | B93: 50204936.517177105 | C93: 15612179.440156 | D93: =RC[-1]/26 -> 600468.44000599999 | E93: =RC[-1]/2 -> 300234.22000299999 | F93: =RC[-1]*1.5 -> 450351.33000449999 | G93: 523094.898514 | H93: =RC[-1]/2 -> 261547.449257 | I93: 634640.87018900004 | J93: =RC[-1]/2 -> 317320.43509450002 | K93: 644265.094468 | L93: =RC[-1]/2 -> 322132.547234 | N93: =R[-1]C*1.03 -> 522759.82498336775 | CR93: =-0.06*((RC[-95]-1963)^2)+8.5*(RC[-95]-1963)+140 -> 416.64000000000004 | CS93: =RC[-1]+50 -> 466.64000000000004 | CT93: =RC[-2]-50 -> 366.64000000000004 | CU93: =RC[-3]+100 -> 516.6400000000001 | CV93: =RC[-4]-100 -> 316.64000000000004 | CW93: =-0.025*((RC[-100]-1963)^2)+5.5*(RC[-100]-1963)+175 -> 468.47500000000002
A94: 2055 | B94: 50235787.359512717 | C94: 15582843.552056998 | D94: =RC[-1]/26 -> 599340.13661757682 | E94: =RC[-1]/2 -> 299670.06830878841 | F94: =RC[-1]*1.5 -> 449505.10246318264 | G94: 522460.84402299998 | H94: =RC[-1]/2 -> 261230.42201149999 | I94: 641913.95792800002 | J94: =RC[-1]/2 -> 320956.97896400001 | K94: 658173.39964600001 | L94: =RC[-1]/2 -> 329086.699823 | N94: =R[-1]C*1.03 -> 538442.61973286886 | CR94: =-0.06*((RC[-95]-1963)^2)+8.5*(RC[-95]-1963)+140 -> 414.16 | CS94: =RC[-1]+50 -> 464.16 | CT94: =RC[-2]-50 -> 364.16 | CU94: =RC[-3]+100 -> 514.16000000000008 | CV94: =RC[-4]-100 -> 314.16000000000003 | CW94: =-0.025*((RC[-100]-1963)^2)+5.5*(RC[-100]-1963)+175 -> 469.4
A95: 2056 | B95: 50261085.996290706 | C95: 15544842.00092 | D95: =RC[-1]/26 -> 597878.53849692305 | E95: =RC[-1]/2 -> 298939.26924846153 | F95: =RC[-1]*1.5 -> 448408.90387269226 | G95: 522641.75681599998 | H95: =RC[-1]/2 -> 261320.87840799999 | I95: 639302.504923 | J95: =RC[-1]/2 -> 319651.2524615 | K95: 669215.337528 | L95: =RC[-1]/2 -> 334607.668764 | N95: =R[-1]C*1.03 -> 554595.8983248549 | CR95: =-0.06*((RC[-95]-1963)^2)+8.5*(RC[-95]-1963)+140 -> 411.56000000000006 | CS95: =RC[-1]+50 -> 461.56000000000006 | CT95: =RC[-2]-50 -> 361.56000000000006 | CU95: =RC[-3]+100 -> 511.56000000000006 | CV95: =RC[-4]-100 -> 311.56000000000006 | CW95: =-0.025*((RC[-100]-1963)^2)+5.5*(RC[-100]-1963)+175 -> 470.27499999999998
A96: 2057 | B96: 50281879.610119931 | C96: 15501819.808833003 | D96: =RC[-1]/26 -> 596223.8388012693 | E96: =RC[-1]/2 -> 298111.91940063465 | F96: =RC[-1]*1.5 -> 447167.87910095195 | G96: 523636.94304099999 | H96: =RC[-1]/2 -> 261818.4715205 | I96: 633805.43188199995 | J96: =RC[-1]/2 -> 316902.71594099997 | K96: 684166.12041500001 | L96: =RC[-1]/2 -> 342083.06020750001 | N96: =R[-1]C*1.03 -> 571233.7752746006 | CR96: =-0.06*((RC[-95]-1963)^2)+8.5*(RC[-95]-1963)+140 -> 408.84000000000003 | CS96: =RC[-1]+50 -> 458.84000000000003 | CT96: =RC[-2]-50 -> 358.84000000000003 | CU96: =RC[-3]+100 -> 508.84000000000003 | CV96: =RC[-4]-100 -> 308.84000000000003 | CW96: =-0.025*((RC[-100]-1963)^2)+5.5*(RC[-100]-1963)+175 -> 471.1
A97: 2058 | B97: 50299207.62650498 | C97: 15450615.752732001 | D97: =RC[-1]/26 -> 594254.45202815393 | E97: =RC[-1]/2 -> 297127.22601407696 | F97: =RC[-1]*1.5 -> 445690.83902111545 | G97: 525454.15762900002 | H97: =RC[-1]/2 -> 262727.07881450001 | I97: 619480.81557099998 | J97: =RC[-1]/2 -> 309740.40778549999 | K97: 692929.28563399997 | L97: =RC[-1]/2 -> 346464.64281699999 | N97: =R[-1]C*1.03 -> 588370.78853283869 | CR97: =-0.06*((RC[-95]-1963)^2)+8.5*(RC[-95]-1963)+140 -> 406 | CS97: =RC[-1]+50 -> 456 | CT97: =RC[-2]-50 -> 356 | CU97: =RC[-3]+100 -> 506 | CV97: =RC[-4]-100 -> 306 | CW97: =-0.025*((RC[-100]-1963)^2)+5.5*(RC[-100]-1963)+175 -> 471.875
A98: 2059 | B98: 50314376.397701398 | C98: 15398059.945600001 | D98: =RC[-1]/26 -> 592233.07483076933 | E98: =RC[-1]/2 -> 296116.53741538466 | F98: =RC[-1]*1.5 -> 444174.806123077 | G98: 528064.38300000003 | H98: =RC[-1]/2 -> 264032.19150000002 | I98: 602555.25508899998 | J98: =RC[-1]/2 -> 301277.62754449999 | K98: 714080.26184699999 | L98: =RC[-1]/2 -> 357040.13092349999 | N98: =R[-1]C*1.03 -> 606021.91218882392 | CR98: =-0.06*((RC[-95]-1963)^2)+8.5*(RC[-95]-1963)+140 -> 403.03999999999996 | CS98: =RC[-1]+50 -> 453.03999999999996 | CT98: =RC[-2]-50 -> 353.03999999999996 | CU98: =RC[-3]+100 -> 503.03999999999996 | CV98: =RC[-4]-100 -> 303.03999999999996 | CW98: =-0.025*((RC[-100]-1963)^2)+5.5*(RC[-100]-1963)+175 -> 472.6
A99: 2060 | B99: 50328697.880063541 | C99: 15332317.269176999 | D99: =RC[-1]/26 -> 589704.51035296149 | E99: =RC[-1]/2 -> 294852.25517648074 | F99: =RC[-1]*1.5 -> 442278.38276472111 | G99: 531462.60153700004 | H99: =RC[-1]/2 -> 265731.30076850002 | I99: 592057.68133799999 | J99: =RC[-1]/2 -> 296028.840669 | K99: 695210.74487699999 | L99: =RC[-1]/2 -> 347605.3724385 | N99: =R[-1]C*1.03 -> 624202.56955448864 | CR99: =-0.06*((RC[-95]-1963)^2)+8.5*(RC[-95]-1963)+140 -> 399.96000000000004 | CS99: =RC[-1]+50 -> 449.96000000000004 | CT99: =RC[-2]-50 -> 349.96000000000004 | CU99: =RC[-3]+100 -> 499.96000000000004 | CV99: =RC[-4]-100 -> 299.96000000000004 | CW99: =-0.025*((RC[-100]-1963)^2)+5.5*(RC[-100]-1963)+175 -> 473.27499999999998
A100: 2061 | B100: 50343453.207908727 | C100: 15292938.406192001 | D100: =RC[-1]/26 -> 588189.93869969237 | E100: =RC[-1]/2 -> 294094.96934984619 | F100: =RC[-1]*1.5 -> 441142.45402476925 | G100: 535658.90596700006 | H100: =RC[-1]/2 -> 267829.45298350003 | I100: 590764.09168399998 | J100: =RC[-1]/2 -> 295382.04584199999 | K100: 690424.02158099995 | L100: =RC[-1]/2 -> 345212.01079049997 | N100: =R[-1]C*1.03 -> 642928.64664112334 | CR100: =-0.06*((RC[-95]-1963)^2)+8.5*(RC[-95]-1963)+140 -> 396.76 | CS100: =RC[-1]+50 -> 446.76 | CT100: =RC[-2]-50 -> 346.76 | CU100: =RC[-3]+100 -> 496.76 | CV100: =RC[-4]-100 -> 296.76 | CW100: =-0.025*((RC[-100]-1963)^2)+5.5*(RC[-100]-1963)+175 -> 473.9
A101: 2062 | B101: 50359999.063408405 | C101: 15265908.189541997 | D101: =RC[-1]/26 -> 587150.31498238456 | E101: =RC[-1]/2 -> 293575.15749119228 | F101: =RC[-1]*1.5 -> 440362.73623678845 | G101: 540644.09927100001 | H101: =RC[-1]/2 -> 270322.04963550001 | I101: 588298.29584200005 | J101: =RC[-1]/2 -> 294149.14792100003 | K101: 690374.09718699998 | L101: =RC[-1]/2 -> 345187.04859349999 | N101: =R[-1]C*1.03 -> 662216.50604035705 | CR101: =-0.06*((RC[-95]-1963)^2)+8.5*(RC[-95]-1963)+140 -> 393.44000000000005 | CS101: =RC[-1]+50 -> 443.44000000000005 | CT101: =RC[-2]-50 -> 343.44000000000005 | CU101: =RC[-3]+100 -> 493.44000000000005 | CV101: =RC[-4]-100 -> 293.44000000000005 | CW101: =-0.025*((RC[-100]-1963)^2)+5.5*(RC[-100]-1963)+175 -> 474.47500000000002
A102: 2063 | B102: 50379523.408799686 | C102: 15246362.933799002 | D102: =RC[-1]/26 -> 586398.57437688473 | E102: =RC[-1]/2 -> 293199.28718844237 | F102: =RC[-1]*1.5 -> 439798.93078266352 | G102: 546368.08150099998 | H102: =RC[-1]/2 -> 273184.04075049999 | I102: 586545.58936900005 | J102: =RC[-1]/2 -> 293272.79468450003 | K102: 678735.50010900002 | L102: =RC[-1]/2 -> 339367.75005450001 | N102: =R[-1]C*1.03 -> 682083.00122156774 | CR102: =-0.06*((RC[-95]-1963)^2)+8.5*(RC[-95]-1963)+140 -> 390 | CS102: =RC[-1]+50 -> 440 | CT102: =RC[-2]-50 -> 340 | CU102: =RC[-3]+100 -> 490 | CV102: =RC[-4]-100 -> 290 | CW102: =-0.025*((RC[-100]-1963)^2)+5.5*(RC[-100]-1963)+175 -> 475
A103: 2064 | B103: 50403160.170872502 | C103: 15245547.482651999 | D103: =RC[-1]/26 -> 586367.21087123069 | E103: =RC[-1]/2 -> 293183.60543561535 | F103: =RC[-1]*1.5 -> 439775.40815342299 | G103: 552744.28050600004 | H103: =RC[-1]/2 -> 276372.14025300002 | I103: 585614.43457000004 | J103: =RC[-1]/2 -> 292807.21728500002 | K103: 660833.55361199996 | L103: =RC[-1]/2 -> 330416.77680599998 | N103: =R[-1]C*1.03 -> 702545.49125821481 | CR103: =-0.06*((RC[-95]-1963)^2)+8.5*(RC[-95]-1963)+140 -> 386.44000000000005 | CS103: =RC[-1]+50 -> 436.44000000000005 | CT103: =RC[-2]-50 -> 336.44000000000005 | CU103: =RC[-3]+100 -> 486.44000000000005 | CV103: =RC[-4]-100 -> 286.44000000000005 | CW103: =-0.025*((RC[-100]-1963)^2)+5.5*(RC[-100]-1963)+175 -> 475.47500000000002
A104: 2065 | B104: 50431968.111927852 | C104: 15269196.808126001 | D104: =RC[-1]/26 -> 587276.80031253851 | E104: =RC[-1]/2 -> 293638.40015626926 | F104: =RC[-1]*1.5 -> 440457.60023440386 | G104: 559645.17728099995 | H104: =RC[-1]/2 -> 279822.58864049998 | I104: 585495.56062600005 | J104: =RC[-1]/2 -> 292747.78031300002 | K104: 668111.38271399995 | L104: =RC[-1]/2 -> 334055.69135699997 | N104: =R[-1]C*1.03 -> 723621.85599596123 | CR104: =-0.06*((RC[-95]-1963)^2)+8.5*(RC[-95]-1963)+140 -> 382.76 | CS104: =RC[-1]+50 -> 432.76 | CT104: =RC[-2]-50 -> 332.76 | CU104: =RC[-3]+100 -> 482.76 | CV104: =RC[-4]-100 -> 282.76 | CW104: =-0.025*((RC[-100]-1963)^2)+5.5*(RC[-100]-1963)+175 -> 475.9
A105: 2066 | B105: 50467212.829404324 | C105: 15291475.850505002 | D105: =RC[-1]/26 -> 588133.68655788468 | E105: =RC[-1]/2 -> 294066.84327894234 | F105: =RC[-1]*1.5 -> 441100.26491841348 | G105: 566149.76716499997 | H105: =RC[-1]/2 -> 283074.88358249998 | I105: 586171.34084399999 | J105: =RC[-1]/2 -> 293085.670422 | K105: 665830.42997599998 | L105: =RC[-1]/2 -> 332915.21498799999 | N105: =R[-1]C*1.03 -> 745330.51167584013 | CR105: =-0.06*((RC[-95]-1963)^2)+8.5*(RC[-95]-1963)+140 -> 378.96000000000004 | CS105: =RC[-1]+50 -> 428.96000000000004 | CT105: =RC[-2]-50 -> 328.96000000000004 | CU105: =RC[-3]+100 -> 478.96000000000004 | CV105: =RC[-4]-100 -> 278.96000000000004 | CW105: =-0.025*((RC[-100]-1963)^2)+5.5*(RC[-100]-1963)+175 -> 476.27499999999998
A106: 2067 | B106: 50509906.803743988 | C106: 15321136.472655 | D106: =RC[-1]/26 -> 589274.47971750004 | E106: =RC[-1]/2 -> 294637.23985875002 | F106: =RC[-1]*1.5 -> 441955.85978812503 | G106: 572749.20403999998 | H106: =RC[-1]/2 -> 286374.60201999999 | I106: 587641.95743900002 | J106: =RC[-1]/2 -> 293820.97871950001 | K106: 660813.28320900002 | L106: =RC[-1]/2 -> 330406.64160450001 | N106: =R[-1]C*1.03 -> 767690.42702611536 | CR106: =-0.06*((RC[-95]-1963)^2)+8.5*(RC[-95]-1963)+140 -> 375.04000000000008 | CS106: =RC[-1]+50 -> 425.04000000000008 | CT106: =RC[-2]-50 -> 325.04000000000008 | CU106: =RC[-3]+100 -> 475.04000000000008 | CV106: =RC[-4]-100 -> 275.04000000000008 | CW106: =-0.025*((RC[-100]-1963)^2)+5.5*(RC[-100]-1963)+175 -> 476.59999999999997
A107: 2068 | B107: 50560885.739680126 | C107: 15360029.999605 | D107: =RC[-1]/26 -> 590770.38460019231 | E107: =RC[-1]/2 -> 295385.19230009615 | F107: =RC[-1]*1.5 -> 443077.78845014423 | G107: 579244.57840500004 | H107: =RC[-1]/2 -> 289622.28920250002 | I107: 589915.11751200003 | J107: =RC[-1]/2 -> 294957.55875600001 | K107: 647299.58405900002 | L107: =RC[-1]/2 -> 323649.79202950001 | N107: =R[-1]C*1.03 -> 790721.13983689889 | CR107: =-0.06*((RC[-95]-1963)^2)+8.5*(RC[-95]-1963)+140 -> 371 | CS107: =RC[-1]+50 -> 421 | CT107: =RC[-2]-50 -> 321 | CU107: =RC[-3]+100 -> 471 | CV107: =RC[-4]-100 -> 271 | CW107: =-0.025*((RC[-100]-1963)^2)+5.5*(RC[-100]-1963)+175 -> 476.875
A108: 2069 | B108: 50621035.150276914 | C108: 15415713.370708 | D108: =RC[-1]/26 -> 592912.05271953845 | E108: =RC[-1]/2 -> 296456.02635976922 | F108: =RC[-1]*1.5 -> 444684.03953965381 | G108: 585443.35030000005 | H108: =RC[-1]/2 -> 292721.67515000002 | I108: 592964.33088200004 | J108: =RC[-1]/2 -> 296482.16544100002 | K108: 631249.16354600003 | L108: =RC[-1]/2 -> 315624.58177300001 | N108: =R[-1]C*1.03 -> 814442.77403200592 | CR108: =-0.06*((RC[-95]-1963)^2)+8.5*(RC[-95]-1963)+140 -> 366.84000000000003 | CS108: =RC[-1]+50 -> 416.84000000000003 | CT108: =RC[-2]-50 -> 316.84000000000003 | CU108: =RC[-3]+100 -> 466.84000000000003 | CV108: =RC[-4]-100 -> 266.84000000000003 | CW108: =-0.025*((RC[-100]-1963)^2)+5.5*(RC[-100]-1963)+175 -> 477.09999999999997
A109: 2070 | B109: 50690990.215817258 | C109: 15489799.994334999 | D109: =RC[-1]/26 -> 595761.53824365383 | E109: =RC[-1]/2 -> 297880.76912182692 | F109: =RC[-1]*1.5 -> 446821.15368274041 | G109: 591170.35224299994 | H109: =RC[-1]/2 -> 295585.17612149997 | I109: 596784.95242700004 | J109: =RC[-1]/2 -> 298392.47621350002 | K109: 621442.19025300001 | L109: =RC[-1]/2 -> 310721.0951265 | N109: =R[-1]C*1.03 -> 838876.0572529661 | CR109: =-0.06*((RC[-95]-1963)^2)+8.5*(RC[-95]-1963)+140 -> 362.56000000000006 | CS109: =RC[-1]+50 -> 412.56000000000006 | CT109: =RC[-2]-50 -> 312.56000000000006 | CU109: =RC[-3]+100 -> 462.56000000000006 | CV109: =RC[-4]-100 -> 262.56000000000006 | CW109: =-0.025*((RC[-100]-1963)^2)+5.5*(RC[-100]-1963)+175 -> 477.27499999999998

Sheet: Quarterly
A1: Quarter | B1: HPI | C1: Unemployment | D1: Price Idealista | E1: Price Notaries | F1: Sales | G1: Spread | H1: Sharp change | I1: Ide.1 | J1: Ide.2 | K1: Ide.3 | L1: Not.1 | M1: Not.2 | N1: Not.3 | O1: Construction period
A2: 2007T1 | B2: 145.935 | C2: 8.42 | D2: =AVERAGE(RC[5]:RC[7]) -> 1995.6666666666667 | E2: =AVERAGE(RC[7]:RC[9]) -> 1756 | F2: 230023 | G2: =ABS(((RC[-2]*100/RC[-3])-100)*-1) -> 12.009353599465513 | H2: =RC[-4] -> 1995.6666666666667 | I2: 1980 | J2: 1984 | K2: 2023 | L2: 1756 | M2: 1756 | N2: 1756 | O2: Before 1921 | P2: 855700
A3: 2007T2 | B3: 150.10300000000001 | C3: 7.93 | D3: =AVERAGE(RC[5]:RC[7]) -> 2037.3333333333333 | E3: =AVERAGE(RC[7]:RC[9]) -> 1810.0966666666666 | F3: 202585 | G3: =ABS(((RC[-2]*100/RC[-3])-100)*-1) -> 11.153632198952877 | H3: =RC[-4]+(RC[-3]-R[-1]C[-3]) -> 2091.4299999999998 | I3: 2015 | J3: 2044 | K3: 2053 | L3: 1773.54 | M3: 1806.79 | N3: 1849.96 | O3: 1921-1940 | P3: 572400
A4: 2007T3 | B4: 151.71899999999999 | C4: 8.01 | D4: =AVERAGE(RC[5]:RC[7]) -> 2031 | E4: =AVERAGE(RC[7]:RC[9]) -> 1782.9466666666667 | F4: 184326 | G4: =ABS(((RC[-2]*100/RC[-3])-100)*-1) -> 12.213359592975536 | H4: =RC[-4]+(RC[-3]-R[-1]C[-3]) -> 2003.8500000000001 | I4: 2045 | J4: 2026 | K4: 2022 | L4: 1886.68 | M4: 1661.57 | N4: 1800.59 | O4: 1941-1960 | P4: 1766500
A5: 2007T4 | B5: 150.63999999999999 | C5: 8.57 | D5: =AVERAGE(RC[5]:RC[7]) -> 2036 | E5: =AVERAGE(RC[7]:RC[9]) -> 1812.3799999999999 | F5: 158366 | G5: =ABS(((RC[-2]*100/RC[-3])-100)*-1) -> 10.983300589390964 | H5: =RC[-4]+(RC[-3]-R[-1]C[-3]) -> 2065.4333333333334 | I5: 2039 | J5: 2046 | K5: 2023 | L5: 1784.15 | M5: 1800.89 | N5: 1852.1 | O5: 1961-1980 | P5: 6459300
A6: 2008T1 | B6: 150.08199999999999 | C6: 9.6 | D6: =AVERAGE(RC[5]:RC[7]) -> 2013 | E6: =AVERAGE(RC[7]:RC[9]) -> 1779.1966666666667 | F6: 162267 | G6: =ABS(((RC[-2]*100/RC[-3])-100)*-1) -> 11.614671303195877 | H6: =RC[-4]+(RC[-3]-R[-1]C[-3]) -> 1979.8166666666668 | I6: 2011 | J6: 2009 | K6: 2019 | L6: 1790.49 | M6: 1758.3 | N6: 1788.8 | O6: 1981-2000 | P6: 5642500
A7: 2008T2 | B7: 149.61799999999999 | C7: 10.36 | D7: =AVERAGE(RC[5]:RC[7]) -> 2014.6666666666667 | E7: =AVERAGE(RC[7]:RC[9]) -> 1788.04 | F7: 150981 | G7: =ABS(((RC[-2]*100/RC[-3])-100)*-1) -> 11.248841826604902 | H7: =RC[-4]+(RC[-3]-R[-1]C[-3]) -> 2023.51 | I7: 2023 | J7: 2013 | K7: 2008 | L7: 1791.67 | M7: 1765.94 | N7: 1806.51 | O7: 2001-2020 | P7: 4913300
A8: 2008T3 | B8: 147.13399999999999 | C8: 11.23 | D8: =AVERAGE(RC[5]:RC[7]) -> 1959.3333333333333 | E8: =AVERAGE(RC[7]:RC[9]) -> 1730.74 | F8: 128773 | G8: =ABS(((RC[-2]*100/RC[-3])-100)*-1) -> 11.666893501190884 | H8: =RC[-4]+(RC[-3]-R[-1]C[-3]) -> 1902.0333333333333 | I8: 1979 | J8: 1953 | K8: 1946 | L8: 1799.46 | M8: 1648.27 | N8: 1744.49 | O8: 2021-2040 | P8: =AVERAGE(Yearly!R[52]C[40])*20 -> 1885000
A9: 2008T4 | B9: 142.511 | C9: 13.79 | D9: =AVERAGE(RC[5]:RC[7]) -> 1934 | E9: =AVERAGE(RC[7]:RC[9]) -> 1736.1933333333334 | F9: 110059 | G9: =ABS(((RC[-2]*100/RC[-3])-100)*-1) -> 10.22785246466735 | H9: =RC[-4]+(RC[-3]-R[-1]C[-3]) -> 1939.4533333333334 | I9: 1938 | J9: 1943 | K9: 1921 | L9: 1765.74 | M9: 1687.57 | N9: 1755.27 | O9: SUM | P9: =SUM(R[-7]C:R[-1]C) -> 22094700
A10: 2009T1 | B10: 138.69300000000001 | C10: 17.239999999999998 | D10: =AVERAGE(RC[5]:RC[7]) -> 1922 | E10: =AVERAGE(RC[7]:RC[9]) -> 1695.5100000000002 | F10: 106523 | G10: =ABS(((RC[-2]*100/RC[-3])-100)*-1) -> 11.784079084287185 | H10: =RC[-4]+(RC[-3]-R[-1]C[-3]) -> 1881.3166666666668 | I10: 1921 | J10: 1918 | K10: 1927 | L10: 1708.89 | M10: 1677.76 | N10: 1699.88
A11: 2009T2 | B11: 138.08199999999999 | C11: 17.77 | D11: =AVERAGE(RC[5]:RC[7]) -> 1911.6666666666667 | E11: =AVERAGE(RC[7]:RC[9]) -> 1700.39 | F11: 97788 | G11: =ABS(((RC[-2]*100/RC[-3])-100)*-1) -> 11.051961639058419 | H11: =RC[-4]+(RC[-3]-R[-1]C[-3]) -> 1916.5466666666666 | I11: 1921 | J11: 1913 | K11: 1901 | L11: 1698.65 | M11: 1698.04 | N11: 1704.48
A12: 2009T3 | B12: 136.845 | C12: 17.75 | D12: =AVERAGE(RC[5]:RC[7]) -> 1886 | E12: =AVERAGE(RC[7]:RC[9]) -> 1666.6266666666668 | F12: 109084 | G12: =ABS(((RC[-2]*100/RC[-3])-100)*-1) -> 11.631671968893585 | H12: =RC[-4]+(RC[-3]-R[-1]C[-3]) -> 1852.2366666666667 | I12: 1897 | J12: 1883 | K12: 1878 | L12: 1719.54 | M12: 1570.93 | N12: 1709.41
A13: 2009T4 | B13: 136.31299999999999 | C13: 18.66 | D13: =AVERAGE(RC[5]:RC[7]) -> 1876.6666666666667 | E13: =AVERAGE(RC[7]:RC[9]) -> 1687.4466666666667 | F13: 99998 | G13: =ABS(((RC[-2]*100/RC[-3])-100)*-1) -> 10.08277087033747 | H13: =RC[-4]+(RC[-3]-R[-1]C[-3]) -> 1897.4866666666667 | I13: 1878 | J13: 1879 | K13: 1873 | L13: 1654.49 | M13: 1674.7 | N13: 1733.15
A14: 2010T1 | B14: 134.626 | C14: 19.84 | D14: =AVERAGE(RC[5]:RC[7]) -> 1877.3333333333333 | E14: =AVERAGE(RC[7]:RC[9]) -> 1685.6233333333332 | F14: 116483 | G14: =ABS(((RC[-2]*100/RC[-3])-100)*-1) -> 10.211825284090921 | H14: =RC[-4]+(RC[-3]-R[-1]C[-3]) -> 1875.5099999999998 | I14: 1873 | J14: 1871 | K14: 1888 | L14: 1701.22 | M14: 1687.45 | N14: 1668.2
A15: 2010T2 | B15: 136.79 | C15: 19.89 | D15: =AVERAGE(RC[5]:RC[7]) -> 1905.6666666666667 | E15: =AVERAGE(RC[7]:RC[9]) -> 1701.6766666666665 | F15: 109139 | G15: =ABS(((RC[-2]*100/RC[-3])-100)*-1) -> 10.704390414553103 | H15: =RC[-4]+(RC[-3]-R[-1]C[-3]) -> 1921.72 | I15: 1898 | J15: 1909 | K15: 1910 | L15: 1678.72 | M15: 1675.8 | N15: 1750.51
A16: 2010T3 | B16: 133.846 | C16: 19.59 | D16: =AVERAGE(RC[5]:RC[7]) -> 1927.3333333333333 | E16: =AVERAGE(RC[7]:RC[9]) -> 1576.0966666666666 | F16: 123241 | G16: =ABS(((RC[-2]*100/RC[-3])-100)*-1) -> 18.223970944309926 | H16: =RC[-4]+(RC[-3]-R[-1]C[-3]) -> 1801.7533333333333 | I16: 1931 | J16: 1924 | K16: 1927 | L16: 1636.3 | M16: 1484.71 | N16: 1607.28
A17: 2010T4 | B17: 133.71799999999999 | C17: 20.11 | D17: =AVERAGE(RC[5]:RC[7]) -> 1955.3333333333333 | E17: =AVERAGE(RC[7]:RC[9]) -> 1624.0633333333335 | F17: 90728 | G17: =ABS(((RC[-2]*100/RC[-3])-100)*-1) -> 16.941868394135696 | H17: =RC[-4]+(RC[-3]-R[-1]C[-3]) -> 2003.3000000000002 | I17: 1943 | J17: 1960 | K17: 1963 | L17: 1606.9 | M17: 1607.69 | N17: 1657.6
A18: 2011T1 | B18: 129.059 | C18: 21.08 | D18: =AVERAGE(RC[5]:RC[7]) -> 1970 | E18: =AVERAGE(RC[7]:RC[9]) -> 1563.7700000000002 | F18: 122933 | G18: =ABS(((RC[-2]*100/RC[-3])-100)*-1) -> 20.620812182741105 | H18: =RC[-4]+(RC[-3]-R[-1]C[-3]) -> 1909.7066666666667 | I18: 1963 | J18: 1963 | K18: 1984 | L18: 1589.82 | M18: 1515.44 | N18: 1586.05
A19: 2011T2 | B19: 127.52800000000001 | C19: 20.64 | D19: =AVERAGE(RC[5]:RC[7]) -> 1983 | E19: =AVERAGE(RC[7]:RC[9]) -> 1555.29 | F19: 83440 | G19: =ABS(((RC[-2]*100/RC[-3])-100)*-1) -> 21.568835098335853 | H19: =RC[-4]+(RC[-3]-R[-1]C[-3]) -> 1974.5199999999998 | I19: 1983 | J19: 1984 | K19: 1982 | L19: 1602.62 | M19: 1522.65 | N19: 1540.6
A20: 2011T3 | B20: 123.94799999999999 | C20: 21.28 | D20: =AVERAGE(RC[5]:RC[7]) -> 1961 | E20: =AVERAGE(RC[7]:RC[9]) -> 1507.0066666666664 | F20: 80736 | G20: =ABS(((RC[-2]*100/RC[-3])-100)*-1) -> 23.151113377528475 | H20: =RC[-4]+(RC[-3]-R[-1]C[-3]) -> 1912.7166666666665 | I20: 1976 | J20: 1965 | K20: 1942 | L20: 1575.97 | M20: 1444.06 | N20: 1500.99
A21: 2011T4 | B21: 118.782 | C21: 22.56 | D21: =AVERAGE(RC[5]:RC[7]) -> 1929.3333333333333 | E21: =AVERAGE(RC[7]:RC[9]) -> 1501.37 | F21: 72715 | G21: =ABS(((RC[-2]*100/RC[-3])-100)*-1) -> 22.181928127159637 | H21: =RC[-4]+(RC[-3]-R[-1]C[-3]) -> 1923.6966666666667 | I21: 1940 | J21: 1935 | K21: 1913 | L21: 1432 | M21: 1453.04 | N21: 1619.07
A22: 2012T1 | B22: 112.861 | C22: 24.19 | D22: =AVERAGE(RC[5]:RC[7]) -> 1879 | E22: =AVERAGE(RC[7]:RC[9]) -> 1379.1233333333332 | F22: 88884 | G22: =ABS(((RC[-2]*100/RC[-3])-100)*-1) -> 26.6033351073266 | H22: =RC[-4]+(RC[-3]-R[-1]C[-3]) -> 1756.7533333333333 | I22: 1902 | J22: 1877 | K22: 1858 | L22: 1349.22 | M22: 1431.61 | N22: 1356.54
A23: 2012T2 | B23: 109.187 | C23: 24.4 | D23: =AVERAGE(RC[5]:RC[7]) -> 1830 | E23: =AVERAGE(RC[7]:RC[9]) -> 1373.6200000000001 | F23: 73857 | G23: =ABS(((RC[-2]*100/RC[-3])-100)*-1) -> 24.938797814207646 | H23: =RC[-4]+(RC[-3]-R[-1]C[-3]) -> 1824.4966666666669 | I23: 1846 | J23: 1828 | K23: 1816 | L23: 1363.87 | M23: 1343.72 | N23: 1413.27
A24: 2012T3 | B24: 105.07299999999999 | C24: 24.79 | D24: =AVERAGE(RC[5]:RC[7]) -> 1770.3333333333333 | E24: =AVERAGE(RC[7]:RC[9]) -> 1336.68 | F24: 80964 | G24: =ABS(((RC[-2]*100/RC[-3])-100)*-1) -> 24.495575221238937 | H24: =RC[-4]+(RC[-3]-R[-1]C[-3]) -> 1733.3933333333332 | I24: 1800 | J24: 1771 | K24: 1740 | L24: 1437.51 | M24: 1210.53 | N24: 1362
A25: 2012T4 | B25: 103.593 | C25: 25.77 | D25: =AVERAGE(RC[5]:RC[7]) -> 1729.3333333333333 | E25: =AVERAGE(RC[7]:RC[9]) -> 1344.37 | F25: 74829 | G25: =ABS(((RC[-2]*100/RC[-3])-100)*-1) -> 22.260794140323824 | H25: =RC[-4]+(RC[-3]-R[-1]C[-3]) -> 1737.0233333333331 | I25: 1742 | J25: 1734 | K25: 1712 | L25: 1345.8 | M25: 1298.78 | N25: 1388.53
A26: 2013T1 | B26: 96.768000000000001 | C26: 26.94 | D26: =AVERAGE(RC[5]:RC[7]) -> 1681.6666666666667 | E26: =AVERAGE(RC[7]:RC[9]) -> 1226.9333333333334 | F26: 97473 | G26: =ABS(((RC[-2]*100/RC[-3])-100)*-1) -> 27.0406342913776 | H26: =RC[-4]+(RC[-3]-R[-1]C[-3]) -> 1564.2300000000002 | I26: 1687 | J26: 1682 | K26: 1676 | L26: 1187.8900000000001 | M26: 1181.25 | N26: 1311.66
A27: 2013T2 | B27: 96.040999999999997 | C27: 26.06 | D27: =AVERAGE(RC[5]:RC[7]) -> 1656.3333333333333 | E27: =AVERAGE(RC[7]:RC[9]) -> 1250.3999999999999 | F27: 74373 | G27: =ABS(((RC[-2]*100/RC[-3])-100)*-1) -> 24.507949285570547 | H27: =RC[-4]+(RC[-3]-R[-1]C[-3]) -> 1679.7999999999997 | I27: 1663 | J27: 1658 | K27: 1648 | L27: 1208.21 | M27: 1256.21 | N27: 1286.78
A28: 2013T3 | B28: 96.742000000000004 | C28: 25.65 | D28: =AVERAGE(RC[5]:RC[7]) -> 1632.3333333333333 | E28: =AVERAGE(RC[7]:RC[9]) -> 1246.6133333333335 | F28: 73373 | G28: =ABS(((RC[-2]*100/RC[-3])-100)*-1) -> 23.629977537267706 | H28: =RC[-4]+(RC[-3]-R[-1]C[-3]) -> 1628.5466666666669 | I28: 1644 | J28: 1630 | K28: 1623 | L28: 1300.8800000000001 | M28: 1215.54 | N28: 1223.42
A29: 2013T4 | B29: 95.512 | C29: 25.73 | D29: =AVERAGE(RC[5]:RC[7]) -> 1608.3333333333333 | E29: =AVERAGE(RC[7]:RC[9]) -> 1250.2166666666667 | F29: 67374 | G29: =ABS(((RC[-2]*100/RC[-3])-100)*-1) -> 22.266321243523308 | H29: =RC[-4]+(RC[-3]-R[-1]C[-3]) -> 1611.9366666666665 | I29: 1611 | J29: 1608 | K29: 1606 | L29: 1269.1300000000001 | M29: 1212.81 | N29: 1268.71
A30: 2014T1 | B30: 95.207999999999998 | C30: 25.93 | D30: =AVERAGE(RC[5]:RC[7]) -> 1593 | E30: =AVERAGE(RC[7]:RC[9]) -> 1280.5033333333333 | F30: 82940 | G30: =ABS(((RC[-2]*100/RC[-3])-100)*-1) -> 19.616865453023649 | H30: =RC[-4]+(RC[-3]-R[-1]C[-3]) -> 1623.2866666666666 | I30: 1603 | J30: 1602 | K30: 1574 | L30: 1312.64 | M30: 1230.1199999999999 | N30: 1298.75
A31: 2014T2 | B31: 96.805000000000007 | C31: 24.47 | D31: =AVERAGE(RC[5]:RC[7]) -> 1561.6666666666667 | E31: =AVERAGE(RC[7]:RC[9]) -> 1252.5166666666667 | F31: 78814 | G31: =ABS(((RC[-2]*100/RC[-3])-100)*-1) -> 19.796157950907158 | H31: =RC[-4]+(RC[-3]-R[-1]C[-3]) -> 1533.68 | I31: 1555 | J31: 1567 | K31: 1563 | L31: 1236.6099999999999 | M31: 1257.8 | N31: 1263.1400000000001
A32: 2014T3 | B32: 97.001999999999995 | C32: 23.67 | D32: =AVERAGE(RC[5]:RC[7]) -> 1551.6666666666667 | E32: =AVERAGE(RC[7]:RC[9]) -> 1221.8433333333335 | F32: 79356 | G32: =ABS(((RC[-2]*100/RC[-3])-100)*-1) -> 21.256068743286789 | H32: =RC[-4]+(RC[-3]-R[-1]C[-3]) -> 1520.9933333333336 | I32: 1562 | J32: 1550 | K32: 1543 | L32: 1277.4000000000001 | M32: 1166.1099999999999 | N32: 1222.02
A33: 2014T4 | B33: 97.194000000000003 | C33: 23.7 | D33: =AVERAGE(RC[5]:RC[7]) -> 1556 | E33: =AVERAGE(RC[7]:RC[9]) -> 1245.4933333333331 | F33: 77720 | G33: =ABS(((RC[-2]*100/RC[-3])-100)*-1) -> 19.955441302485013 | H33: =RC[-4]+(RC[-3]-R[-1]C[-3]) -> 1579.6499999999996 | I33: 1546 | J33: 1559 | K33: 1563 | L33: 1229.83 | M33: 1232.74 | N33: 1273.9100000000001
A34: 2015T1 | B34: 96.650999999999996 | C34: 23.78 | D34: =AVERAGE(RC[5]:RC[7]) -> 1551.3333333333333 | E34: =AVERAGE(RC[7]:RC[9]) -> 1246.6166666666666 | F34: 90748 | G34: =ABS(((RC[-2]*100/RC[-3])-100)*-1) -> 19.642243231628711 | H34: =RC[-4]+(RC[-3]-R[-1]C[-3]) -> 1552.4566666666667 | I34: 1554 | J34: 1549 | K34: 1551 | L34: 1277.72 | M34: 1225.57 | N34: 1236.56
A35: 2015T2 | B35: 100.687 | C35: 22.37 | D35: =AVERAGE(RC[5]:RC[7]) -> 1549 | E35: =AVERAGE(RC[7]:RC[9]) -> 1301.2366666666667 | F35: 87612 | G35: =ABS(((RC[-2]*100/RC[-3])-100)*-1) -> 15.995050570260375 | H35: =RC[-4]+(RC[-3]-R[-1]C[-3]) -> 1603.6200000000001 | I35: 1548 | J35: 1552 | K35: 1547 | L35: 1307.98 | M35: 1280.53 | N35: 1315.2
A36: 2015T3 | B36: 101.358 | C36: 21.18 | D36: =AVERAGE(RC[5]:RC[7]) -> 1530.6666666666667 | E36: =AVERAGE(RC[7]:RC[9]) -> 1254.8799999999999 | F36: 93115 | G36: =ABS(((RC[-2]*100/RC[-3])-100)*-1) -> 18.017421602787465 | H36: =RC[-4]+(RC[-3]-R[-1]C[-3]) -> 1484.31 | I36: 1544 | J36: 1526 | K36: 1522 | L36: 1320.46 | M36: 1163.08 | N36: 1281.0999999999999
A37: 2015T4 | B37: 101.30500000000001 | C37: 20.9 | D37: =AVERAGE(RC[5]:RC[7]) -> 1526.3333333333333 | E37: =AVERAGE(RC[7]:RC[9]) -> 1283.5133333333333 | F37: 84081 | G37: =ABS(((RC[-2]*100/RC[-3])-100)*-1) -> 15.908713692946051 | H37: =RC[-4]+(RC[-3]-R[-1]C[-3]) -> 1554.9666666666667 | I37: 1525 | J37: 1526 | K37: 1528 | L37: 1255.8900000000001 | M37: 1281.94 | N37: 1312.71
A38: 2016T1 | B38: 102.77500000000001 | C38: 21 | D38: =AVERAGE(RC[5]:RC[7]) -> 1525.6666666666667 | E38: =AVERAGE(RC[7]:RC[9]) -> 1299.5466666666664 | F38: 99620 | G38: =ABS(((RC[-2]*100/RC[-3])-100)*-1) -> 14.821061830893612 | H38: =RC[-4]+(RC[-3]-R[-1]C[-3]) -> 1541.6999999999998 | I38: 1524 | J38: 1526 | K38: 1527 | L38: 1331.29 | M38: 1273.03 | N38: 1294.32
A39: 2016T2 | B39: 104.601 | C39: 20 | D39: =AVERAGE(RC[5]:RC[7]) -> 1518.3333333333333 | E39: =AVERAGE(RC[7]:RC[9]) -> 1319.3233333333335 | F39: 108662 | G39: =ABS(((RC[-2]*100/RC[-3])-100)*-1) -> 13.107135016465406 | H39: =RC[-4]+(RC[-3]-R[-1]C[-3]) -> 1538.1100000000004 | I39: 1524 | J39: 1516 | K39: 1515 | L39: 1304.6600000000001 | M39: 1313.93 | N39: 1339.38
A40: 2016T3 | B40: 105.431 | C40: 18.91 | D40: =AVERAGE(RC[5]:RC[7]) -> 1506 | E40: =AVERAGE(RC[7]:RC[9]) -> 1265.42 | F40: 103640 | G40: =ABS(((RC[-2]*100/RC[-3])-100)*-1) -> 15.974767596281538 | H40: =RC[-4]+(RC[-3]-R[-1]C[-3]) -> 1452.0966666666666 | I40: 1509 | J40: 1512 | K40: 1497 | L40: 1340.07 | M40: 1156.1600000000001 | N40: 1300.03
A41: 2016T4 | B41: 105.848 | C41: 18.63 | D41: =AVERAGE(RC[5]:RC[7]) -> 1507.6666666666667 | E41: =AVERAGE(RC[7]:RC[9]) -> 1332.8966666666668 | F41: 93463 | G41: =ABS(((RC[-2]*100/RC[-3])-100)*-1) -> 11.592084899403048 | H41: =RC[-4]+(RC[-3]-R[-1]C[-3]) -> 1575.1433333333334 | I41: 1496 | J41: 1506 | K41: 1521 | L41: 1341.26 | M41: 1299.7 | N41: 1357.73
A42: 2017T1 | B42: 108.239 | C42: 18.75 | D42: =AVERAGE(RC[5]:RC[7]) -> 1525.3333333333333 | E42: =AVERAGE(RC[7]:RC[9]) -> 1354.97 | F42: 114965 | G42: =ABS(((RC[-2]*100/RC[-3])-100)*-1) -> 11.168924825174827 | H42: =RC[-4]+(RC[-3]-R[-1]C[-3]) -> 1547.4066666666665 | I42: 1524 | J42: 1522 | K42: 1530 | L42: 1368.55 | M42: 1349.41 | N42: 1346.95
A43: 2017T2 | B43: 110.41 | C43: 17.22 | D43: =AVERAGE(RC[5]:RC[7]) -> 1538.3333333333333 | E43: =AVERAGE(RC[7]:RC[9]) -> 1390.4066666666668 | F43: 121395 | G43: =ABS(((RC[-2]*100/RC[-3])-100)*-1) -> 9.6160346695557735 | H43: =RC[-4]+(RC[-3]-R[-1]C[-3]) -> 1573.77 | I43: 1537 | J43: 1535 | K43: 1543 | L43: 1411.97 | M43: 1363.87 | N43: 1395.38
A44: 2017T3 | B44: 112.44199999999999 | C44: 16.38 | D44: =AVERAGE(RC[5]:RC[7]) -> 1549.6666666666667 | E44: =AVERAGE(RC[7]:RC[9]) -> 1353.1233333333332 | F44: 120069 | G44: =ABS(((RC[-2]*100/RC[-3])-100)*-1) -> 12.68294256829428 | H44: =RC[-4]+(RC[-3]-R[-1]C[-3]) -> 1512.3833333333332 | I44: 1564 | J44: 1551 | K44: 1534 | L44: 1440.58 | M44: 1225.26 | N44: 1393.53
A45: 2017T4 | B45: 113.45699999999999 | C45: 16.55 | D45: =AVERAGE(RC[5]:RC[7]) -> 1552 | E45: =AVERAGE(RC[7]:RC[9]) -> 1369.5666666666666 | F45: 111215 | G45: =ABS(((RC[-2]*100/RC[-3])-100)*-1) -> 11.754725085910664 | H45: =RC[-4]+(RC[-3]-R[-1]C[-3]) -> 1568.4433333333334 | I45: 1544 | J45: 1555 | K45: 1557 | L45: 1371.99 | M45: 1356.08 | N45: 1380.63
A46: 2018T1 | B46: 114.994 | C46: 16.739999999999998 | D46: =AVERAGE(RC[5]:RC[7]) -> 1589 | E46: =AVERAGE(RC[7]:RC[9]) -> 1372.1333333333332 | F46: 129164 | G46: =ABS(((RC[-2]*100/RC[-3])-100)*-1) -> 13.64799664359137 | H46: =RC[-4]+(RC[-3]-R[-1]C[-3]) -> 1591.5666666666666 | I46: 1570 | J46: 1590 | K46: 1607 | L46: 1388.17 | M46: 1363.29 | N46: 1364.94
A47: 2018T2 | B47: 117.941 | C47: 15.28 | D47: =AVERAGE(RC[5]:RC[7]) -> 1622 | E47: =AVERAGE(RC[7]:RC[9]) -> 1413.0166666666667 | F47: 134405 | G47: =ABS(((RC[-2]*100/RC[-3])-100)*-1) -> 12.88429921907111 | H47: =RC[-4]+(RC[-3]-R[-1]C[-3]) -> 1662.8833333333334 | I47: 1612 | J47: 1619 | K47: 1635 | L47: 1431.43 | M47: 1386.2 | N47: 1421.42
A48: 2018T3 | B48: 120.491 | C48: 14.55 | D48: =AVERAGE(RC[5]:RC[7]) -> 1659 | E48: =AVERAGE(RC[7]:RC[9]) -> 1403.5733333333335 | F48: 134156 | G48: =ABS(((RC[-2]*100/RC[-3])-100)*-1) -> 15.396423548322275 | H48: =RC[-4]+(RC[-3]-R[-1]C[-3]) -> 1649.5566666666668 | I48: 1650 | J48: 1661 | K48: 1666 | L48: 1468 | M48: 1284.31 | N48: 1458.41
A49: 2018T4 | B49: 120.95399999999999 | C49: 14.45 | D49: =AVERAGE(RC[5]:RC[7]) -> 1678.3333333333333 | E49: =AVERAGE(RC[7]:RC[9]) -> 1422.2366666666667 | F49: 120259 | G49: =ABS(((RC[-2]*100/RC[-3])-100)*-1) -> 15.258987090367427 | H49: =RC[-4]+(RC[-3]-R[-1]C[-3]) -> 1696.9966666666664 | I49: 1666 | J49: 1684 | K49: 1685 | L49: 1396.47 | M49: 1411.77 | N49: 1458.47
A50: 2019T1 | B50: 122.758 | C50: 14.7 | D50: =AVERAGE(RC[5]:RC[7]) -> 1694.3333333333333 | E50: =AVERAGE(RC[7]:RC[9]) -> 1421.96 | F50: 135031 | G50: =ABS(((RC[-2]*100/RC[-3])-100)*-1) -> 16.07554593743852 | H50: =RC[-4]+(RC[-3]-R[-1]C[-3]) -> 1694.0566666666666 | I50: 1686 | J50: 1694 | K50: 1703 | L50: 1452.43 | M50: 1386.39 | N50: 1427.06
A51: 2019T2 | B51: 124.175 | C51: 14.02 | D51: =AVERAGE(RC[5]:RC[7]) -> 1718 | E51: =AVERAGE(RC[7]:RC[9]) -> 1425.34 | F51: 130987 | G51: =ABS(((RC[-2]*100/RC[-3])-100)*-1) -> 17.034924330617002 | H51: =RC[-4]+(RC[-3]-R[-1]C[-3]) -> 1721.3799999999999 | I51: 1709 | J51: 1712 | K51: 1733 | L51: 1417.99 | M51: 1408.33 | N51: 1449.7
A52: 2019T3 | B52: 126.13500000000001 | C52: 13.92 | D52: =AVERAGE(RC[5]:RC[7]) -> 1740.6666666666667 | E52: =AVERAGE(RC[7]:RC[9]) -> 1449.3566666666666 | F52: 121256 | G52: =ABS(((RC[-2]*100/RC[-3])-100)*-1) -> 16.735541937954821 | H52: =RC[-4]+(RC[-3]-R[-1]C[-3]) -> 1764.6833333333334 | I52: 1738 | J52: 1749 | K52: 1735 | L52: 1519.39 | M52: 1370.26 | N52: 1458.42
A53: 2019T4 | B53: 125.32 | C53: 13.78 | D53: =AVERAGE(RC[5]:RC[7]) -> 1755 | E53: =AVERAGE(RC[7]:RC[9]) -> 1449.9433333333334 | F53: 116272 | G53: =ABS(((RC[-2]*100/RC[-3])-100)*-1) -> 17.382146248812916 | H53: =RC[-4]+(RC[-3]-R[-1]C[-3]) -> 1755.5866666666668 | I53: 1741 | J53: 1761 | K53: 1763 | L53: 1427.36 | M53: 1444.51 | N53: 1477.96
A54: 2020T1 | B54: 126.69499999999999 | C54: 14.41 | D54: =AVERAGE(RC[5]:RC[7]) -> 1756 | E54: =AVERAGE(RC[7]:RC[9]) -> 1460.38 | F54: 125837 | G54: =ABS(((RC[-2]*100/RC[-3])-100)*-1) -> 16.834851936218683 | H54: =RC[-4]+(RC[-3]-R[-1]C[-3]) -> 1766.4366666666667 | I54: 1758 | J54: 1752 | K54: 1758 | L54: 1492 | M54: 1439.14 | N54: 1450
A55: 2020T2 | B55: 126.79900000000001 | C55: 15.33 | D55: =AVERAGE(RC[5]:RC[7]) -> 1711 | E55: =AVERAGE(RC[7]:RC[9]) -> 1477.6666666666667 | F55: 74657 | G55: =ABS(((RC[-2]*100/RC[-3])-100)*-1) -> 13.637249172024141 | H55: =RC[-4]+(RC[-3]-R[-1]C[-3]) -> 1728.2866666666666 | I55: 1753 | J55: 1730 | K55: 1650 | L55: 1513 | M55: 1482 | N55: 1438
A56: 2020T3 | B56: 128.255 | C56: 16.260000000000002 | D56: =AVERAGE(RC[5]:RC[7]) -> 1718 | E56: =AVERAGE(RC[7]:RC[9]) -> 1369.3333333333333 | F56: 101887 | G56: =ABS(((RC[-2]*100/RC[-3])-100)*-1) -> 20.294916569654646 | H56: =RC[-4]+(RC[-3]-R[-1]C[-3]) -> 1609.6666666666665 | I56: 1677 | J56: 1735 | K56: 1742 | L56: 1443 | M56: 1293 | N56: 1372
A57: 2020T4 | B57: 127.179 | C57: 16.13 | D57: =AVERAGE(RC[5]:RC[7]) -> 1766.6666666666667 | E57: =AVERAGE(RC[7]:RC[9]) -> 1409.6666666666667 | F57: 113367 | G57: =ABS(((RC[-2]*100/RC[-3])-100)*-1) -> 20.207547169811306 | H57: =RC[-4]+(RC[-3]-R[-1]C[-3]) -> 1807.0000000000002 | I57: 1752 | J57: 1769 | K57: 1779 | L57: 1374 | M57: 1393 | N57: 1462
A58: 2021T1 | B58: 127.831 | C58: 15.98 | D58: =AVERAGE(RC[5]:RC[7]) -> 1780.3333333333333 | E58: =AVERAGE(RC[7]:RC[9]) -> 1457.6666666666667 | F58: 130270 | G58: =ABS(((RC[-2]*100/RC[-3])-100)*-1) -> 18.123946826436978 | H58: =RC[-4]+(RC[-3]-R[-1]C[-3]) -> 1828.3333333333333 | I58: 1786 | J58: 1771 | K58: 1784 | L58: 1497 | M58: 1428 | N58: 1448
A59: 2021T2 | B59: 130.9 | C59: 15.26 | D59: =AVERAGE(RC[5]:RC[7]) -> 1805 | E59: =AVERAGE(RC[7]:RC[9]) -> 1500 | F59: 137445 | G59: =ABS(((RC[-2]*100/RC[-3])-100)*-1) -> 16.89750692520775 | H59: =RC[-4]+(RC[-3]-R[-1]C[-3]) -> 1847.3333333333333 | I59: 1794 | J59: 1805 | K59: 1816 | L59: 1479 | M59: 1489 | N59: 1532
A60: 2021T3 | B60: 133.6 | C60: 14.57 | D60: =AVERAGE(RC[5]:RC[7]) -> 1821.3333333333333 | E60: =AVERAGE(RC[7]:RC[9]) -> 1515.6666666666667 | F60: 153552 | G60: =ABS(((RC[-2]*100/RC[-3])-100)*-1) -> 16.782576866764259 | H60: =RC[-4]+(RC[-3]-R[-1]C[-3]) -> 1837 | I60: 1826 | J60: 1825 | K60: 1813 | L60: 1578 | M60: 1430 | N60: 1539
A61: 2021T4 | B61: 135.291 | C61: 13.33 | D61: =AVERAGE(RC[5]:RC[7]) -> 1825.3333333333333 | E61: =AVERAGE(RC[7]:RC[9]) -> 1553 | F61: 144256 | G61: =ABS(((RC[-2]*100/RC[-3])-100)*-1) -> 14.919649379108833 | H61: =RC[-4]+(RC[-3]-R[-1]C[-3]) -> 1862.6666666666665 | I61: 1816 | J61: 1831 | K61: 1829 | L61: 1527 | M61: 1551 | N61: 1581
A62: 2022T1 | B62: 138.74 | C62: 13.65 | D62: =AVERAGE(RC[5]:RC[7]) -> 1821 | E62: =AVERAGE(RC[7]:RC[9]) -> 1617 | F62: 165579 | G62: =ABS(((RC[-2]*100/RC[-3])-100)*-1) -> 11.202635914332788 | H62: =RC[-4]+(RC[-3]-R[-1]C[-3]) -> 1885 | I62: 1824 | J62: 1814 | K62: 1825 | L62: 1651 | M62: 1578 | N62: 1622
A63: 2022T2 | B63: 141.43299999999999 | C63: 12.48 | D63: =AVERAGE(RC[5]:RC[7]) -> 1866 | E63: =AVERAGE(RC[7]:RC[9]) -> 1620.3333333333333 | F63: 165418 | G63: =ABS(((RC[-2]*100/RC[-3])-100)*-1) -> 13.165416220078612 | H63: =RC[-4]+(RC[-3]-R[-1]C[-3]) -> 1869.3333333333333 | I63: 1853 | J63: 1869 | K63: 1876 | L63: 1606 | M63: 1603 | N63: 1652
A64: 2022T3 | C64: 12.67 | D64: =AVERAGE(RC[5]:RC[7]) -> 1892.3333333333333 | F64: 166570 | I64: 1888 | J64: 1896 | K64: 1893
A65: 2022T4 | D65: =AVERAGE(RC[5]:RC[7]) -> 1910 | I65: 1910

Sheet: Notes
A1: Cells in pink imply that the data are past projections.
A2: Cells in red implies that the data is provisional or future projections.